date_time,town,title,price,beds,sqft,url
2022-07-11 15:40, (Dulles Town Center),Come in as a stranger and stay as a neighbor! 2 Bed/2 Bath/1008 SqFt,2312,2,1008.0,https://washingtondc.craigslist.org/nva/apa/d/sterling-come-in-as-stranger-and-stay/7507545271.html
2022-07-11 15:39, (maryland),"Walk-In Closets, Pool, On-Site Management",1755,3,,https://washingtondc.craigslist.org/mld/apa/d/district-heights-walk-in-closets-pool/7500563417.html
2022-07-11 15:37, (northern virginia),"Cozy Clubhouse, Private Patio or Balcony, Hassle-Free Transfer Program",1925,1,693.0,https://washingtondc.craigslist.org/nva/apa/d/fairfax-cozy-clubhouse-private-patio-or/7503466107.html
2022-07-11 15:35, (northern virginia),"Wood Plank Flooring, Fitness Center, Granite Countertops",2117,,574.0,https://washingtondc.craigslist.org/nva/apa/d/arlington-wood-plank-flooring-fitness/7503456384.html
2022-07-11 15:34, (Rockville),A great place to kick back and relax! Beautiful neighborhood!,1804,1,897.0,https://washingtondc.craigslist.org/mld/apa/d/rockville-great-place-to-kick-back-and/7507542465.html
2022-07-11 15:34, (northern virginia),"Swimming Pool, On-Site Management, Public Transportation",2390,2,1182.0,https://washingtondc.craigslist.org/nva/apa/d/herndon-swimming-pool-on-site/7501124154.html
2022-07-11 15:34, (northern virginia),"renovated units available, apply today, self guided tours available",1631,1,586.0,https://washingtondc.craigslist.org/nva/apa/d/alexandria-renovated-units-available/7507542406.html
2022-07-11 15:34, (maryland),"Air conditioner, Dishwasher, Stainless steel appliances, Oak cabinetry",1760,1,818.0,https://washingtondc.craigslist.org/mld/apa/d/germantown-air-conditioner-dishwasher/7507542332.html
2022-07-11 15:33, (northern virginia),"2 Bedroom Townhouse, Access to Neighborhood Pool, Bark Park.",2806,2,980.0,https://washingtondc.craigslist.org/nva/apa/d/springfield-bedroom-townhouse-access-to/7507541760.html
2022-07-11 15:32, (maryland),"Fitness Center, Close to Schools, On-Site Management",1875,2,950.0,https://washingtondc.craigslist.org/mld/apa/d/beltsville-fitness-center-close-to/7507534981.html
2022-07-11 15:31, (purcellville),Hello Horse Lover! This 5-BR/5 FB/92.3 ac farm is yours.,4900,5,,https://washingtondc.craigslist.org/nva/apa/d/purcellville-hello-horse-lover-this-br/7507541112.html
2022-07-11 15:31, (Washington),Modern Living in the Heart of the City!,5262,3,1259.0,https://washingtondc.craigslist.org/doc/apa/d/washington-modern-living-in-the-heart/7507534444.html
2022-07-11 15:31, (Fairfax),"Stylish Features, Cats and Dogs Ok, Ideal Fairfax Location",2500,3,1275.0,https://washingtondc.craigslist.org/nva/apa/d/fairfax-stylish-features-cats-and-dogs/7507540830.html
2022-07-11 15:30," (4740 Bradley Blvd , Chevy Chase, MD)","Great schools, Gas stove, Walk to Bethesda Metro",2025,2,879.0,https://washingtondc.craigslist.org/mld/apa/d/chevy-chase-great-schools-gas-stove/7506797741.html
2022-07-11 15:30, (Adams Morgan),"Move In Now, Leasing Now, Near Metro Stops",3172,2,859.0,https://washingtondc.craigslist.org/doc/apa/d/washington-move-in-now-leasing-now-near/7507522996.html
2022-07-11 15:30, (maryland),"Refreshing Swimming Pool with Sundeck, Impressive Views, Dishwasher",1451,1,756.0,https://washingtondc.craigslist.org/mld/apa/d/bladensburg-refreshing-swimming-pool/7506457352.html
2022-07-11 15:29, (70 I Street SE),Executive conference center,3362,2,1159.0,https://washingtondc.craigslist.org/doc/apa/d/washington-executive-conference-center/7507539760.html
2022-07-11 15:29, (14Th Street Corridor NW),September Sunny & Spacious Studio ~ All Utilities Included!,2095,,,https://washingtondc.craigslist.org/doc/apa/d/washington-september-sunny-spacious/7507538219.html
2022-07-11 15:28, (ROCKVILLE),2 Bedroom 2 Bath Condo Conveniently Located in Rockville,2400,2,1165.0,https://washingtondc.craigslist.org/mld/apa/d/rockville-bedroom-bath-condo/7507539626.html
2022-07-11 15:28, (Near American University),"This gorgeous 1 Bed, 1 Bath will not disappoint. 4115 Wisconsin",1913,1,607.0,https://washingtondc.craigslist.org/doc/apa/d/washington-this-gorgeous-bed-bath-will/7507527634.html
2022-07-11 15:28, (maryland),Live in Style & Luxury at gallery Bethesda!,3244,2,1130.0,https://washingtondc.craigslist.org/mld/apa/d/bethesda-live-in-style-luxury-at/7507539333.html
2022-07-11 15:27, (SILVER SPRING MD),"Harmony Hills Elementary School, Metro Bus at your door, Schools",2133,3,1124.0,https://washingtondc.craigslist.org/mld/apa/d/silver-spring-harmony-hills-elementary/7507527818.html
2022-07-11 15:27, (1215 East West Highway),"Controlled-access garage parking, Modern black appliances",2022,1,807.0,https://washingtondc.craigslist.org/mld/apa/d/silver-spring-controlled-access-garage/7507538729.html
2022-07-11 15:26, (northern virginia),"Controlled Access Community, Spacious Closets, On-Site Maintenance",2115,1,828.0,https://washingtondc.craigslist.org/nva/apa/d/arlington-controlled-access-community/7501499062.html
2022-07-11 15:25, (northern virginia),"Gas Cooking Ranges, Outdoor deck with grilling area, Private Balconies",6156,4,2832.0,https://washingtondc.craigslist.org/nva/apa/d/arlington-gas-cooking-ranges-outdoor/7500573358.html
2022-07-11 15:25, (Herndon),"Convenient Location, Pool with Sundeck, Modern Design",1957,1,714.0,https://washingtondc.craigslist.org/nva/apa/d/convenient-location-pool-with-sundeck/7507537970.html
2022-07-11 15:24, (district of columbia),"Dog Park, Spacious Closets, Non-Smoking Community",1670,1,697.0,https://washingtondc.craigslist.org/doc/apa/d/falls-church-dog-park-spacious-closets/7506759280.html
2022-07-11 15:23, (Rockville),"Electronic Thermostat, Gas Range, Ceiling Fan",2120,2,1120.0,https://washingtondc.craigslist.org/mld/apa/d/rockville-electronic-thermostat-gas/7507536921.html
2022-07-11 15:22, (Adams Morgan),In the Heart of Adams Morgan,2100,,1.0,https://washingtondc.craigslist.org/doc/apa/d/washington-in-the-heart-of-adams-morgan/7507503658.html
2022-07-11 15:22," (4701 Kenmore Avenue , Alexandria, VA)",Live Like You Want. That's Our Anthem! Come in and Tour Today...,2153,2,1100.0,https://washingtondc.craigslist.org/nva/apa/d/alexandria-live-like-you-want-thats-our/7507536657.html
2022-07-11 15:22," (1502 Potomac Ave SE, Washington, DC)",2 bd2 ba981 sqft,1400,2,981.0,https://washingtondc.craigslist.org/doc/apa/d/washington-bd2-ba981-sqft/7507536416.html
2022-07-11 15:22, (district of columbia),"Highly Desired School District, Washer and Dryer, Parking Garage",1634,,447.0,https://washingtondc.craigslist.org/doc/apa/d/arlington-highly-desired-school/7496122382.html
2022-07-11 15:21, (maryland),"Reserved Parking Available, Laundry Facility, Large Walk-In Closets",1565,1,850.0,https://washingtondc.craigslist.org/mld/apa/d/beltsville-reserved-parking-available/7507532692.html
2022-07-11 15:21," (1204 S Washington St, Alexandria, VA)","Patio/Balcony, Move In Guarantee, On-Site Management",1717,1,700.0,https://washingtondc.craigslist.org/nva/apa/d/alexandria-patio-balcony-move-in/7507535755.html
2022-07-11 15:20, (northern virginia),A Higher Quality of Living.,2153,2,1036.0,https://washingtondc.craigslist.org/nva/apa/d/herndon-higher-quality-of-living/7507535689.html
2022-07-11 15:20, (maryland),"High-tech business center, Scenic Zen garden",2674,1,932.0,https://washingtondc.craigslist.org/mld/apa/d/potomac-high-tech-business-center/7507531954.html
2022-07-11 15:20, (northern virginia),"2/bd 2/ba, Dry Cleaning                                                         ",2277,2,1100.0,https://washingtondc.craigslist.org/nva/apa/d/alexandria-bd-ba-dry-cleaning/7505854099.html
2022-07-11 15:19, (maryland),"Package Receiving, Hardwood Flooring, Public Transportation",1485,1,748.0,https://washingtondc.craigslist.org/mld/apa/d/capitol-heights-package-receiving/7501759833.html
2022-07-11 15:18," (1815 Sycamore Valley Drive, Reston, VA)","Spacious Closets; Walk-In Closets, Central Air Conditioning, Clubhouse",2493,3,1033.0,https://washingtondc.craigslist.org/nva/apa/d/reston-spacious-closets-walk-in-closets/7507534579.html
2022-07-11 15:18," (1204 S Washington St, Alexandria, VA)","Granite Countertops, Built-In Microwave, On-Site Management",1504,,405.0,https://washingtondc.craigslist.org/nva/apa/d/alexandria-granite-countertops-built-in/7502689759.html
2022-07-11 15:18, (northern virginia),Love Where You Live.,2383,2,1289.0,https://washingtondc.craigslist.org/nva/apa/d/herndon-love-where-you-live/7507534261.html
2022-07-11 15:18, (northern virginia),"Smart home package, PackageReceiving, Pantry, Dog wash station",2331,1,847.0,https://washingtondc.craigslist.org/nva/apa/d/alexandria-smart-home-package/7507534167.html
2022-07-11 15:16, (district of columbia),"Move In Now, Newly Renovated, Laundry in Unit",2450,1,600.0,https://washingtondc.craigslist.org/doc/apa/d/washington-move-in-now-newly-renovated/7507522465.html
2022-07-11 15:16, (Harrisonburg),Still looking for Off Campus Housing at JMU?  The Fox has you covered!,485,1,,https://washingtondc.craigslist.org/nva/apa/d/harrisonburg-still-looking-for-off/7507533401.html
2022-07-11 15:16, (district of columbia),"Contact us Today, Pets Welcome, Newly Renovated",2450,1,600.0,https://washingtondc.craigslist.org/doc/apa/d/washington-contact-us-today-pets/7507503314.html
2022-07-11 15:15," (Foxhall-Palisades/Washington, DC)","Award-winning, large Sears home(Lovingly renovated). Move in Today",2212,4,3362.0,https://washingtondc.craigslist.org/doc/apa/d/washington-award-winning-large-sears/7507501878.html
2022-07-11 15:15, (district of columbia),"On-Site Management, Elevator, Microwave",2573,1,936.0,https://washingtondc.craigslist.org/doc/apa/d/washington-on-site-management-elevator/7504879640.html
2022-07-11 15:15, (Logan and Dupont Circle),"Near Parks and Shopping, Ideal Location, Large Windows",2085,,500.0,https://washingtondc.craigslist.org/doc/apa/d/parcel-return-service-near-parks-and/7507532693.html
2022-07-11 15:14," (5901 Coverdale Way Alexandria, VA)",One Bedroom + Study! Alexandria!!,2040,1,886.0,https://washingtondc.craigslist.org/nva/apa/d/one-bedroom-study-alexandria/7507532637.html
2022-07-11 15:14," (1265 Elden Street, Herndon, VA)","Walking Distance to Dog Park, Oversized Closets, Flexible Lease Terms",2531,2,830.0,https://washingtondc.craigslist.org/nva/apa/d/herndon-walking-distance-to-dog-park/7507532595.html
2022-07-11 15:14, (district of columbia),$1280.00 Bright and airy condo in Logan Circle,1280,1,632.0,https://washingtondc.craigslist.org/doc/apa/d/washington-bright-and-airy-condo-in/7507518854.html
2022-07-11 15:13," (5901 Coverdale Way Alexandria, VA)",Quarantine & Keep Your Hands Clean... in a New HOME!,1945,1,788.0,https://washingtondc.craigslist.org/nva/apa/d/quarantine-keep-your-hands-clean-in-new/7507532058.html
2022-07-11 15:13," (5901 Coverdale Way Alexandria, VA)",Gorgeous 2 Bed/2 Full Bath on Top Floor!!.. Washer and Dryer in Unit,2580,2,990.0,https://washingtondc.craigslist.org/nva/apa/d/gorgeous-bed-full-bath-on-top-floor/7507531764.html
2022-07-11 15:12, (Sterling),"Leasing Now, Car Wash Area, Close to Tysons Corner",2025,2,905.0,https://washingtondc.craigslist.org/nva/apa/d/sterling-leasing-now-car-wash-area/7507531516.html
2022-07-11 15:12, (district of columbia),"Efficient Appliances, Electronic Thermostat, Separate Dining Room",2015,1,870.0,https://washingtondc.craigslist.org/doc/apa/d/rockville-efficient-appliances/7502185238.html
2022-07-11 15:12, (maryland),"Patio/Balcony, Air Conditioner, Playground On-Site",1695,2,,https://washingtondc.craigslist.org/mld/apa/d/district-heights-patio-balcony-air/7504853306.html
2022-07-11 15:11, (district of columbia),"BEAUTIFUL TOWNHOME MASTER DOWNSTAIRS, COME SEE VERY PRETTY!",999,2,,https://washingtondc.craigslist.org/doc/apa/d/washington-beautiful-townhome-master/7507519214.html
2022-07-11 15:11, (Logan Circle),"studio fully furnished, all utilities included, perfect location",1785,,410.0,https://washingtondc.craigslist.org/doc/apa/d/washington-studio-fully-furnished-all/7507530805.html
2022-07-11 15:10, (Connecticut Ave),"Bright, Beautiful 625 sq ft 1 bed, 1 bath in Washington now showing!",1960,1,625.0,https://washingtondc.craigslist.org/doc/apa/d/washington-bright-beautiful-625-sq-ft/7507530466.html
2022-07-11 15:10, (Alexandria),"Stylish Features, Easy Freeway Access, Laundry Care Center",1910,2,815.0,https://washingtondc.craigslist.org/nva/apa/d/alexandria-stylish-features-easy/7507530139.html
2022-07-11 15:09, (Vienna),Gorgeous remodeled 866 sq ft 1 bed / 1 bath at Lerner Arrowood Parc!,1948,1,866.0,https://washingtondc.craigslist.org/nva/apa/d/vienna-gorgeous-remodeled-866-sq-ft-bed/7496790318.html
2022-07-11 15:09, (Minutes to Vienna Metro Station),"What a great place to live! 1 bd, 1 ba, 866 sq ft. Come home today!",1970,1,866.0,https://washingtondc.craigslist.org/nva/apa/d/vienna-what-great-place-to-live-bd-ba/7502605093.html
2022-07-11 15:08, (Columbia Heights),Lower Level One Bedroom In Great Columbia Heights Location,1550,1,525.0,https://washingtondc.craigslist.org/doc/apa/d/washington-lower-level-one-bedroom-in/7507529432.html
2022-07-11 15:08, (6340 Wingate St),Apto de 2 cuartos con laundry adentro,1982,2,920.0,https://washingtondc.craigslist.org/nva/apa/d/alexandria-apto-de-cuartos-con-laundry/7507529262.html
2022-07-11 15:08," (Capitol Hill, DC)",Welcome To Your New Home #416 In Capitol Hill,2399,1,,https://washingtondc.craigslist.org/doc/apa/d/washington-welcome-to-your-new-home-416/7507529220.html
2022-07-11 15:08, (northern virginia),Discover Woodland Apartment Living.,1891,1,832.0,https://washingtondc.craigslist.org/nva/apa/d/herndon-discover-woodland-apartment/7506759935.html
2022-07-11 15:08, (Cathedral Heights),Idaho Terrace. Studio 362 Sq Ft,1545,,362.0,https://washingtondc.craigslist.org/doc/apa/d/washington-idaho-terrace-studio-362-sq/7507529174.html
2022-07-11 15:08," (Northeast DC, Near Langston Golf Course)","Stylish Features, Community Garden, Near Langston Golf Course",1295,2,650.0,https://washingtondc.craigslist.org/doc/apa/d/washington-stylish-features-community/7507529163.html
2022-07-11 15:08," (7131 Silver Lake Blvd., Alexandria, VA)","Dishwasher, Dog Park, Disability Access",1451,2,803.0,https://washingtondc.craigslist.org/nva/apa/d/alexandria-dishwasher-dog-park/7507529046.html
2022-07-11 15:08, (Minutes to Vienna Metro Station),"Wonderful amenities, spacious floorplans, and washer/dryer in unit!",1868,1,868.0,https://washingtondc.craigslist.org/nva/apa/d/vienna-wonderful-amenities-spacious/7507528960.html
2022-07-11 15:07, (Friendship Heights Metro),"874 sq ft 2 bd, 1 ba available today. Call us now!",2768,2,874.0,https://washingtondc.craigslist.org/doc/apa/d/washington-874-sq-ft-bd-ba-available/7507528839.html
2022-07-11 15:07, (SILVER SPRING MD),"Schools, Updated Appliances, Wall to wall carpeting",1445,1,700.0,https://washingtondc.craigslist.org/mld/apa/d/silver-spring-schools-updated/7496144990.html
2022-07-11 15:07," (1301 15th Street Northwest, Washington, DC)","Resident Payments via Online Portal Available, Parquet Floors, Sundeck",1749,1,447.0,https://washingtondc.craigslist.org/doc/apa/d/washington-resident-payments-via-online/7505448272.html
2022-07-11 15:06," (4701 Kenmore Avenue, Alexandria, VA)",3br - Great Size for an even GREATER PRICE. Don't miss out!,2687,3,1270.0,https://washingtondc.craigslist.org/nva/apa/d/alexandria-3br-great-size-for-an-even/7501817127.html
2022-07-11 15:03, (northern virginia),"Upgraded Suite, Refrigerator, Swimming Pool",1480,,,https://washingtondc.craigslist.org/nva/apa/d/falls-church-upgraded-suite/7501747537.html
2022-07-11 15:03, (Fairfax),"Complimentary Shuttle to Vienna Metro, Sparkling Pool, Business Center",2357,2,1059.0,https://washingtondc.craigslist.org/nva/apa/d/fairfax-complimentary-shuttle-to-vienna/7496156257.html
2022-07-11 15:01, (Chevy Chase),"Immediate 1 bed, 1 bath move-in available at The Livingston",1960,1,625.0,https://washingtondc.craigslist.org/doc/apa/d/washington-immediate-bed-bath-move-in/7507525389.html
2022-07-11 15:00, (maryland),"Newly Renovated Business Center, Business Center, ½ mile to 495",1875,2,950.0,https://washingtondc.craigslist.org/mld/apa/d/beltsville-newly-renovated-business/7507515253.html
2022-07-11 15:00, (northern virginia),"Close to Schools, Air Conditioner, Carpeting",1690,1,,https://washingtondc.craigslist.org/nva/apa/d/falls-church-close-to-schools-air/7507524960.html
2022-07-11 14:59, (Green Park),"Great 1 Bed, 1 Bath floor plans at Residences at Rio",2190,1,796.0,https://washingtondc.craigslist.org/mld/apa/d/gaithersburg-great-bed-bath-floor-plans/7507503134.html
2022-07-11 14:59, (northern virginia),"Fully equipped kitchens, Sparkling Swimming Pool, On-Call Maintenance",1862,2,950.0,https://washingtondc.craigslist.org/nva/apa/d/annandale-fully-equipped-kitchens/7505028985.html
2022-07-11 14:58, (Alexandria),Sunny Spacious Panoramic Views,1600,1,760.0,https://washingtondc.craigslist.org/nva/apa/d/alexandria-sunny-spacious-panoramic/7507524088.html
2022-07-11 14:57, (northern virginia),"1/bd, Free Open Surface Parking, 2 24-Hour Fitness Centers",2007,1,,https://washingtondc.craigslist.org/nva/apa/d/woodbridge-bd-free-open-surface-parking/7505486993.html
2022-07-11 14:57, (northern virginia),"Upgraded Appliance Package, Capital Bike Share, In Arlington",1941,1,609.0,https://washingtondc.craigslist.org/nva/apa/d/arlington-upgraded-appliance-package/7504878082.html
2022-07-11 14:57, (TGM Sudley Crossing),Affordable living! Wonderful floor plans!!!,1880,1,979.0,https://washingtondc.craigslist.org/nva/apa/d/manassas-affordable-living-wonderful/7507523224.html
2022-07-11 14:56," (1265 Elden Street, Herndon, VA)","Resident Activities, Walking Distance to Dog Park, Pre-installed Wi-Fi",2655,1,720.0,https://washingtondc.craigslist.org/nva/apa/d/herndon-resident-activities-walking/7506763419.html
2022-07-11 14:56, (TGM Sudley Crossing),Affordable living! Wonderful floor plans!!!,1880,1,979.0,https://washingtondc.craigslist.org/nva/apa/d/manassas-affordable-living-wonderful/7507523102.html
2022-07-11 14:56, (TGM Sudley Crossing),"Experience the better lifestyle, Lease today!!!",1700,1,727.0,https://washingtondc.craigslist.org/nva/apa/d/manassas-experience-the-better/7507522823.html
2022-07-11 14:56, (TGM Sudley Crossing),"Experience the better lifestyle, Lease today!!!",1700,1,727.0,https://washingtondc.craigslist.org/nva/apa/d/manassas-experience-the-better/7507522663.html
2022-07-11 14:55, (TGM Sudley Crossing),Lease today!!!,1700,1,727.0,https://washingtondc.craigslist.org/nva/apa/d/manassas-lease-today/7507522211.html
2022-07-11 14:54, (district of columbia),"Short-term Leases Available, 24-hour On-site Maintenance, Tile Floors",2380,1,794.0,https://washingtondc.craigslist.org/doc/apa/d/arlington-short-term-leases-available/7505017075.html
2022-07-11 14:54, (Navy Yard),1 Bedroom 1 Bath – Short Term Lease (09/01/2022 – 02/02/2023),3000,1,,https://washingtondc.craigslist.org/doc/apa/d/washington-bedroom-bath-short-term/7507521950.html
2022-07-11 14:54, (Chevy Chase Pavilion),2 Bed / 1 Bath available at Legation House. Pets Welcome!,2768,2,874.0,https://washingtondc.craigslist.org/doc/apa/d/washington-bed-bath-available-at/7507521806.html
2022-07-11 14:54, (Falls Church / Merrifield),Basement- UTILITIES/INTERNET Included- Private Kitchen/Bath/Laundry,1350,1,500.0,https://washingtondc.craigslist.org/nva/apa/d/merrifield-basement-utilities-internet/7503671226.html
2022-07-11 14:53, (Suitland),"Modern and Well Managed, 5 Minute Walk to Suitland Metro",1371,1,800.0,https://washingtondc.craigslist.org/mld/apa/d/suitland-modern-and-well-managed-minute/7507521460.html
2022-07-11 14:53, (TGM Sudley Crossing),"Hello, Summer Savings, rent with TGM Sudley Crossing!",1735,1,727.0,https://washingtondc.craigslist.org/nva/apa/d/manassas-hello-summer-savings-rent-with/7507521106.html
2022-07-11 14:52," (Washington, DC)",Last 2 Bedroom at this price! Rent it TODAY before prices go up!,2247,2,663.0,https://washingtondc.craigslist.org/doc/apa/d/washington-last-bedroom-at-this-price/7507520972.html
2022-07-11 14:52, (district of columbia),"On-Site Maintenance, Availability 24 Hours, Disability Access",4974,2,1864.0,https://washingtondc.craigslist.org/doc/apa/d/washington-on-site-maintenance/7507520426.html
2022-07-11 14:51, (district of columbia),Large Two bedroom Two bath,1742,2,1115.0,https://washingtondc.craigslist.org/doc/apa/d/bladensburg-large-two-bedroom-two-bath/7504034207.html
2022-07-11 14:51, (northern virginia),Welcoming lobby & game room with a pool table!,2550,2,1108.0,https://washingtondc.craigslist.org/nva/apa/d/falls-church-welcoming-lobby-game-room/7505832629.html
2022-07-11 14:50, (Capitol Heights),"Stylish Features, Swimming Pool, Minutes to Addison Metro",1754,3,943.0,https://washingtondc.craigslist.org/doc/apa/d/capitol-heights-stylish-features/7507519762.html
2022-07-11 14:50, (Gaithersburg),"Playground, Close to Shops and Dining, Walk In Closets",1680,1,780.0,https://washingtondc.craigslist.org/mld/apa/d/gaithersburg-playground-close-to-shops/7507519522.html
2022-07-11 14:49, (Alexandria),"Professionally Managed, Storage, Close to Shops and Dining",2949,2,1141.0,https://washingtondc.craigslist.org/nva/apa/d/alexandria-professionally-managed/7507519279.html
2022-07-11 14:49, (Near excellent shops),Fantastic Studio! Wonderful community at Connecticut Gardens,1940,,402.0,https://washingtondc.craigslist.org/doc/apa/d/washington-fantastic-studio-wonderful/7507519080.html
2022-07-11 14:49, (Old Town Alexandria),"Don't wait! This spacious 1 bed, 1 bath will go fast! 854 Sq Ft!",1504,1,854.0,https://washingtondc.craigslist.org/nva/apa/d/alexandria-dont-wait-this-spacious-bed/7507518731.html
2022-07-11 14:48, (Near Wheaton),"Granite Countertops, Cable Ready, Air Conditioning",1790,2,1135.0,https://washingtondc.craigslist.org/mld/apa/d/silver-spring-granite-countertops-cable/7496237911.html
2022-07-11 14:48," (Washington, DC)","Takoma-DC - 6911 8th St NW - 4BD, 4BA & 2,385 sq ft Home for Rent.",1425,4,,https://washingtondc.craigslist.org/doc/apa/d/washington-takoma-dc-th-st-nw-4bd-4ba/7502152422.html
2022-07-11 14:48," (20155 San Joaquin Terrace, Washington, DC)","Built-in USB Ports, Hardwood Floors, Newly Renovated Apartment Homes",2874,3,1365.0,https://washingtondc.craigslist.org/nva/apa/d/ashburn-built-in-usb-ports-hardwood/7506733514.html
2022-07-11 14:48," (2844 Northampton St NW, Washington, DC)","Space, light, and convenience in Chevy Chase! 4 bedroom & 2.5 bath",1461,4,2115.0,https://washingtondc.craigslist.org/doc/apa/d/washington-space-light-and-convenience/7502150872.html
2022-07-11 14:48, (maryland),"High-speed WiFi Internet available, Walk-in Closets, Spa/Hot Tub",2564,1,1134.0,https://washingtondc.craigslist.org/mld/apa/d/rockville-high-speed-wifi-internet/7505869323.html
2022-07-11 14:47," (5102 Yuma St NW, Washington, DC)","Spring Valley - over 4000 sf of home on a flat, almost 10,000 sf lot",2450,4,3925.0,https://washingtondc.craigslist.org/doc/apa/d/washington-spring-valley-over-4000-sf/7507499920.html
2022-07-11 14:46, (Washington),"Near Metro, Balcony, Leasing Now",2199,1,619.0,https://washingtondc.craigslist.org/doc/apa/d/washington-near-metro-balcony-leasing/7507506946.html
2022-07-11 14:46, (district of columbia),"Resident Controlled Heat & Air Conditioning, Gas Cooking, Ceiling Fans",1997,1,740.0,https://washingtondc.craigslist.org/doc/apa/d/washington-resident-controlled-heat-air/7505861079.html
2022-07-11 14:44, (northern virginia),"24-Hour Fitness Studio, Only available in select apartments, Java Bar",2468,2,1280.0,https://washingtondc.craigslist.org/nva/apa/d/fairfax-24-hour-fitness-studio-only/7507516523.html
2022-07-11 14:44, (Woodbridge),"Leasing Now, Spacious Lounge, Mail Room",1945,1,739.0,https://washingtondc.craigslist.org/nva/apa/d/woodbridge-leasing-now-spacious-lounge/7507516224.html
2022-07-11 14:43, (Petworth Location),"Perfect 1 bed, 1 bath just for you! Rent today at Park Place at Petworth Metro",2360,1,673.0,https://washingtondc.craigslist.org/doc/apa/d/washington-perfect-bed-bath-just-for/7507516005.html
2022-07-11 14:43, (northern virginia),"Resident Events, Pet Friendly. See Pet Policy, Balcony Or Patio",1644,1,730.0,https://washingtondc.craigslist.org/nva/apa/d/leesburg-resident-events-pet-friendly/7506766801.html
2022-07-11 14:43," (7131 Silver Lake Blvd., Alexandria, VA)","Cable & Satellite Ready, Community Garden, Extra Storage",1771,2,803.0,https://washingtondc.craigslist.org/nva/apa/d/alexandria-cable-satellite-ready/7504928883.html
2022-07-11 14:43, (Ashburn),"Perfect Location, On Site Retail, Controlled  Access",2382,2,1050.0,https://washingtondc.craigslist.org/nva/apa/d/ashburn-perfect-location-on-site-retail/7507515384.html
2022-07-11 14:42, (maryland),"Planked Flooring (in select apts), Fitness Center, Laundry Facility",1875,2,950.0,https://washingtondc.craigslist.org/mld/apa/d/beltsville-planked-flooring-in-select/7506296093.html
2022-07-11 14:41, (TGM Sudley Crossing),Don’t wait. Get Your Dream Apartment Today!,1730,1,727.0,https://washingtondc.craigslist.org/nva/apa/d/manassas-dont-wait-get-your-dream/7507515007.html
2022-07-11 14:41, (district of columbia),"Rich Wood Cabinetry, Non-Smoking Community, Outdoor Grilling Stations",2975,3,1100.0,https://washingtondc.craigslist.org/doc/apa/d/falls-church-rich-wood-cabinetry-non/7503557584.html
2022-07-11 14:41, (Adams Morgan),"Chefs Kitchen, Near Metro Stops, Clothes Care Center",3172,2,859.0,https://washingtondc.craigslist.org/doc/apa/d/washington-chefs-kitchen-near-metro/7507504592.html
2022-07-11 14:41, (Herndon),"Come Look and Lease, Yoga Studio, Laundry in Unit",2207,2,1059.0,https://washingtondc.craigslist.org/nva/apa/d/herndon-come-look-and-lease-yoga-studio/7507514798.html
