date_time,town,title,price,beds,sqft,url
2022-07-12 13:16, (TGM Sudley Crossing),"Hello, Summer Savings, rent with TGM Sudley Crossing!",1700,1,727.0,https://washingtondc.craigslist.org/nva/apa/d/manassas-hello-summer-savings-rent-with/7507891362.html
2022-07-12 13:15, (TGM Sudley Crossing),Schedule A Unique Tour Today Rent Today! Call Now!,1850,2,906.0,https://washingtondc.craigslist.org/nva/apa/d/manassas-schedule-unique-tour-today/7507891225.html
2022-07-12 13:15, (district of columbia),"LuxerOne Package Lockers, High-End Italian Inspired Finishes",2870,1,895.0,https://washingtondc.craigslist.org/doc/apa/d/parcel-return-service-luxerone-package/7507866892.html
2022-07-12 13:15," (4701 Kenmore Avenue, Alexandria, VA)",This Studio has AMAZING Storage and a Penthouse View.,1397,,560.0,https://washingtondc.craigslist.org/nva/apa/d/alexandria-this-studio-has-amazing/7503077619.html
2022-07-12 13:15, (TGM Sudley Crossing),Live at the Center of Modern Livings Here At TGM Sudley Crossing!,1850,2,906.0,https://washingtondc.craigslist.org/nva/apa/d/manassas-live-at-the-center-of-modern/7507891113.html
2022-07-12 13:15, (TGM Sudley Crossing),Affordable living! Wonderful floor plans!!!,1880,1,979.0,https://washingtondc.craigslist.org/nva/apa/d/manassas-affordable-living-wonderful/7507890950.html
2022-07-12 13:14, (Herndon),"Porcelain tile bathroom flooring, Foosball tables, Grilling areas",1935,1,762.0,https://washingtondc.craigslist.org/nva/apa/d/dulles-porcelain-tile-bathroom-flooring/7507890847.html
2022-07-12 13:14, (district of columbia),"Business Center, Public Transportation, Free Weights",2625,1,797.0,https://washingtondc.craigslist.org/doc/apa/d/washington-business-center-public/7507890663.html
2022-07-12 13:14," (916 Beacon Square Court Gaithersburg, MD)",$500 off First Month's Rent! Upgraded 1 Bedroom Apt Available Soon!,2055,1,730.0,https://washingtondc.craigslist.org/mld/apa/d/gaithersburg-500-off-first-months-rent/7507890402.html
2022-07-12 13:13, (northern virginia),Always Fresh. Forever Original.,1891,1,832.0,https://washingtondc.craigslist.org/nva/apa/d/herndon-always-fresh-forever-original/7507890313.html
2022-07-12 13:13, (Reston),"Just what you wanted! A great 2 bed, 1.5 bath in Reston",1920,2,977.0,https://washingtondc.craigslist.org/nva/apa/d/reston-just-what-you-wanted-great-bed/7507889906.html
2022-07-12 13:12," (4701 Kenmore Avenue, Alexandria, VA)",You Do Have a Chance at Getting Your Dream Home. LEASE TODAY.,1985,2,1020.0,https://washingtondc.craigslist.org/nva/apa/d/alexandria-you-do-have-chance-at/7507889632.html
2022-07-12 13:12, (district of columbia),"Dual Sink Vanities in Master Bathroom, Non-Smoking Community, Pet Spa",2620,1,1008.0,https://washingtondc.craigslist.org/doc/apa/d/washington-dual-sink-vanities-in-master/7495990569.html
2022-07-12 13:12, (Union Market),"Built-in linen closets*, Property management and services by Bozzuto",2799,1,623.0,https://washingtondc.craigslist.org/doc/apa/d/washington-built-in-linen-closets/7507889303.html
2022-07-12 13:11," (6100 Lincolnia Road Alexandria, VA)",Newly Renovated 1Bed/Bath Available Now Leasing,2116,1,729.0,https://washingtondc.craigslist.org/nva/apa/d/alexandria-newly-renovated-1bed-bath/7507888807.html
2022-07-12 13:11, (near Howard Town),"374 Sq Ft, Studio apt ready to show! Highview & Castle Manor",1700,,374.0,https://washingtondc.craigslist.org/doc/apa/d/washington-374-sq-ft-studio-apt-ready/7507879815.html
2022-07-12 13:10, (district of columbia),"Bike Racks, Elevator, Clubhouse",1902,,648.0,https://washingtondc.craigslist.org/doc/apa/d/washington-bike-racks-elevator-clubhouse/7506213663.html
2022-07-12 13:10, (maryland),"Upgraded Bathrooms, Dishwasher, Patio/Balcony",1575,2,,https://washingtondc.craigslist.org/mld/apa/d/district-heights-upgraded-bathrooms/7500723980.html
2022-07-12 13:10, (Shaw NW),Studio in Shaw | 🚊Steps to Metro | ⚡Utilities Incl.,1600,,400.0,https://washingtondc.craigslist.org/doc/apa/d/washington-studio-in-shaw-steps-to/7506789919.html
2022-07-12 13:10, (Manassas Park),"Club House, Bluetooth Shower-heads, Disposal, Elevator",1669,1,748.0,https://washingtondc.craigslist.org/nva/apa/d/manassas-club-house-bluetooth-shower/7507888271.html
2022-07-12 13:09," (20155 San Joaquin Terrace, Ashburn, VA)","Pet Wash Station, Built-in USB Ports, Vaulted Ceilings",2293,1,1016.0,https://washingtondc.craigslist.org/nva/apa/d/ashburn-pet-wash-station-built-in-usb/7503077225.html
2022-07-12 13:08," (1204 S Washington St, Alexandria, VA)","Bicycle Storage, Short Term Lease, Built-In Microwave",1631,,500.0,https://washingtondc.craigslist.org/nva/apa/d/alexandria-bicycle-storage-short-term/7507887387.html
2022-07-12 13:08, (Woodbridge),Check out our 1 bed / 1 bath. Every convenience your heart desires!,1670,1,683.0,https://washingtondc.craigslist.org/nva/apa/d/woodbridge-check-out-our-bed-bath-every/7507887287.html
2022-07-12 13:07, (District Heights),"Designer Cabinets & Countertops, Air Conditioning, Patios*, Dog Park",1433,2,921.0,https://washingtondc.craigslist.org/mld/apa/d/district-heights-designer-cabinets/7507886889.html
2022-07-12 13:06, (Manassas),A picture is worth a thousand words! Check this 2 bed 2 bath out!,1940,2,1084.0,https://washingtondc.craigslist.org/nva/apa/d/manassas-picture-is-worth-thousand/7507886452.html
2022-07-12 13:06," (215 C Street, SE Washington, DC)",Come Check Us Out At 215 Cst Offering All Utilities Included,1711,,420.0,https://washingtondc.craigslist.org/doc/apa/d/washington-come-check-us-out-at-215-cst/7507886402.html
2022-07-12 13:06, (District Heights),"Designer Cabinets & Countertops, Business Center, Clubhouse",1617,3,1169.0,https://washingtondc.craigslist.org/mld/apa/d/district-heights-designer-cabinets/7507886126.html
2022-07-12 13:05, (SILVER SPRING MD),"Harmony Hills Elementary School, Generous living spaces, Swimming Pool",1740,2,950.0,https://washingtondc.craigslist.org/mld/apa/d/silver-spring-harmony-hills-elementary/7496945930.html
2022-07-12 13:05," (Dulles, Ashburn)",Check out this deal! Amazing 2 Bed 2 Bath in Sterling,2268,2,1186.0,https://washingtondc.craigslist.org/nva/apa/d/sterling-check-out-this-deal-amazing/7507885745.html
2022-07-12 13:05, (maryland),"Hardwood Flooring, Emergency Maintenance, Close to Schools",1290,1,,https://washingtondc.craigslist.org/mld/apa/d/brentwood-hardwood-flooring-emergency/7501968464.html
2022-07-12 13:04, (Silver Spring),2 bed 1 bath ready to view now! Visit Amherst Square today!,1515,2,971.0,https://washingtondc.craigslist.org/mld/apa/d/silver-spring-bed-bath-ready-to-view/7507885312.html
2022-07-12 13:04, (northern virginia),"Easy access to route 50 and i-395, Washer and Dryer, Private Balconies",5361,3,1635.0,https://washingtondc.craigslist.org/nva/apa/d/arlington-easy-access-to-route-50-and/7507885242.html
2022-07-12 13:02," (Potomac Falls, Leesburg)",Relax in your new home! Beautiful resort style 1 bed / 1 bath!,1866,1,741.0,https://washingtondc.craigslist.org/nva/apa/d/sterling-relax-in-your-new-home/7507884122.html
2022-07-12 13:02, (district of columbia),"Private Balcony/Patio, Non-Smoking Community, Dog Park",1670,1,697.0,https://washingtondc.craigslist.org/doc/apa/d/falls-church-private-balcony-patio-non/7507883939.html
2022-07-12 13:01," (4201 Mass Ave. NW Washington, DC)",1 BD/BATH AVAILBLE NOW. BEST LOCATION AND METRO FRIENDLY! CAL NOW,2232,1,800.0,https://washingtondc.craigslist.org/doc/apa/d/washington-bd-bath-availble-now-best/7507877891.html
2022-07-12 13:01, (Arlington),"Modern, fully equipped 2 BDR in great neighborhood!",2995,2,1010.0,https://washingtondc.craigslist.org/nva/apa/d/arlington-modern-fully-equipped-bdr-in/7505573313.html
2022-07-12 13:00, (Laurel),1 Bedroom Apartment in a beautiful community,1975,1,668.0,https://washingtondc.craigslist.org/mld/apa/d/laurel-bedroom-apartment-in-beautiful/7507883087.html
2022-07-12 13:00," (9220 Old Lantern Way, Laurel, MD)","GOFit Fitness Center, Playground, 2 Swimming Pools",1464,1,664.0,https://washingtondc.craigslist.org/doc/apa/d/laurel-gofit-fitness-center-playground/7505414117.html
2022-07-12 12:59, (Arlington),"At Last, This Is What You’ve Been Searching For",1650,1,730.0,https://washingtondc.craigslist.org/nva/apa/d/arlington-at-last-this-is-what-youve/7507882405.html
2022-07-12 12:58, (northern virginia),Life is better here.,1891,1,832.0,https://washingtondc.craigslist.org/nva/apa/d/herndon-life-is-better-here/7506202663.html
2022-07-12 12:58, (district of columbia),Nice Spectacular 2 Bedroom Apartment Available,939,2,1532.0,https://washingtondc.craigslist.org/doc/apa/d/washington-nice-spectacular-bedroom/7507881801.html
2022-07-12 12:57, (Cleveland Park),"Dry Cleaning Services, Ideal Location, Contact us Today",1650,,315.0,https://washingtondc.craigslist.org/doc/apa/d/washington-dry-cleaning-services-ideal/7507863295.html
2022-07-12 12:56, (Laurel),We Have What You Need,1250,1,720.0,https://washingtondc.craigslist.org/mld/apa/d/laurel-we-have-what-you-need/7507880878.html
2022-07-12 12:56, (Germantown),Put a smile on your face! You've just found the right place!,3052,3,1408.0,https://washingtondc.craigslist.org/mld/apa/d/germantown-put-smile-on-your-face-youve/7507880823.html
2022-07-12 12:55," (Falls Church, VA)","A sparkling resort-style pool, Game Room with Pool Table, Cats welcome",2250,2,1108.0,https://washingtondc.craigslist.org/nva/apa/d/falls-church-sparkling-resort-style/7503899522.html
2022-07-12 12:55, (Navy Yard),"Maple-wood cabinetry, Rooftop swimming pool and sundeck",2632,1,881.0,https://washingtondc.craigslist.org/doc/apa/d/washington-maple-wood-cabinetry-rooftop/7507880310.html
2022-07-12 12:55, (district of columbia),"Generously Sized Floor Plans, Oversized Walk-In Closets, Gas Range",2200,2,939.0,https://washingtondc.craigslist.org/doc/apa/d/washington-generously-sized-floor-plans/7504885745.html
2022-07-12 12:54, (Germantown),Why settle for remodeled? Live in a sparkling new 2 BD / 2 BA!,2200,2,1137.0,https://washingtondc.craigslist.org/mld/apa/d/germantown-why-settle-for-remodeled/7507880222.html
2022-07-12 12:54," (4201 Mass Ave. NW Washington, DC)",IDEAL LOCATION IN THE CENTER OF DC! 1 MONTH FREE...,3069,2,1000.0,https://washingtondc.craigslist.org/doc/apa/d/washington-ideal-location-in-the-center/7507880040.html
2022-07-12 12:54, (maryland),"Laundry Facility, Close to Schools, Close to Shopping",1875,2,950.0,https://washingtondc.craigslist.org/mld/apa/d/beltsville-laundry-facility-close-to/7507879996.html
2022-07-12 12:54, (Fort Totten),1-BEDROOM AVAILABLE NOW (5132),1690,1,651.0,https://washingtondc.craigslist.org/doc/apa/d/washington-bedroom-available-now-5132/7505787496.html
2022-07-12 12:53, (Germantown),Come home to Lerner Black Hill Apartments! Washer/dryer in unit. Tour,2446,2,1256.0,https://washingtondc.craigslist.org/mld/apa/d/germantown-come-home-to-lerner-black/7507879731.html
2022-07-12 12:53, (Fort Totten),TWO BEDROOM AVAILABLE (3134) FORT TOTTEN,2250,2,761.0,https://washingtondc.craigslist.org/doc/apa/d/washington-two-bedroom-available-3134/7505789798.html
2022-07-12 12:53, (Near the National Zoo),Gorgeous 932 sq ft 1 bed / 2 bath - Prime location in Washington,2815,1,932.0,https://washingtondc.craigslist.org/doc/apa/d/washington-gorgeous-932-sq-ft-bed-bath/7507874425.html
2022-07-12 12:53," (1507 Ray Road, Hyattsville, MD)","Utilities Paid, Beautifully landscaped grounds, Air Conditioning",1300,1,749.0,https://washingtondc.craigslist.org/mld/apa/d/hyattsville-utilities-paid-beautifully/7499296006.html
2022-07-12 12:53, (Fort Totten),1-BEDROOM AVAILABLE (5132) Now!,1690,1,651.0,https://washingtondc.craigslist.org/doc/apa/d/washington-bedroom-available-5132-now/7505790374.html
2022-07-12 12:53, (Fort Totten),TWO BEDROOM AVAILABLE AUGUST (3134) FORT TOTTEN,2250,2,761.0,https://washingtondc.craigslist.org/doc/apa/d/washington-two-bedroom-available-august/7505791496.html
2022-07-12 12:51, (Fort Totten),1- BEDROOM AVAILABLE (0022) SEPTEMBER 20!,1815,1,651.0,https://washingtondc.craigslist.org/doc/apa/d/washington-bedroom-available-0022/7505793636.html
2022-07-12 12:50, (Fort Totten),1- BEDROOM AVAILABLE NOW (0022) SEPTEMBER,1815,1,651.0,https://washingtondc.craigslist.org/doc/apa/d/washington-bedroom-available-now-0022/7505794361.html
2022-07-12 12:50, (Near Wheaton),Waived Fees     Apply Now While You Can!  Newly Renovated Apts!!!!,1990,2,1135.0,https://washingtondc.craigslist.org/doc/apa/d/silver-spring-waived-fees-apply-now/7507877983.html
2022-07-12 12:49," (2100 Brooks Dr Forestville, MD)",Don't miss out on this Studio APPLY NOW! Ask Diamond!!!,1209,,570.0,https://washingtondc.craigslist.org/mld/apa/d/district-heights-dont-miss-out-on-this/7505991708.html
2022-07-12 12:49, (maryland),"Additional Storage, Gated Electronic Entrance, In-Home Washer/Dryer",2094,1,859.0,https://washingtondc.craigslist.org/mld/apa/d/rockville-additional-storage-gated/7506021894.html
2022-07-12 12:49, (northern virginia),"Central Heat and AC, Private Balconies, Washer and Dryer",3647,2,1188.0,https://washingtondc.craigslist.org/nva/apa/d/arlington-central-heat-and-ac-private/7506410864.html
2022-07-12 12:48, (Fairfax VA),"Brand New, Outdoor Fireplace Lounge, Electric Car Charging Station",1900,1,700.0,https://washingtondc.craigslist.org/nva/apa/d/merrifield-brand-new-outdoor-fireplace/7507877121.html
2022-07-12 12:48, (Arlington),"#736 Modern, fully equipped 2 BDR in great neighborhood!",3375,2,1080.0,https://washingtondc.craigslist.org/nva/apa/d/arlington-736-modern-fully-equipped-bdr/7507876943.html
2022-07-12 12:48, (Fairfax VA),"Stylish Features, Washer and Dryer, Great Fitness Studio",2740,2,1079.0,https://washingtondc.craigslist.org/nva/apa/d/merrifield-stylish-features-washer-and/7507876900.html
2022-07-12 12:47," (2100 Brooks Dr Forestville, MD)",Don't miss out on this Studio APPLY NOW! Ask Diamond!!!,1209,,570.0,https://washingtondc.craigslist.org/nva/apa/d/district-heights-dont-miss-out-on-this/7505992863.html
2022-07-12 12:47, (Arlington),#221 Modern & Fully Equipped 1BR/1BA in the Courthouse Area!,2270,1,620.0,https://washingtondc.craigslist.org/nva/apa/d/arlington-221-modern-fully-equipped-1br/7507876178.html
2022-07-12 12:46," (2100 Brooks Dr Forestville, MD)",Junior one bedroom SPECIALS! Ask Diamond,1369,1,520.0,https://washingtondc.craigslist.org/mld/apa/d/district-heights-junior-one-bedroom/7505995533.html
2022-07-12 12:46, (northern virginia),"Coffee Bar, 24-Hour Fitness, Walk-In Closets",3364,2,1433.0,https://washingtondc.craigslist.org/nva/apa/d/arlington-coffee-bar-24-hour-fitness/7500382165.html
2022-07-12 12:46, (Laurel),"Perfect Location, Stainless Steel Appliances, Pets Welcome",1730,2,985.0,https://washingtondc.craigslist.org/mld/apa/d/southern-md-facility-perfect-location/7507875766.html
2022-07-12 12:46," (2100 Brooks Dr Forestville, MD)",Don't miss out on this Studio APPLY NOW! Ask Diamond!!!,1209,,570.0,https://washingtondc.craigslist.org/doc/apa/d/district-heights-dont-miss-out-on-this/7505993910.html
2022-07-12 12:46," (4137 Wadsworth Court, Washington, DC)","Fully equipped kitchens, On-Call Maintenance, Patio with select homes",2317,3,1100.0,https://washingtondc.craigslist.org/nva/apa/d/annandale-fully-equipped-kitchens-on/7507875702.html
2022-07-12 12:45," (2100 Brooks Dr Forestville, MD)",Junior ONE Bedroom AVAILABLE SOON! Ask Diamond!,1369,1,700.0,https://washingtondc.craigslist.org/doc/apa/d/district-heights-junior-one-bedroom/7505997000.html
2022-07-12 12:45, (Arlington),#121 Modern & Fully Equipped 1BR/1BA in the Courthouse Area!,2270,1,620.0,https://washingtondc.craigslist.org/nva/apa/d/arlington-121-modern-fully-equipped-1br/7507875378.html
2022-07-12 12:45," (2100 Brooks Dr Forestville, MD)",Amazing Studio with Amazing View! Ask for Diamond,1209,,510.0,https://washingtondc.craigslist.org/nva/apa/d/district-heights-amazing-studio-with/7500173160.html
2022-07-12 12:45," (2100 Brooks Dr Forestville, MD)",Amazing Studio with Amazing View! Ask for Diamond,1209,,570.0,https://washingtondc.craigslist.org/doc/apa/d/district-heights-amazing-studio-with/7500173946.html
2022-07-12 12:45," (2100 Brooks Dr Forestville, MD)",Awesome ONE bedroom coming available! Ask for Diamond,1469,1,870.0,https://washingtondc.craigslist.org/doc/apa/d/district-heights-awesome-one-bedroom/7500175690.html
2022-07-12 12:44," (2100 Brooks Dr Forestville, MD)",Awesome ONE bedroom available! Ask for Diamond!,1469,1,870.0,https://washingtondc.craigslist.org/nva/apa/d/district-heights-awesome-one-bedroom/7500176800.html
2022-07-12 12:44, (Washington),"Fantastic 1 bed, 1 bath in sought-after Washington area at Chalfonte!",2600,1,846.0,https://washingtondc.craigslist.org/doc/apa/d/washington-fantastic-bed-bath-in-sought/7507856500.html
2022-07-12 12:44," (2100 Brooks Dr Forestville, MD)",Amazing One Bedroom with Amazing View! Ask for Diamond,1469,1,870.0,https://washingtondc.craigslist.org/mld/apa/d/district-heights-amazing-one-bedroom/7500177646.html
2022-07-12 12:44, (Arbor Park of Alexandria),"Balcony or patio, Air conditioning, On-site laundry",1978,1,785.0,https://washingtondc.craigslist.org/nva/apa/d/alexandria-balcony-or-patio-air/7507874608.html
2022-07-12 12:43," (2100 Brooks Dr Forestville, MD)",Don't miss out on this SPECIAL! APPLY NOW! Ask for Diamond!!!,1469,1,870.0,https://washingtondc.craigslist.org/mld/apa/d/district-heights-dont-miss-out-on-this/7498883071.html
2022-07-12 12:43, (Silver Spring MD 20904),GARDEN STYLE!!!HURRY THEY ARE GOING FAST....APPLY TODAY!!,1585,1,850.0,https://washingtondc.craigslist.org/mld/apa/d/garden-stylehurry-they-are-going/7496851555.html
2022-07-12 12:41," (Northeast DC, Near Langston Golf Course)",Get the Apartment you want,1445,2,650.0,https://washingtondc.craigslist.org/doc/apa/d/washington-get-the-apartment-you-want/7507873550.html
2022-07-12 12:41, (Langston),"Perfect Location, Granite Countertops , Close to Downtown",1275,1,600.0,https://washingtondc.craigslist.org/doc/apa/d/perfect-location-granite-countertops/7507873368.html
2022-07-12 12:41, (Washington),"Wonderful Amenities, 1 Bed/1 Bath/673 Sq Ft, Beautiful Community",2360,1,673.0,https://washingtondc.craigslist.org/doc/apa/d/washington-wonderful-amenities-bed-bath/7507873320.html
2022-07-12 12:41," (2100 Brooks Dr Forestville, MD)",Gorgeous Studio apartment home! Ask Diamond,1209,,570.0,https://washingtondc.craigslist.org/mld/apa/d/district-heights-gorgeous-studio/7507873140.html
2022-07-12 12:40, (Old Town Alexandria),Incredible space. Inviting location. 1 bd 1 ba. Make a home with us!,1520,1,854.0,https://washingtondc.craigslist.org/nva/apa/d/alexandria-incredible-space-inviting/7507872787.html
2022-07-12 12:40, (maryland),"24-hour fitness center, Built-in bookcase, Washer and dryer, Pantry",3090,2,1300.0,https://washingtondc.craigslist.org/mld/apa/d/college-park-24-hour-fitness-center/7507872635.html
2022-07-12 12:39, (maryland),"Close to Schools, Renovated Units Available, Online Payments Available",1315,1,,https://washingtondc.craigslist.org/mld/apa/d/brentwood-close-to-schools-renovated/7507872218.html
2022-07-12 12:39, (district of columbia),"Lease Today, Walk to Everything, Perfect Location",1041,1,,https://washingtondc.craigslist.org/doc/apa/d/lease-today-walk-to-everything-perfect/7507872129.html
2022-07-12 12:39, (Adams Morgan),Beautiful 2 BD/2 BA in the heart of Adams Morgan!,3250,2,1002.0,https://washingtondc.craigslist.org/doc/apa/d/washington-beautiful-bd-ba-in-the-heart/7507866082.html
2022-07-12 12:38," (1301 15th Street Northwest, Washington, DC)","Fitness Center, On-Site Management, Gas Range",1749,1,447.0,https://washingtondc.craigslist.org/doc/apa/d/washington-fitness-center-on-site/7501753948.html
2022-07-12 12:38, (Rockville),"Efficient Appliances, Wall to Wall Carpet, BBQ and Picnic Area",2605,3,1230.0,https://washingtondc.craigslist.org/mld/apa/d/rockville-efficient-appliances-wall-to/7503481764.html
2022-07-12 12:37, (maryland),"Courtyard, Pet Friendly, Laundry Facilities",1195,1,,https://washingtondc.craigslist.org/mld/apa/d/temple-hills-courtyard-pet-friendly/7506206767.html
2022-07-12 12:37, (maryland),"Close to Freeway, Window Coverings, Playground",1470,1,,https://washingtondc.craigslist.org/mld/apa/d/laurel-close-to-freeway-window/7506023860.html
2022-07-12 12:37, (Ashburn),Beautiful Two-Bedroom One-Bath Available in Ashburn Va,1781,2,971.0,https://washingtondc.craigslist.org/nva/apa/d/ashburn-beautiful-two-bedroom-one-bath/7507870993.html
2022-07-12 12:37, (Great Falls),1850 SF Walk-Out Basement Apartment,2300,2,1850.0,https://washingtondc.craigslist.org/nva/apa/d/great-falls-1850-sf-walk-out-basement/7507870943.html
2022-07-12 12:36, (Twinbrook Station/Congressional Plaza),"All Season Courtyard Lounge, 24-Hour Emergency Maintenance",2799,2,1170.0,https://washingtondc.craigslist.org/mld/apa/d/rockville-all-season-courtyard-lounge/7507870862.html
2022-07-12 12:36, (Ashburn),"Convenient Location, Sundeck, Wifi",2527,2,1192.0,https://washingtondc.craigslist.org/nva/apa/d/ashburn-convenient-location-sundeck-wifi/7507870405.html
2022-07-12 12:34, (Alexandria),Great Spacious 2bd with a lot of Natural Light and Big Balcony!,2113,2,984.0,https://washingtondc.craigslist.org/doc/apa/d/alexandria-great-spacious-2bd-with-lot/7507863981.html
2022-07-12 12:34, (Cathedral Heights/Glover Park/NW DC/Georgetown/AU),Amazing Deal & Price on 2BDR in Cathedral Heights! 1 Month FREE!,2850,2,982.0,https://washingtondc.craigslist.org/doc/apa/d/washington-amazing-deal-price-on-2bdr/7507869159.html
2022-07-12 12:33, (district of columbia),"24-Hour Fitness Center, Sauna, Hair Salon",2437,2,1160.0,https://washingtondc.craigslist.org/doc/apa/d/gainesville-24-hour-fitness-center/7507869019.html
2022-07-12 12:33, (northern virginia),Everyone’s dream.,2930,3,1272.0,https://washingtondc.craigslist.org/nva/apa/d/herndon-everyones-dream/7507863253.html
2022-07-12 12:33, (northern virginia),"Large Closets, Intercom Entry system, Ceramic Tile Flooring",1539,1,400.0,https://washingtondc.craigslist.org/nva/apa/d/washington-large-closets-intercom-entry/7505311712.html
2022-07-12 12:33, (Alexandria),Penthouse style loft for rent (5mins from pentagon city/dc),2677,1,1062.0,https://washingtondc.craigslist.org/nva/apa/d/alexandria-penthouse-style-loft-for/7507868614.html
2022-07-12 12:32, (Alexandria),"Luxury 2 Bedroom + Den, in-unit laundry & 24-hour fitness center",2775,2,1417.0,https://washingtondc.craigslist.org/nva/apa/d/alexandria-luxury-bedroom-den-in-unit/7507843158.html
2022-07-12 12:32, (Gaithersburg),"Perfect Location, Off Street Parking, Stylish Features",2070,2,1120.0,https://washingtondc.craigslist.org/mld/apa/d/gaithersburg-perfect-location-off/7507868427.html
2022-07-12 12:32, (70 I Street SE),"Generous walk-in closets*, Complete black GE appliance packages",1883,,529.0,https://washingtondc.craigslist.org/doc/apa/d/washington-generous-walk-in-closets/7507868416.html
2022-07-12 12:32, (district of columbia),"Cable Ready, High Speed Internet, Guest Room",1902,,648.0,https://washingtondc.craigslist.org/doc/apa/d/washington-cable-ready-high-speed/7506284674.html
2022-07-12 12:32, (Washington),"Perfect Location, Floor to Ceiling Windows, Wood Like Flooring",3552,2,1202.0,https://washingtondc.craigslist.org/doc/apa/d/washington-perfect-location-floor-to/7507862062.html
2022-07-12 12:32, (maryland),"Smoke Free, Pool, On-Site Management",1760,3,,https://washingtondc.craigslist.org/mld/apa/d/district-heights-smoke-free-pool-on/7504853300.html
2022-07-12 12:31," (2100 Brooks Dr Forestville, MD)",Don't miss out on this SPECIAL! APPLY NOW! Ask Tiffany!!!,1209,,570.0,https://washingtondc.craigslist.org/mld/apa/d/district-heights-dont-miss-out-on-this/7507867848.html
2022-07-12 12:31, (maryland),A Place To Call Home!,1793,2,1045.0,https://washingtondc.craigslist.org/mld/apa/d/silver-spring-place-to-call-home/7506733655.html
2022-07-12 12:30, (northern virginia),"Great Size, Even Greater Value! Renovated Home with a 12th Floor View!",2744,3,1270.0,https://washingtondc.craigslist.org/nva/apa/d/alexandria-great-size-even-greater/7505113226.html
2022-07-12 12:30, (bethesda),"Beautiful-spacious Single Family House Bethesda, 2 car garage, 4 br",3595,4,2500.0,https://washingtondc.craigslist.org/nva/apa/d/bethesda-beautiful-spacious-single/7503122947.html
2022-07-12 12:30," (6079 Bellview Dr. Falls Church, VA)","Right Around the Corner, Near Everywhere You Want to Be.",1759,2,873.0,https://washingtondc.craigslist.org/nva/apa/d/falls-church-right-around-the-corner/7507867384.html
2022-07-12 12:30, (maryland),"Close to Restaurants, Online Payments Available, Close to Freeway",1875,2,950.0,https://washingtondc.craigslist.org/mld/apa/d/beltsville-close-to-restaurants-online/7505181342.html
2022-07-12 12:29, (Washington),"Incredible Features, Pet Friendly, Stainless Steel Appliances",1745,1,645.0,https://washingtondc.craigslist.org/doc/apa/d/washington-incredible-features-pet/7507867041.html
2022-07-12 12:29, (Rockville),A great place to kick back and relax! Beautiful neighborhood!,1804,1,897.0,https://washingtondc.craigslist.org/mld/apa/d/rockville-great-place-to-kick-back-and/7507867027.html
2022-07-12 12:29, (Alexandria),"Pet-friendly, Frost free refrigerator with ice maker, Loft",2341,2,1135.0,https://washingtondc.craigslist.org/nva/apa/d/alexandria-pet-friendly-frost-free/7507866852.html
2022-07-12 12:28, (Germantown),"Perfect Location, Business Center, Garages Available",2149,2,1105.0,https://washingtondc.craigslist.org/mld/apa/d/germantown-perfect-location-business/7507866398.html
2022-07-12 12:28, (maryland),2BR Apt w/ Ample Closet Space and Large Bedrooms,1905,2,860.0,https://washingtondc.craigslist.org/mld/apa/d/silver-spring-2br-apt-ample-closet/7507859086.html
