date_time,town,title,price,beds,sqft,url
2022-07-12 08:31, (northern virginia),"Recycling, Double-Paned Windows, Air Conditioner",1566,1,450.0,https://washingtondc.craigslist.org/nva/apa/d/washington-recycling-double-paned/7499808277.html
2022-07-12 08:31, (district of columbia),"Patio or Balcony, Reserved Parking, Car Wash Area",2540,3,1230.0,https://washingtondc.craigslist.org/doc/apa/d/rockville-patio-or-balcony-reserved/7506235829.html
2022-07-12 08:30, (maryland),"Dishwasher, Ceiling Fan, Cable Ready",1755,3,,https://washingtondc.craigslist.org/mld/apa/d/district-heights-dishwasher-ceiling-fan/7500242115.html
2022-07-12 08:30, (SILVER SPRING MD),"Schools, Swimming pool /Picnic areas, Swimming Pool",2133,3,1124.0,https://washingtondc.craigslist.org/mld/apa/d/silver-spring-schools-swimming-pool/7506842356.html
2022-07-12 08:30, (maryland),"On-Site Maintenance, Heating, Pet Friendly",1760,3,,https://washingtondc.craigslist.org/mld/apa/d/district-heights-on-site-maintenance/7504853297.html
2022-07-12 08:29," (201 I Street SW Washington, DC)",Huge Studios near The District Wharf!,1495,,480.0,https://washingtondc.craigslist.org/doc/apa/d/washington-huge-studios-near-the/7507767049.html
2022-07-12 08:29, (northern virginia),A New Wave of Living! fully upgraded studio waiting for you!,1540,,535.0,https://washingtondc.craigslist.org/nva/apa/d/alexandria-new-wave-of-living-fully/7505848055.html
2022-07-12 08:28, (Washington),LOVELY ROW HOUSE IN COLUMBIA HEIGHTS,3000,3,1500.0,https://washingtondc.craigslist.org/doc/apa/d/washington-lovely-row-house-in-columbia/7507765671.html
2022-07-12 08:22, (northern virginia),"Wi-Fi in Common Areas, Furnished Apartments Available, Tile Floors",2706,2,1146.0,https://washingtondc.craigslist.org/nva/apa/d/arlington-wi-fi-in-common-areas/7499061135.html
2022-07-12 08:21, (Washington),We love your pets! They'll love Paramount! Tour today!,1620,,354.0,https://washingtondc.craigslist.org/doc/apa/d/washington-we-love-your-pets-theyll/7507762358.html
2022-07-12 08:20, (northern virginia),Controlled access with dens available!,2710,3,1210.0,https://washingtondc.craigslist.org/nva/apa/d/falls-church-controlled-access-with/7505815380.html
2022-07-12 08:20," (1507 Ray Road, Hyattsville, MD)","Air Conditioning, Playground, Cable or Satellite",1545,2,891.0,https://washingtondc.craigslist.org/mld/apa/d/hyattsville-air-conditioning-playground/7505850500.html
2022-07-12 08:17, (district of columbia),"Air Conditioner, Patio/Balcony, Disposal",2573,1,797.0,https://washingtondc.craigslist.org/doc/apa/d/washington-air-conditioner-patio/7496958789.html
2022-07-12 08:10," (1445 Ogden Street Northwest, Washington, DC)","Fitness Center, Ceiling Fan, Intercom system",1325,,540.0,https://washingtondc.craigslist.org/doc/apa/d/washington-fitness-center-ceiling-fan/7507763157.html
2022-07-12 08:10, (maryland),"Dishwasher, Desired Location, On-Site Maintenance",1460,1,,https://washingtondc.craigslist.org/mld/apa/d/laurel-dishwasher-desired-location-on/7506024980.html
2022-07-12 08:09, (district of columbia),Stunning contemporary 2 bed,2647,2,1124.0,https://washingtondc.craigslist.org/doc/apa/d/washington-stunning-contemporary-bed/7503712393.html
2022-07-12 08:09, (northern virginia),"Intimate In-Home Fireplace, Hassle-Free Transfer Program, Bark Park",2488,2,1280.0,https://washingtondc.craigslist.org/nva/apa/d/fairfax-intimate-in-home-fireplace/7498607549.html
2022-07-12 08:08," (1507 Ray Road, Hyattsville, MD)","Swimming pool, Beautifully landscaped grounds, Playground",1300,1,752.0,https://washingtondc.craigslist.org/mld/apa/d/hyattsville-swimming-pool-beautifully/7507762845.html
2022-07-12 08:07, (maryland),"Huge walk in closets, Individually controlled A/C, Walk to shopping",1740,2,950.0,https://washingtondc.craigslist.org/mld/apa/d/silver-spring-huge-walk-in-closets/7497608253.html
2022-07-12 08:07, (maryland),"Air Conditioning, Complete Kitchen Appliance Packages, Bike Storage",2094,1,859.0,https://washingtondc.craigslist.org/mld/apa/d/rockville-air-conditioning-complete/7505801259.html
2022-07-12 08:04, (Washington DC),2 Bedroom Condo for Rent!!,1950,2,789.0,https://washingtondc.craigslist.org/doc/apa/d/washington-bedroom-condo-for-rent/7502470190.html
2022-07-12 08:03," (1445 Ogden Street Northwest, Washington, DC)","Updated Bathrooms, Hardwood Floors, Intercom system",1725,1,710.0,https://washingtondc.craigslist.org/doc/apa/d/washington-updated-bathrooms-hardwood/7497648265.html
2022-07-12 08:02, (maryland),"Pet Friendly (Some Restrictions Apply), Playground, Ceiling Fans",1485,1,829.0,https://washingtondc.craigslist.org/mld/apa/d/silver-spring-pet-friendly-some/7507761645.html
2022-07-12 08:02, (Georgetown),georgetown 2 bedroom furnished DENT STREET all utilties,3250,2,,https://washingtondc.craigslist.org/doc/apa/d/washington-georgetown-bedroom-furnished/7505994556.html
2022-07-12 08:02," (DC/ 6th & Q NW/ Between U St, H St, Dupont Circle and NOMA)",CENTRALLY LOCATED NW 2BR/1BA FURNISHED ALL UTIL./WIFI INCL. THRU MAY!,2000,2,900.0,https://washingtondc.craigslist.org/doc/apa/d/washington-centrally-located-nw-2br-1ba/7506024798.html
2022-07-12 08:02, (NW DC/ Columbia Heights/Adams Morgan/ U Street),"LOVELY COLUMBIA HEIGHTS 2BR/1BA, ALL UTIL/WIFI INCL. Shorter term, OK!",2100,2,1000.0,https://washingtondc.craigslist.org/doc/apa/d/washington-lovely-columbia-heights-2br/7505991388.html
2022-07-12 08:01," (Capitol Hill, DC)",Hill House Apartments #416 In Capitol Hill,2399,1,,https://washingtondc.craigslist.org/doc/apa/d/washington-hill-house-apartments-416-in/7507761468.html
2022-07-12 07:59, (4903 Edgemoor Lane),"Aspen 2, 1Br/1Ba on the 6th floor, Hardwood Fl , W/D and More",2251,1,768.0,https://washingtondc.craigslist.org/doc/apa/d/chevy-chase-aspen-1br-1ba-on-the-6th/7507755286.html
2022-07-12 07:57, (northern virginia),Great Location~ Gorgeous~ Apartment~ Pet Friendly!,1757,1,835.0,https://washingtondc.craigslist.org/nva/apa/d/alexandria-great-location-gorgeous/7497029047.html
2022-07-12 07:57, (maryland),"Cable Ready, Playground, On-Site Maintenance",1175,1,,https://washingtondc.craigslist.org/mld/apa/d/temple-hills-cable-ready-playground-on/7500123855.html
2022-07-12 07:49, (district of columbia),"View, Handrails in bathroom, Window Coverings, Clubroom",3376,1,1197.0,https://washingtondc.craigslist.org/doc/apa/d/washington-view-handrails-in-bathroom/7507759552.html
2022-07-12 07:48, (northern virginia),"Dens available, Formal dining room or eat-in kitchen, Cats welcome",1830,1,801.0,https://washingtondc.craigslist.org/nva/apa/d/falls-church-dens-available-formal/7503727774.html
2022-07-12 07:44," (1204 S Washington St, Alexandria, VA)","Dishwasher, Bicycle Storage, Built-In Microwave",1619,,500.0,https://washingtondc.craigslist.org/nva/apa/d/alexandria-dishwasher-bicycle-storage/7503553323.html
2022-07-12 07:43, (northern virginia),"Close to Freeway, Hardwood Flooring, Close to Schools",1880,2,,https://washingtondc.craigslist.org/nva/apa/d/falls-church-close-to-freeway-hardwood/7502819852.html
2022-07-12 07:41, (northern virginia),"Fully equipped kitchens, Separate Dining Area, Carpeted",1862,1,750.0,https://washingtondc.craigslist.org/nva/apa/d/annandale-fully-equipped-kitchens/7502829158.html
2022-07-12 07:33, (northern virginia),"Wi-Fi in Common Areas, Large Closets, Bike Storage",2096,,590.0,https://washingtondc.craigslist.org/nva/apa/d/arlington-wi-fi-in-common-areas-large/7502193575.html
2022-07-12 07:32," (1265 Elden Street, Herndon, VA)","Flexible Lease Terms, Renter Rewards Program, Spanish Speaking Staff",2779,3,1035.0,https://washingtondc.craigslist.org/nva/apa/d/herndon-flexible-lease-terms-renter/7505948771.html
2022-07-12 07:31, (Dupont Circle/ West End),Fully-Furnished Studio-Dupont Circle,2000,,650.0,https://washingtondc.craigslist.org/doc/apa/d/washington-fully-furnished-studio/7502362492.html
2022-07-12 07:31," (4740 Bradley Blvd , Chevy Chase, MD)","Recently renovated apartments, Walk to Bethesda Metro, Gas stove",1505,1,668.0,https://washingtondc.craigslist.org/mld/apa/d/chevy-chase-recently-renovated/7499700251.html
2022-07-12 07:29, (purcellville/va),Hello Horse Lover! This 5-BR/5 FB/92.3 ac farm is yours.,4900,5,,https://washingtondc.craigslist.org/nva/apa/d/purcellville-hello-horse-lover-this-br/7507756532.html
2022-07-12 07:27, (northern virginia),Need a rest? Call the best.,2079,2,1036.0,https://washingtondc.craigslist.org/nva/apa/d/herndon-need-rest-call-the-best/7505902769.html
2022-07-12 07:14, (district of columbia),"Sundeck, Free Weights, Air Conditioner",1902,,648.0,https://washingtondc.craigslist.org/doc/apa/d/washington-sundeck-free-weights-air/7505775112.html
2022-07-12 07:08, (Washington DC),Great Location - Sky High Ceilings - Basement Apartment,1700,1,710.0,https://washingtondc.craigslist.org/doc/apa/d/washington-great-location-sky-high/7504956844.html
2022-07-12 07:08, (Washington DC),6 Bedroom w/ spacious outdoor area and Beautiful Kitchen,5650,6,4000.0,https://washingtondc.craigslist.org/doc/apa/d/washington-bedroom-spacious-outdoor/7495942676.html
2022-07-12 07:08," (Silver Spring, MD)","Renovated Kitchens, Dishwasher, Washer/Dryer in Every Home",850,2,1045.0,https://washingtondc.craigslist.org/mld/apa/d/renovated-kitchens-dishwasher-washer/7507753936.html
2022-07-12 07:03, (northern virginia),"STYLISH STUDIO ~ W/ HUGE CLOSET, AVAILABLE FOR IMMEDIATE MOVE-IN!!",1594,,535.0,https://washingtondc.craigslist.org/nva/apa/d/alexandria-stylish-studio-huge-closet/7497035494.html
2022-07-12 07:03, (northern virginia),"Large Kitchen Islands, Oversized Windows, Modern Lighting and Flooring",2060,1,764.0,https://washingtondc.craigslist.org/nva/apa/d/woodbridge-large-kitchen-islands/7498516848.html
2022-07-12 06:55," (4740 Bradley Blvd , Chevy Chase, MD)","Resident controlled access buildings’, Great schools, Walk-in closets",1505,1,668.0,https://washingtondc.craigslist.org/mld/apa/d/chevy-chase-resident-controlled-access/7506252859.html
2022-07-12 06:54, (maryland),"Dishwasher, Close to Schools, Renovated Units",1650,2,967.0,https://washingtondc.craigslist.org/mld/apa/d/capitol-heights-dishwasher-close-to/7497723925.html
2022-07-12 06:37," (Tysons, McLean VA)","Open House PeachTree of McLean June 18, 2022, Apply Today!!!!!!",1830,1,801.0,https://washingtondc.craigslist.org/nva/apa/d/falls-church-open-house-peachtree-of/7497903209.html
2022-07-12 06:29, (maryland),"Short Term Leases Available (3, 6, and 9 months), Courtyard, Gas Range",1265,2,,https://washingtondc.craigslist.org/mld/apa/d/temple-hills-short-term-leases/7502174196.html
2022-07-12 06:28, (maryland),"Close to Shopping Centers, Renovated Units w/Carpet & Hardwood Floors",1290,1,,https://washingtondc.craigslist.org/mld/apa/d/brentwood-close-to-shopping-centers/7502318128.html
2022-07-12 06:26," (4701 Kenmore Avenue, Alexandria, VA)","""STOP! TAKE A GOOD LOOK AT THIS ONE!""",2080,2,985.0,https://washingtondc.craigslist.org/nva/apa/d/alexandria-stop-take-good-look-at-this/7497853210.html
2022-07-12 06:25, (maryland),"Hardwood Flooring, Online Payments Available, Private Balcony or Patio",2275,2,888.0,https://washingtondc.craigslist.org/mld/apa/d/rockville-hardwood-flooring-online/7505869396.html
2022-07-12 06:25, (maryland),"Recycling, Laundry Facilities, 24 Hour Emergency Maintenance",1285,2,,https://washingtondc.craigslist.org/mld/apa/d/temple-hills-recycling-laundry/7506280914.html
2022-07-12 06:24, (Rockville),"Free Weights, Car Wash Area, Separate Dining Room",2120,2,1120.0,https://washingtondc.craigslist.org/mld/apa/d/rockville-free-weights-car-wash-area/7502818786.html
2022-07-12 06:19, (Congress Heights),Super Nice Condo,1350,1,600.0,https://washingtondc.craigslist.org/doc/apa/d/washington-super-nice-condo/7503835884.html
2022-07-12 06:19, (Congress Heights),Spacious Condo - Top Floor,1500,2,750.0,https://washingtondc.craigslist.org/doc/apa/d/washington-spacious-condo-top-floor/7503836574.html
2022-07-12 06:15, (northern virginia),"Swimming Pool, Walk-In Closet, Wired for Technology",1862,2,950.0,https://washingtondc.craigslist.org/nva/apa/d/annandale-swimming-pool-walk-in-closet/7498260836.html
2022-07-12 06:05, (district of columbia),"On-Site Parking, Elevator, Extra Storage",1902,,648.0,https://washingtondc.craigslist.org/doc/apa/d/washington-on-site-parking-elevator/7502608223.html
2022-07-12 06:03, (northern virginia),"Only available in select apartments, Granite Countertops, Java Bar",2115,1,864.0,https://washingtondc.craigslist.org/nva/apa/d/fairfax-only-available-in-select/7497382672.html
2022-07-12 06:00, (SILVER SPRING MD),"Off street parking available, Vertical blinds throughout unit, Schools",1923,2,1075.0,https://washingtondc.craigslist.org/mld/apa/d/silver-spring-off-street-parking/7496418587.html
2022-07-12 06:00," (20155 San Joaquin Terrace, Washington, DC)","Open Concept Kitchens, Modern Clubhouse, Package Lockers",3071,3,1388.0,https://washingtondc.craigslist.org/nva/apa/d/ashburn-open-concept-kitchens-modern/7497011065.html
2022-07-12 05:59, (maryland),"Cable Ready, Refrigerator, On-Site Management",1585,2,,https://washingtondc.craigslist.org/mld/apa/d/laurel-cable-ready-refrigerator-on-site/7506026122.html
2022-07-12 05:58," (Tysons, McLean VA)","Open House PeachTree of McLean June 18, Apply Today!",2725,3,1210.0,https://washingtondc.craigslist.org/nva/apa/d/falls-church-open-house-peachtree-of/7497898741.html
2022-07-12 05:56, (maryland),"Smoke Free, Heating, Modern Appliances",1595,2,,https://washingtondc.craigslist.org/mld/apa/d/district-heights-smoke-free-heating/7504935000.html
2022-07-12 05:47," (4701 Kenmore Avenue , Alexandria, VA)",Step into Your Newly Upgraded Apartment at Seminary Towers Today !!,1777,1,825.0,https://washingtondc.craigslist.org/nva/apa/d/alexandria-step-into-your-newly/7501754528.html
2022-07-12 05:42, (northern virginia),"Air Conditioner, Separate Dining Area, Recycling",1690,1,,https://washingtondc.craigslist.org/nva/apa/d/falls-church-air-conditioner-separate/7506009609.html
2022-07-12 05:37, (district of columbia),"Large Closets, Wood Plank Flooring, Short-term Leases Available",2181,1,735.0,https://washingtondc.craigslist.org/doc/apa/d/arlington-large-closets-wood-plank/7499011007.html
2022-07-12 05:21, (Falls Church),"Easy Freeway Access, Easy Access to Public Transportation",1890,2,719.0,https://washingtondc.craigslist.org/nva/apa/d/falls-church-easy-freeway-access-easy/7502863145.html
2022-07-12 05:18," (9220 Old Lantern Way, Laurel, MD)","Resident Events, 2 Swimming Pools, GOChat Business Center",1506,1,711.0,https://washingtondc.craigslist.org/doc/apa/d/laurel-resident-events-swimming-pools/7505516824.html
2022-07-12 05:06, (northern virginia),"Instalación de lavandería, cerca del aeropuerto, piscina",1862,2,950.0,https://washingtondc.craigslist.org/nva/apa/d/annandale-instalacin-de-lavandera-cerca/7498801356.html
2022-07-12 05:01, (district of columbia),"On-Site Maintenance, Refrigerator, Recycling",3280,2,1295.0,https://washingtondc.craigslist.org/doc/apa/d/washington-on-site-maintenance/7499004637.html
2022-07-12 04:59," (Tysons, McLean VA)","""""""Open House PeachTree of McLean June 18, 2022, Apply Today""""""""",1830,1,801.0,https://washingtondc.craigslist.org/nva/apa/d/falls-church-open-house-peachtree-of/7497898892.html
2022-07-12 04:57, (northern virginia),Everything You Need. All Right Here~Submit Your Application TODAY~,2185,2,1185.0,https://washingtondc.craigslist.org/nva/apa/d/alexandria-everything-you-need-all/7500377024.html
2022-07-12 04:56," (4740 Bradley Blvd , Chevy Chase, MD)","Shopping & restaurants within a short walk, Walk-in closets, Gas stove",2025,2,879.0,https://washingtondc.craigslist.org/mld/apa/d/chevy-chase-shopping-restaurants-within/7506280823.html
2022-07-12 04:50, (maryland),"Separate Dining Area, Pool, Playground",1485,1,748.0,https://washingtondc.craigslist.org/mld/apa/d/capitol-heights-separate-dining-area/7499265228.html
2022-07-12 04:49, (northern virginia),"Nine-Foot Ceilings, Children’s Recreation Park, Large Bark Park",1895,1,763.0,https://washingtondc.craigslist.org/nva/apa/d/woodbridge-nine-foot-ceilings-childrens/7503439754.html
2022-07-12 04:39, (maryland),"Plenty of green space and trails, Pet spa, Online Payments Available",1929,1,660.0,https://washingtondc.craigslist.org/mld/apa/d/gaithersburg-plenty-of-green-space-and/7505931750.html
2022-07-12 04:36, (northern virginia),"24-Hour Fitness Center, Pet Wash Station, Subway Tile Backsplash",1925,1,692.0,https://washingtondc.craigslist.org/nva/apa/d/ashburn-24-hour-fitness-center-pet-wash/7496973620.html
2022-07-12 04:25, (maryland),"Renovated Units w/ Hardwood Floors & Carpet , Near Shopping Centers",1315,1,,https://washingtondc.craigslist.org/mld/apa/d/brentwood-renovated-units-hardwood/7503109983.html
2022-07-12 04:24, (maryland),"Spa/Hot Tub, Washer and Dryer Connections, Parking Garage",2820,2,1200.0,https://washingtondc.craigslist.org/mld/apa/d/rockville-spa-hot-tub-washer-and-dryer/7505869426.html
2022-07-12 04:20," (4701 Kenmore Avenue, Alexandria, VA)",Make Seminary Towers your next place to call home - apply today!!,1773,1,835.0,https://washingtondc.craigslist.org/nva/apa/d/alexandria-make-seminary-towers-your/7501951295.html
2022-07-12 04:19, (district of columbia),"Separate Dining Room, Reserved Parking, Patio or Balcony",2120,2,1120.0,https://washingtondc.craigslist.org/doc/apa/d/rockville-separate-dining-room-reserved/7504947308.html
2022-07-12 04:17, (maryland),"Heating, Short Term Leases Available (3, 6, and 9 months), Dishwasher",1760,3,,https://washingtondc.craigslist.org/mld/apa/d/district-heights-heating-short-term/7504853291.html
2022-07-12 04:16, (maryland),"Heating, Hardwood Floors, Air Conditioner",1695,2,,https://washingtondc.craigslist.org/mld/apa/d/district-heights-heating-hardwood/7503569775.html
2022-07-12 04:14," (1450 Church St NW APT 301, Washington, DC)","2 bd2 ba1,100 sqft",1400,2,1100.0,https://washingtondc.craigslist.org/doc/apa/d/washington-bd2-ba1100-sqft/7507742780.html
2022-07-12 04:00, (district of columbia),"Controlled Access/Gated, On-Site Management, Cable Ready",3155,2,1295.0,https://washingtondc.craigslist.org/doc/apa/d/washington-controlled-access-gated-on/7502831059.html
2022-07-12 03:57," (Tysons, McLean VA)","Cats welcome, A sparkling resort-style pool, Plenty of closet space",1850,1,801.0,https://washingtondc.craigslist.org/nva/apa/d/falls-church-cats-welcome-sparkling/7496157151.html
2022-07-12 03:55, (northern virginia),"Private Patio or Balcony, Intimate In-Home Fireplace, Java Bar",2230,2,1004.0,https://washingtondc.craigslist.org/nva/apa/d/fairfax-private-patio-or-balcony/7501164586.html
2022-07-12 03:53, (maryland),"Close to Schools, Hardwood Flooring, On-Site Maintenance",1460,2,,https://washingtondc.craigslist.org/mld/apa/d/laurel-close-to-schools-hardwood/7502843244.html
2022-07-12 03:50, (216 21st St NE APT 1 Washington DC),2 bd2 ba 710 sqft,1400,2,710.0,https://washingtondc.craigslist.org/doc/apa/d/washington-bd2-ba-710-sqft/7506913756.html
2022-07-12 03:40, (maryland),"Individually controlled A/C, Metro Bus at your door, Walk to Shopping",1445,1,700.0,https://washingtondc.craigslist.org/mld/apa/d/silver-spring-individually-controlled-c/7495872518.html
2022-07-12 03:39, (northern virginia),"Hardwood Flooring, Pet Friendly, BBQ/Picnic Area",1480,,,https://washingtondc.craigslist.org/nva/apa/d/falls-church-hardwood-flooring-pet/7500325512.html
2022-07-12 03:37, (maryland),"Heating, Pool, On-Site Management",1595,2,,https://washingtondc.craigslist.org/mld/apa/d/district-heights-heating-pool-on-site/7504935021.html
2022-07-12 03:34, (district of columbia),"Valet Dry Cleaning, Bike Storage, Resident Lounge",3554,2,1433.0,https://washingtondc.craigslist.org/doc/apa/d/arlington-valet-dry-cleaning-bike/7502451853.html
2022-07-12 03:28, (northern virginia),"On-Call Maintenance, Walk-In Closet, Dishwasher",1887,2,950.0,https://washingtondc.craigslist.org/nva/apa/d/annandale-on-call-maintenance-walk-in/7499439042.html
2022-07-12 03:16, (Falls Church),"Visit Your New Home, All that's missing is you, Apply Today",1935,2,719.0,https://washingtondc.craigslist.org/nva/apa/d/falls-church-visit-your-new-home-all/7501749332.html
2022-07-12 03:16, (northern virginia),A better life !!! At Seminary Towers.,1540,,535.0,https://washingtondc.craigslist.org/nva/apa/d/alexandria-better-life-at-seminary/7505867097.html
2022-07-12 03:09, (northern virginia),Apartments Tailored to Your Highest Standards.,2210,2,1289.0,https://washingtondc.craigslist.org/nva/apa/d/herndon-apartments-tailored-to-your/7505155665.html
2022-07-12 03:08, (northern virginia),"Spacious 1 Bedroom, 9 Foot Ceilings, Oversized Walk-in Closets",2095,1,,https://washingtondc.craigslist.org/nva/apa/d/woodbridge-spacious-bedroom-foot/7504952278.html
2022-07-12 03:06," (Tysons, McLean VA)","Wall-to-wall carpet, Clubhouse, Fitness Center",1830,1,801.0,https://washingtondc.craigslist.org/nva/apa/d/falls-church-wall-to-wall-carpet/7497898590.html
2022-07-12 02:58, (northern virginia),Shared space - bedrooms available - Townhouse Arlington - see details,1250,1,,https://washingtondc.craigslist.org/nva/apa/d/arlington-shared-space-bedrooms/7503807365.html
2022-07-12 02:56," (4740 Bradley Blvd , Chevy Chase, MD)","One free parking permit included in the rent, Gas stove, Great schools",2025,2,879.0,https://washingtondc.craigslist.org/mld/apa/d/chevy-chase-one-free-parking-permit/7506319764.html
2022-07-12 02:55, (northern virginia),"Vestidor, área de juegos para niños, pisos de madera noble",1862,2,950.0,https://washingtondc.craigslist.org/nva/apa/d/annandale-vestidor-rea-de-juegos-para/7498145710.html
2022-07-12 02:55," (9220 Old Lantern Way, Laurel, MD)","GOFit Fitness Center, 2 Swimming Pools, Clubhouse",1581,1,711.0,https://washingtondc.craigslist.org/doc/apa/d/laurel-gofit-fitness-center-swimming/7505636834.html
2022-07-12 02:55, (district of columbia),"Elevator, Fitness Center, Clubhouse",1902,,648.0,https://washingtondc.craigslist.org/doc/apa/d/washington-elevator-fitness-center/7502620016.html
2022-07-12 02:46, (Arlington - Ballston),550 SQ FT Condo for Rent $1800,1800,1,550.0,https://washingtondc.craigslist.org/nva/apa/d/arlington-550-sq-ft-condo-for-rent-1800/7507737796.html
2022-07-12 02:46, (northern virginia),"Oversized Windows, Controlled Access, Nine-Foot Ceilings",2520,2,1118.0,https://washingtondc.craigslist.org/nva/apa/d/woodbridge-oversized-windows-controlled/7505594066.html
2022-07-12 02:45, (maryland),"Hardwood Flooring, Ceiling Fan, Close to Restaurants",1485,1,748.0,https://washingtondc.craigslist.org/mld/apa/d/capitol-heights-hardwood-flooring/7499265885.html
2022-07-12 02:34, (northern virginia),The joy of doing your best We love having you here!,1785,1,835.0,https://washingtondc.craigslist.org/nva/apa/d/alexandria-the-joy-of-doing-your-best/7506861798.html
2022-07-12 02:25," (20155 San Joaquin Terrace, Washington, DC)","Charcoal and Gas Grills with Picnic Style Seating, Java Bar, Fireplace",3078,3,1388.0,https://washingtondc.craigslist.org/nva/apa/d/ashburn-charcoal-and-gas-grills-with/7502011138.html
2022-07-12 02:24, (maryland),"Bike Storage, Parking Garage, Gated Electronic Entrance",1954,1,668.0,https://washingtondc.craigslist.org/mld/apa/d/rockville-bike-storage-parking-garage/7505970239.html
2022-07-12 02:23," (Rosslyn, Arlington)","Large Room for Rent, near Metro",1102,2,,https://washingtondc.craigslist.org/nva/apa/d/arlington-large-room-for-rent-near-metro/7507736089.html
2022-07-12 02:11, (district of columbia),"Patio or Balcony, Dishwasher, Ceiling Fan",1945,1,950.0,https://washingtondc.craigslist.org/doc/apa/d/rockville-patio-or-balcony-dishwasher/7495915662.html
2022-07-12 02:11, (maryland),"BBQ/Picnic Area, Ceiling Fan, On-Site Management",1195,1,,https://washingtondc.craigslist.org/mld/apa/d/temple-hills-bbq-picnic-area-ceiling/7506280987.html
2022-07-12 02:10, (maryland),"Great location near schools, shopping & restaurants! Renovated Units",1315,1,,https://washingtondc.craigslist.org/mld/apa/d/brentwood-great-location-near-schools/7504036988.html
2022-07-12 02:00," (4701 Kenmore Avenue , Alexandria, VA)",Newly Updated Home! Come see what makes Seminary Towers Exceptional,1950,2,1000.0,https://washingtondc.craigslist.org/nva/apa/d/alexandria-newly-updated-home-come-see/7502042168.html
2022-07-12 01:59, (district of columbia),"Air Conditioner, Short Term Lease, Disposal",1859,,648.0,https://washingtondc.craigslist.org/doc/apa/d/washington-air-conditioner-short-term/7499461242.html
2022-07-12 01:56, (maryland),"Cable Ready, Public Transportation, Refrigerator",1395,1,,https://washingtondc.craigslist.org/mld/apa/d/temple-hills-cable-ready-public/7506281098.html
2022-07-12 01:54, (northern virginia),"Cozy Clubhouse, Flexible Lease Terms, Breakfast Bar",2230,2,1076.0,https://washingtondc.craigslist.org/nva/apa/d/fairfax-cozy-clubhouse-flexible-lease/7501129789.html
2022-07-12 01:44, (northern virginia),Pets welcome & plenty of space!,2550,2,1108.0,https://washingtondc.craigslist.org/nva/apa/d/falls-church-pets-welcome-plenty-of/7505812856.html
2022-07-12 01:40, (SILVER SPRING MD),"Surrounded by restaurants, shopping centers, Walk to Shopping, Schools",1445,1,700.0,https://washingtondc.craigslist.org/mld/apa/d/silver-spring-surrounded-by-restaurants/7496479027.html
2022-07-12 01:36, (northern virginia),"Refrigerator, Recycling, Mirrored Wardrobe",1480,,,https://washingtondc.craigslist.org/nva/apa/d/falls-church-refrigerator-recycling/7500625315.html
2022-07-12 01:33, (Arlington),"1 Bedroom Condo w/ Amenities, 4 min Walk to Metro",1850,1,600.0,https://washingtondc.craigslist.org/nva/apa/d/arlington-bedroom-condo-amenities-min/7507731642.html
