date_time,town,title,price,beds,sqft,url
2022-07-12 13:55, (east valley),One Bedroom home in the Heart of Tempe! Move quickly before Its Gone!,2080,1,618.0,https://phoenix.craigslist.org/evl/apa/d/tempe-one-bedroom-home-in-the-heart-of/7507998769.html
2022-07-12 13:53, (west valley),"Amazing amenities can be yours at Zinc Apartments! 2 bed, 2 bath",1628,2,1057.0,https://phoenix.craigslist.org/wvl/apa/d/avondale-amazing-amenities-can-be-yours/7507998078.html
2022-07-12 13:53," (5740 N 59th Ave, Glendale, AZ)",YOU + This Apartment = HOME,1550,2,926.0,https://phoenix.craigslist.org/wvl/apa/d/glendale-you-this-apartment-home/7500401179.html
2022-07-12 13:53, (Phoenix),WELCOME HOME!!!!!!!,1450,1,,https://phoenix.craigslist.org/wvl/apa/d/phoenix-welcome-home/7507998004.html
2022-07-12 13:53, (Scottsdale),"Pet friendly, great location, affordable low rates, immediate move in!",1750,2,840.0,https://phoenix.craigslist.org/evl/apa/d/scottsdale-pet-friendly-great-location/7507997911.html
2022-07-12 13:52," (8400 Virginia Ave, Phoenix, AZ)","Quartz Countertops, Farm House Deep Kitchen Sinks, Walk In Closets",1538,1,722.0,https://phoenix.craigslist.org/wvl/apa/d/phoenix-quartz-countertops-farm-house/7505486396.html
2022-07-12 13:51, (Phoenix),COME HOME TO ARBOR CREEK!!!!!!!!!!!,1450,1,,https://phoenix.craigslist.org/wvl/apa/d/phoenix-come-home-to-arbor-creek/7507997411.html
2022-07-12 13:51," (North Scottsdale, REDUCED, this won't last long!)","24 hour fitness center, walk in closets, private patio",1899,2,,https://phoenix.craigslist.org/nph/apa/d/scottsdale-24-hour-fitness-center-walk/7507997377.html
2022-07-12 13:51, (central/south phx),7th St & Osborn - Furnished 2 Bed/2Bath - NO Credit Checks,645,2,,https://phoenix.craigslist.org/cph/apa/d/phoenix-7th-st-osborn-furnished-bed/7502940320.html
2022-07-12 13:51, (east valley),"Large Bedrooms, Built-In Microwave Select Units, Business Center",1615,2,1144.0,https://phoenix.craigslist.org/evl/apa/d/mesa-large-bedrooms-built-in-microwave/7507979771.html
2022-07-12 13:51," (Central Phoenix, July move in)","Garage parking, Zen garden and lush landscaping",1660,1,,https://phoenix.craigslist.org/cph/apa/d/phoenix-garage-parking-zen-garden-and/7498964176.html
2022-07-12 13:51, (East Valley),Don't Let Credit Issues Get In The Way Of Finding Your New Place!!,1595,2,,https://phoenix.craigslist.org/evl/apa/d/dont-let-credit-issues-get-in-the-way/7498299291.html
2022-07-12 13:51, (East Valley EXPERTS),NEED TO FIND AN APARTMENT?  WE MAKE IT EASY!  FREE SERVICE!,1595,2,,https://phoenix.craigslist.org/evl/apa/d/need-to-find-an-apartment-we-make-it/7497533944.html
2022-07-12 13:51, (In the heart of Phoenix),"Floor to ceiling windows, New and fabulous! Reduced!",1695,1,,https://phoenix.craigslist.org/cph/apa/d/phoenix-floor-to-ceiling-windows-new/7504723071.html
2022-07-12 13:51, (Chandler / Ocotillo Bay),"Available NOW, Split 2 Bedroom Floorplan, 1st Floor!!!",1899,2,1055.0,https://phoenix.craigslist.org/evl/apa/d/chandler-available-now-split-bedroom/7507997068.html
2022-07-12 13:51, (Mesa / Tempe / Phoenix / Scottsdale),YAY - KEEP YOUR PET!! ***LOW DEPOSITS ***Call Apartment Options!!***,1545,2,900.0,https://phoenix.craigslist.org/evl/apa/d/mesa-yay-keep-your-pet-low-deposits/7503305881.html
2022-07-12 13:50, (East Valley),We LOVE OUR VETERANS - RENT-TO-OWN/BUY/OR RENT TODAY!,1695,2,,https://phoenix.craigslist.org/evl/apa/d/we-love-our-veterans-rent-to-own-buy-or/7497532463.html
2022-07-12 13:50, (Mesa - Tempe - Chandler - Ahwatukee - Gilbert),APPROVAL HASSLE FREE - PERFECT CREDIT NOT REQUIRED - PET FRIENDLY,2250,3,,https://phoenix.craigslist.org/evl/apa/d/mesa-approval-hassle-free-perfect/7506482505.html
2022-07-12 13:50, (Scottsdale),"Low rates, affordable move in cost. Hurry today and apply!!",1750,2,840.0,https://phoenix.craigslist.org/evl/apa/d/scottsdale-low-rates-affordable-move-in/7507996945.html
2022-07-12 13:50," (Downtown Phoenix, Move in July)","Brand New, Pet Friendly with beautiful Finishes",1799,1,,https://phoenix.craigslist.org/cph/apa/d/phoenix-brand-new-pet-friendly-with/7507996947.html
2022-07-12 13:50, (Phoenix),MOVE IN TODAY!!!!!!!!!!!!,1450,1,,https://phoenix.craigslist.org/wvl/apa/d/phoenix-move-in-today/7507996868.html
2022-07-12 13:49, (Phoenix),APPROVED!!!!!!!!!!!,1450,1,,https://phoenix.craigslist.org/wvl/apa/d/phoenix-approved/7507996205.html
2022-07-12 13:49, (east valley),"Open patios, Dishwasher, 24 Hour Emergency Maintenance",1800,2,919.0,https://phoenix.craigslist.org/evl/apa/d/mesa-open-patios-dishwasher-24-hour/7507996134.html
2022-07-12 13:48," (164 N 74th St, Mesa, AZ)",So I'll Leave You With My Best Advice...CALL ME!!!,1570,2,965.0,https://phoenix.craigslist.org/cph/apa/d/mesa-so-ill-leave-you-with-my-best/7507986043.html
2022-07-12 13:48, (west valley),SAY 🤗HELLO🤗TO YOUR FUTURE HOME AT ZINC!!,1623,2,1057.0,https://phoenix.craigslist.org/wvl/apa/d/avondale-say-helloto-your-future-home/7507995894.html
2022-07-12 13:48, (North Scottsdale),"Salt Water Pools, 9' Ceilings, Granite, Stainless",2088,2,,https://phoenix.craigslist.org/nph/apa/d/salt-water-pools-ceilings-granite/7507995880.html
2022-07-12 13:47, (North Phoenix/Scottsdale),"Furnished,includes all utilities,TV,club house,Gym,pool,concierg,gate",1999,1,875.0,https://phoenix.craigslist.org/nph/apa/d/phoenix-furnishedincludes-all/7504419888.html
2022-07-12 13:47, (Phoenix),1 BEDROOM APARTMENT UTILITIES INCLUDED!!!!!!!!!!,1450,1,,https://phoenix.craigslist.org/wvl/apa/d/phoenix-bedroom-apartment-utilities/7507995322.html
2022-07-12 13:47," (Central Phoenix, July move in, two bedrooms also available)","Garage parking, Zen garden and lush landscaping, Dog Park",1660,1,,https://phoenix.craigslist.org/cph/apa/d/phoenix-garage-parking-zen-garden-and/7500383756.html
2022-07-12 13:46," (In the heart of Phoenix, June move in)","Granite, stainless, walk-in closets, plank flooring, game room",1995,2,,https://phoenix.craigslist.org/cph/apa/d/phoenix-granite-stainless-walk-in/7496942254.html
2022-07-12 13:46, (North Scottsdale),"One Month FREE,Two car attached garage, Stunning off the 101 and NEW!!",2850,3,1585.0,https://phoenix.craigslist.org/nph/apa/d/one-month-freetwo-car-attached-garage/7498987903.html
2022-07-12 13:46," (Downtown Phoenix, 12 month lease)","Brand New, Pet Friendly with beautiful Finishes",1775,1,,https://phoenix.craigslist.org/cph/apa/d/phoenix-brand-new-pet-friendly-with/7498577313.html
2022-07-12 13:46, (Central Phoenix),"New, Rooftop Lounge with city views, gas cooking",1799,1,,https://phoenix.craigslist.org/cph/apa/d/phoenix-new-rooftop-lounge-with-city/7499521462.html
2022-07-12 13:46," (North Scottsdale, easy freeway access)","4 weeks FREE, Granite, Tiled Backsplash, Resort Inspired Pools/Spa",1581,1,,https://phoenix.craigslist.org/nph/apa/d/scottsdale-weeks-free-granite-tiled/7507995071.html
2022-07-12 13:46," (8650 W Peoria Ave, Phoenix, AZ)","BBQ/Picnic Area Adjacent to Central Rec, Fitness Center, Wall Accents",1270,1,695.0,https://phoenix.craigslist.org/wvl/apa/d/peoria-bbq-picnic-area-adjacent-to/7504065566.html
2022-07-12 13:46, (Mid Town),"$$Move-In Special Utilities, Cable-WiFi included., Gated Community$$",869,,300.0,https://phoenix.craigslist.org/cph/apa/d/phoenix-move-in-special-utilities-cable/7505451668.html
2022-07-12 13:46, (east valley),2BR - Available To Pre Lease!,1700,2,960.0,https://phoenix.craigslist.org/evl/apa/d/chandler-2br-available-to-pre-lease/7498343792.html
2022-07-12 13:45, (Avondale),"Professional Management, Brushed Nickel Finishes Throughout*",1745,2,1058.0,https://phoenix.craigslist.org/wvl/apa/d/cashion-professional-management-brushed/7507982243.html
2022-07-12 13:45, (Phoenix),"Leasing Now, Detached Garages, Pool and Hot Tub",1650,2,962.0,https://phoenix.craigslist.org/evl/apa/d/phoenix-leasing-now-detached-garages/7507994453.html
2022-07-12 13:44, (Glendale),We got what you need.. Look & Lease Today,1285,1,525.0,https://phoenix.craigslist.org/nph/apa/d/phoenix-we-got-what-you-need-look-lease/7507994181.html
2022-07-12 13:44, (phoenix),1 bedroom BLOW OUT!!! $499 move in,1475,1,,https://phoenix.craigslist.org/evl/apa/d/phoenix-bedroom-blow-out-499-move-in/7507994096.html
2022-07-12 13:44, (central/south phx),"1B/1B, Polished quartz countertops, 9-foot ceilings",1578,1,796.0,https://phoenix.craigslist.org/cph/apa/d/phoenix-1b-1b-polished-quartz/7499828557.html
2022-07-12 13:43, (Tempe),"Credit Cards Accepted, Ceiling Fan(s), Copy/Fax Available",1369,1,630.0,https://phoenix.craigslist.org/evl/apa/d/tempe-credit-cards-accepted-ceiling/7507993680.html
2022-07-12 13:42, (Goodyear),You'll fall in love with these Brand New Homes! 😍🙌 Call today to tou,2025,2,1205.0,https://phoenix.craigslist.org/wvl/apa/d/goodyear-youll-fall-in-love-with-these/7507976013.html
2022-07-12 13:41, (west valley),"Designer Faucets, Barbecue Area, Kitchen Pantry and Island",1740,1,668.0,https://phoenix.craigslist.org/wvl/apa/d/peoria-designer-faucets-barbecue-area/7506489930.html
2022-07-12 13:38, (15 Minute Drive to Arizona Museum of Natural History),We love your pets! They'll love Arches at Hidden Creek Apartments! Tour today!,1961,2,948.0,https://phoenix.craigslist.org/evl/apa/d/chandler-we-love-your-pets-theyll-love/7507991296.html
2022-07-12 13:38, (10 Minute Drive to Dreamy Draw Recreation Area),You'll love our great amenities at North Mountain Apartments!,1225,1,557.0,https://phoenix.craigslist.org/nph/apa/d/phoenix-youll-love-our-great-amenities/7507991264.html
2022-07-12 13:37, (Phoenix),Welcome Home to Arbor Creek!!!,1450,1,,https://phoenix.craigslist.org/wvl/apa/d/phoenix-welcome-home-to-arbor-creek/7507990904.html
2022-07-12 13:37, (Chandler),"Spacious 2 Bed, 2 Bath. 988 SqFt! Wonderful community! Visit today!",1985,2,988.0,https://phoenix.craigslist.org/evl/apa/d/chandler-spacious-bed-bath-988-sqft/7507990819.html
2022-07-12 13:36, (2475 W Pecos Rd),"Stainless-Steel Appliance Packages*, Minutes to Downtown Chandler",1727,1,850.0,https://phoenix.craigslist.org/evl/apa/d/chandler-stainless-steel-appliance/7507990450.html
2022-07-12 13:36, (Phoenix),ONLY 1 LEFT!!!!!!!!!!,1450,1,,https://phoenix.craigslist.org/wvl/apa/d/phoenix-only-left/7507990436.html
2022-07-12 13:36, (west valley),"Breakfast Bar, Extra Storage (up to two on patios)",1150,1,528.0,https://phoenix.craigslist.org/wvl/apa/d/glendale-breakfast-bar-extra-storage-up/7507990402.html
2022-07-12 13:35, (Gilbert),4 Sparkling pools & wonderful 2x2 unit to call home!,1550,2,1000.0,https://phoenix.craigslist.org/evl/apa/d/mesa-sparkling-pools-wonderful-2x2-unit/7507990136.html
2022-07-12 13:35," (6451 W Bell Rd Glendale, AZ)",FULLY RENOVATED 1 BEDROOM 1 BATH AVAILABLE NOW!! MOVE IN TODAY!!,1575,1,627.0,https://phoenix.craigslist.org/wvl/apa/d/glendale-fully-renovated-bedroom-bath/7507972711.html
2022-07-12 13:34, (Phoenix),Come Check Us Out!!! Arbor Creek Apartments*Call Us Today!!!,1450,1,,https://phoenix.craigslist.org/wvl/apa/d/phoenix-come-check-us-out-arbor-creek/7507989795.html
2022-07-12 13:34, (east valley),"Gated Community, Swimming Pool, Laundry Facilities",924,,392.0,https://phoenix.craigslist.org/evl/apa/d/phoenix-gated-community-swimming-pool/7507989784.html
2022-07-12 13:34," (17447 N. Avenue of the Arts, Surprise, AZ)",Looking for a 3X2 for immediate move in? Your search is over!!!,2181,3,1183.0,https://phoenix.craigslist.org/wvl/apa/d/surprise-looking-for-3x2-for-immediate/7503137498.html
2022-07-12 13:33, (Phoenix),Arbor Creek Apartments Wants You To Come Join Our Family!!!,1450,1,,https://phoenix.craigslist.org/wvl/apa/d/phoenix-arbor-creek-apartments-wants/7507989195.html
2022-07-12 13:33, (phx north),"Newly Renovated Kitchen*, Complimentary Coffee Bar, Garages Availablle",2192,3,1147.0,https://phoenix.craigslist.org/nph/apa/d/phoenix-newly-renovated-kitchen/7507988883.html
2022-07-12 13:32, (Mesa),SILVER CREEK APARTMENTS,1250,1,,https://phoenix.craigslist.org/evl/apa/d/mesa-silver-creek-apartments/7507988754.html
2022-07-12 13:32, (Phoenix),EVICTIONS WELCOME!!!!!!!!,1450,1,,https://phoenix.craigslist.org/wvl/apa/d/phoenix-evictions-welcome/7507988712.html
2022-07-12 13:31, (Tempe),"Storage Space, Playground, Walking Closet, Business Center",1845,2,800.0,https://phoenix.craigslist.org/evl/apa/d/tempe-storage-space-playground-walking/7507988383.html
2022-07-12 13:31, (Midtown Phoenix),"Stainless Steel Appliances, Refs W/ Bottom Mount Freezers, Bike Shop",2563,2,1154.0,https://phoenix.craigslist.org/nph/apa/d/phoenix-stainless-steel-appliances-refs/7507979431.html
2022-07-12 13:31, (Mesa),"MILES MOTEL- POOL, WIFI,  (Mesa Az)",79,1,,https://phoenix.craigslist.org/evl/apa/d/mesa-miles-motel-pool-wifi-mesa-az/7507988222.html
2022-07-12 13:31, (east valley),Furnished Condos Phoenix,3899,2,,https://phoenix.craigslist.org/evl/apa/d/furnished-condos-phoenix/7506196104.html
2022-07-12 13:30," (5750 N 59th Ave, Glendale, AZ)",Need A 2 Bedroom?! We Got One!,1489,2,900.0,https://phoenix.craigslist.org/wvl/apa/d/glendale-need-2-bedroom-we-got-one/7506280354.html
2022-07-12 13:30, (Chandler),There Is No Place Like Home here at Towne Square Apartment Homes!,1695,2,940.0,https://phoenix.craigslist.org/evl/apa/d/chandler-there-is-no-place-like-home/7507987821.html
2022-07-12 13:30, (Mesa),SILVER CREEK APARTMENTS,1250,1,,https://phoenix.craigslist.org/evl/apa/d/mesa-silver-creek-apartments/7507987663.html
2022-07-12 13:30," (20808 North 27th Avenue, Phoenix, AZ)","2B/2B, Separate dining area, Phoenix AZ",1617,2,1033.0,https://phoenix.craigslist.org/cph/apa/d/phoenix-2b-2b-separate-dining-area/7500057703.html
2022-07-12 13:29, (east valley),"Uncovered Parking Available, Brand New Ronovations, Brick Walls",1099,,420.0,https://phoenix.craigslist.org/evl/apa/d/phoenix-uncovered-parking-available/7507987351.html
2022-07-12 13:29," (164 N 74th St, Mesa, AZ)",Work from your new home today. We have the WIfi,1470,2,965.0,https://phoenix.craigslist.org/cph/apa/d/mesa-work-from-your-new-home-today-we/7497551654.html
2022-07-12 13:28, (central/south phx),"Guest Laundromat On Site, Free Utilities, Siegel Rewards Program",314,1,,https://phoenix.craigslist.org/cph/apa/d/casa-grande-guest-laundromat-on-site/7507102731.html
2022-07-12 13:27, (east valley),"2bd 2.5ba, Oversized walk-in closets, Carpeting Select units",1990,2,1314.0,https://phoenix.craigslist.org/evl/apa/d/mesa-2bd-25ba-oversized-walk-in-closets/7499497717.html
2022-07-12 13:27, (McDowell Mountain Ranch),"Picnic Ramadas with Barbecue Grills, Resident Guest Suites Available",1932,1,916.0,https://phoenix.craigslist.org/nph/apa/d/scottsdale-picnic-ramadas-with-barbecue/7507982230.html
2022-07-12 13:27," (220 W Bell Rd Phoenix, AZ)",Make Cyprus Your Now Home!,1320,1,720.0,https://phoenix.craigslist.org/nph/apa/d/phoenix-make-cyprus-your-now-home/7507981214.html
2022-07-12 13:27," (9680 W Olive Ave, Peoria, AZ)","Spa, Create Your Own Front Yard Retreat, Washer & Dryer in Every Home",2132,2,1000.0,https://phoenix.craigslist.org/wvl/apa/d/peoria-spa-create-your-own-front-yard/7505512996.html
2022-07-12 13:27, (Scottsdale),"Central Air Conditioning and Heat, New Modern Lighting*",2241,3,1223.0,https://phoenix.craigslist.org/evl/apa/d/scottsdale-central-air-conditioning-and/7507980113.html
2022-07-12 13:26, (Mesa),"Custom Cabinetry, Fitness Center, Professional Management",1700,2,971.0,https://phoenix.craigslist.org/evl/apa/d/mesa-custom-cabinetry-fitness-center/7507986127.html
2022-07-12 13:26, (Mesa),Move in now,1540,3,1540.0,https://phoenix.craigslist.org/evl/apa/d/mesa-move-in-now/7507985895.html
2022-07-12 13:26, (Tempe Az),beautiful 2x2 BD available immediate move in,2461,2,1181.0,https://phoenix.craigslist.org/evl/apa/d/tempe-beautiful-2x2-bd-available/7507985818.html
2022-07-12 13:26, (Phoenix),"Leasing Now, Controlled Access, BBQ Picnic Area",2760,3,1292.0,https://phoenix.craigslist.org/cph/apa/d/phoenix-leasing-now-controlled-access/7507985816.html
2022-07-12 13:25, (North Phoenix),One Bedroom W/ A Beautiful Pool View- Reduced Rate-Available September,1276,1,620.0,https://phoenix.craigslist.org/nph/apa/d/phoenix-one-bedroom-a-beautiful-pool/7507985683.html
2022-07-12 13:25," (5740 N 59th Ave, Glendale, AZ)","Downstairs one bedroom, ready to move in!",1242,1,540.0,https://phoenix.craigslist.org/wvl/apa/d/glendale-downstairs-one-bedroom-ready/7507976454.html
2022-07-12 13:24, (Mesa / Tempe / Phoenix / Scottsdale),YAY - KEEP YOUR PET!! ***LOW DEPOSITS ***Call Apartment Options!!***,1545,2,900.0,https://phoenix.craigslist.org/evl/apa/d/mesa-yay-keep-your-pet-low-deposits/7505620320.html
2022-07-12 13:24, (Mesa),Mesa Two Bedroom Apt,1115,2,775.0,https://phoenix.craigslist.org/evl/apa/d/tempe-mesa-two-bedroom-apt/7506289809.html
2022-07-12 13:24, (Tempe/Mesa/Chandler/Gilbert/Ahwatukee),"Are You On The Hunt For a 1, 2, or 3 Bedroom in the East Valley?",2125,3,1200.0,https://phoenix.craigslist.org/evl/apa/d/mesa-are-you-on-the-hunt-for-1-or/7498298546.html
2022-07-12 13:24, (Chandler),"Comfortable 811 sq ft 1 bd, 1 ba for all your needs. Call us now!",1620,1,811.0,https://phoenix.craigslist.org/evl/apa/d/chandler-comfortable-811-sq-ft-bd-ba/7507985184.html
2022-07-12 13:24, (east valley),"Build Your Credit with RentPlus, Covered Parking Available, Courtyard",1432,2,810.0,https://phoenix.craigslist.org/evl/apa/d/mesa-build-your-credit-with-rentplus/7499769435.html
2022-07-12 13:24, (East Valley - Chandler/Tempe/Mesa/Ahwatukee),Budget or Luxury Apartment?  You Decide!  We Make It Easy!,1595,2,,https://phoenix.craigslist.org/evl/apa/d/mesa-budget-or-luxury-apartment-you/7497802090.html
2022-07-12 13:24, (East Valley EXPERTS - Mesa/Tempe/Ahwatukee),END THE STRUGGLE - LEAVE THE SEARCH TO US! GET APPROVED TODAY!,2275,3,,https://phoenix.craigslist.org/evl/apa/d/end-the-struggle-leave-the-search-to-us/7506482965.html
2022-07-12 13:24, (East Valley),NEED A NEW APARTMENT? We make it Easy! 100% FREE SERVICE!,2295,3,,https://phoenix.craigslist.org/evl/apa/d/need-new-apartment-we-make-it-easy-100/7499535126.html
2022-07-12 13:24," (600 West Grove Parkway Tempe, AZ)",Stunning One Bedroom Available Today!,1650,1,797.0,https://phoenix.craigslist.org/evl/apa/d/tempe-stunning-one-bedroom-available/7507985072.html
2022-07-12 13:24, (Scottsdale),"Sizzling move in special apply today lease today, ask us how!",1750,2,840.0,https://phoenix.craigslist.org/evl/apa/d/scottsdale-sizzling-move-in-special/7507984863.html
2022-07-12 13:23, (east valley),"Dishwasher, Separate Dining Area, Fitness Center",1200,1,744.0,https://phoenix.craigslist.org/evl/apa/d/mesa-dishwasher-separate-dining-area/7506803133.html
2022-07-12 13:23," (220 W Bell Rd Phoenix, AZ)",Luxury Living No Security Deposits Near 101,1780,2,1006.0,https://phoenix.craigslist.org/nph/apa/d/phoenix-luxury-living-no-security/7507980257.html
2022-07-12 13:22," (5740 N 59th Ave, Glendale, AZ)",Ready to move? One bedroom ready for you!,1232,1,540.0,https://phoenix.craigslist.org/wvl/apa/d/glendale-ready-to-move-one-bedroom/7506379868.html
2022-07-12 13:21," (9680 W Olive Ave, Peoria, AZ)","Lush Greenways, Oversized Closets, Washer & Dryer in Every Home",1774,2,900.0,https://phoenix.craigslist.org/wvl/apa/d/peoria-lush-greenways-oversized-closets/7507983680.html
2022-07-12 13:21, (Gilbert),"Playground, High-speed Internet Access, Heated Swimming Pool and Spa",1525,2,960.0,https://phoenix.craigslist.org/evl/apa/d/gilbert-playground-high-speed-internet/7507983587.html
2022-07-12 13:21, (Phoenix),"On Site Management, In-Door Basketball Court, On Site Maintenance",1400,2,911.0,https://phoenix.craigslist.org/nph/apa/d/phoenix-on-site-management-in-door/7507979201.html
2022-07-12 13:21, (east valley),"Package Receiving, Cable or Satellite Connections, Dishwasher",1370,1,496.0,https://phoenix.craigslist.org/evl/apa/d/scottsdale-package-receiving-cable-or/7507983497.html
2022-07-12 13:21," (510 East McKellips Road, Mesa Arizona)","2 Bed, 2 Bath! Private Patio, 1st Floor, wash/dry, gated.",1573,3,874.0,https://phoenix.craigslist.org/evl/apa/d/mesa-bed-bath-private-patio-1st-floor/7506863304.html
2022-07-12 13:20, (Tempe),"Close to Park, Private Balcony/Patio, Close to Dog Park",1899,1,920.0,https://phoenix.craigslist.org/cph/apa/d/tempe-close-to-park-private-balcony/7507983225.html
2022-07-12 13:20, (Scottsdale),"Access to Public Transportation, Beautiful Landscaping",2370,3,1162.0,https://phoenix.craigslist.org/evl/apa/d/scottsdale-access-to-public/7507983163.html
2022-07-12 13:20, (Phoenix),"Courtyard View Available, Private Balcony, Pool View Available",1695,2,904.0,https://phoenix.craigslist.org/nph/apa/d/phoenix-courtyard-view-available/7507983123.html
2022-07-12 13:20," (Mesa, AZ)","Granite-style counters*, Online Maintenance Requests, Gated Community",1100,1,550.0,https://phoenix.craigslist.org/evl/apa/d/mesa-granite-style-counters-online/7507983084.html
2022-07-12 13:20, (Phoenix),Weekly Special Starting at $424 (Phoenix),424,,,https://phoenix.craigslist.org/cph/apa/d/phoenix-weekly-special-starting-at-424/7507977710.html
2022-07-12 13:19, (Scottsdale),"Undermount large, single basin stainless sink, Virtual tours",2599,1,1089.0,https://phoenix.craigslist.org/nph/apa/d/scottsdale-undermount-large-single/7507982860.html
2022-07-12 13:19, (east valley),"2/bd, Oversized walk-in closets, BBQ/picnic area",1681,2,1054.0,https://phoenix.craigslist.org/evl/apa/d/tempe-bd-oversized-walk-in-closets-bbq/7505857578.html
2022-07-12 13:19, (Scottsdale),"All the Amenities, Elegant Clubhouse, Townhome Community",3365,3,1499.0,https://phoenix.craigslist.org/evl/apa/d/scottsdale-all-the-amenities-elegant/7507976720.html
2022-07-12 13:19," (Phoenix, Arizona)","Covered Parking, Swimming Pool, Fireplace, Professional Landscaping",1249,1,650.0,https://phoenix.craigslist.org/cph/apa/d/phoenix-covered-parking-swimming-pool/7507982640.html
2022-07-12 13:19, (Glendale),"Fitness Center, Garage Parking*, Swimming Pool, Patio/Balcony",1500,1,834.0,https://phoenix.craigslist.org/nph/apa/d/phoenix-fitness-center-garage-parking/7507982509.html
2022-07-12 13:18, (Mesa),"Clubhouse, Spacious Floor Plans, Private Patio or Balcony",1605,2,956.0,https://phoenix.craigslist.org/evl/apa/d/mesa-clubhouse-spacious-floor-plans/7507982191.html
2022-07-12 13:18, (Paradise Valley),"New countertops, Courtyard views, Close proximity to public transit",1415,1,637.0,https://phoenix.craigslist.org/nph/apa/d/phoenix-new-countertops-courtyard-views/7507982169.html
2022-07-12 13:18, (Mesa),"Package Receiving, Sundeck, Washer/Dryer, Cable Ready",1595,2,961.0,https://phoenix.craigslist.org/evl/apa/d/mesa-package-receiving-sundeck-washer/7507976037.html
2022-07-12 13:18, (phx north),"Car Port, Courtyard, Cable/Satellite",1321,2,885.0,https://phoenix.craigslist.org/nph/apa/d/phoenix-car-port-courtyard-cable/7502692277.html
2022-07-12 13:18, (east valley),"2B/2B, Oversized walk-in closets, Situated in Phoenix!",1894,2,1003.0,https://phoenix.craigslist.org/evl/apa/d/phoenix-2b-2b-oversized-walk-in-closets/7500670764.html
2022-07-12 13:18, (Tempe),"Convenient Location, Extra Storage, Garbage Disposal",1570,1,615.0,https://phoenix.craigslist.org/evl/apa/d/tempe-convenient-location-extra-storage/7507981982.html
2022-07-12 13:18, (Tempe),"BBQ Gas Grills/Picnic Area, Modernized Designer Finishes",1775,3,1000.0,https://phoenix.craigslist.org/cph/apa/d/tempe-bbq-gas-grills-picnic-area/7507981972.html
2022-07-12 13:17, (Tempe),"Resort-Style Pool and Spa, Spa bathrooms with soaking tubs*",2589,2,1128.0,https://phoenix.craigslist.org/cph/apa/d/tempe-resort-style-pool-and-spa-spa/7507981763.html
2022-07-12 13:17, (Phoenix),"Walk In Closet, 24-Hour Availability, Pool, Gated Community",1599,2,1100.0,https://phoenix.craigslist.org/cph/apa/d/phoenix-walk-in-closet-24-hour/7507981653.html
2022-07-12 13:17, (Mesa),"Ceiling Fan(s), Convenient Location, Close to Major Schools",1685,2,1062.0,https://phoenix.craigslist.org/evl/apa/d/mesa-ceiling-fans-convenient-location/7507981562.html
2022-07-12 13:17, (Tempe),Una recama accesible lista para moverse utilidades gratis inc,1450,1,,https://phoenix.craigslist.org/evl/apa/d/tempe-una-recama-accesible-lista-para/7507981549.html
2022-07-12 13:17, (Chandler),"Refrigerator, Dishwasher, Window Coverings, Designer Upgrades *",1800,2,925.0,https://phoenix.craigslist.org/cph/apa/d/tempe-refrigerator-dishwasher-window/7507981483.html
2022-07-12 13:17, (Tempe),"Vertical Blinds, Beautiful Landscaping, On-site Maintenance",1321,2,910.0,https://phoenix.craigslist.org/cph/apa/d/tempe-vertical-blinds-beautiful/7507978514.html
2022-07-12 13:16, (Glendale),You'll fit right in!👌❤️️,1807,1,624.0,https://phoenix.craigslist.org/nph/apa/d/glendale-youll-fit-right-in/7507981430.html
2022-07-12 13:16, (east valley),1/2 Month Off 1st Months Rent + Look & Look Lease,1500,2,900.0,https://phoenix.craigslist.org/evl/apa/d/chandler-2-month-off-1st-months-rent/7507981231.html
2022-07-12 13:16, (Phoenix),Newly Remodeled 2 Bed 2 Bath for Immediate Move-in!!,1800,2,950.0,https://phoenix.craigslist.org/wvl/apa/d/phoenix-newly-remodeled-bed-bath-for/7507981216.html
2022-07-12 13:16," (North Phoenix, Paradise Valley)","Large two bedroom, walk-in closets, washer & dryer",1899,2,,https://phoenix.craigslist.org/nph/apa/d/phoenix-large-two-bedroom-walk-in/7498251119.html
2022-07-12 13:16, (Scottsdale),"Community room, kitchen, TV, Dishwashers, Lush mature landscaping",1450,1,695.0,https://phoenix.craigslist.org/evl/apa/d/scottsdale-community-room-kitchen-tv/7507981192.html
2022-07-12 13:16," (McCormick Ranch/Scottsdale, 6-12 month leases)","REDUCED, Walk on the green belt, nears shops, dining, golf course",2080,2,1167.0,https://phoenix.craigslist.org/evl/apa/d/scottsdale-reduced-walk-on-the-green/7498251773.html
2022-07-12 13:16," (77 W Coolidge St, Phoenix, AZ)","Spacious Patio, Modern Design, Walking Distance to Light Rail",1575,2,976.0,https://phoenix.craigslist.org/cph/apa/d/phoenix-spacious-patio-modern-design/7506351275.html
