date_time,town,title,price,beds,sqft,url
2022-07-12 10:50," (10710 17th Avenue South, Tacoma, WA)",Coming Soon! One Bed! Pool! Gym! Deposit Free Community!!,1396,1,760.0,https://seattle.craigslist.org/est/apa/d/tacoma-coming-soon-one-bed-pool-gym/7506347032.html
2022-07-12 10:50, (Redmond),"Come Look and Lease, Barbeque Grills, Wifi Lounge",2373,1,779.0,https://seattle.craigslist.org/est/apa/d/redmond-come-look-and-lease-barbeque/7507908893.html
2022-07-12 10:49, (Bothell),Come Home With Confidence! You'll Love This Town Home At Willina Ranch,3235,3,1360.0,https://seattle.craigslist.org/est/apa/d/bothell-come-home-with-confidence-youll/7507908471.html
2022-07-12 10:49," (9624 Frontier Ave SE Snoqualmie, WA)",Beautiful 1 Bedroom 1 Bath Unit Available for Pre-Lease!!,1622,1,821.0,https://seattle.craigslist.org/see/apa/d/preston-beautiful-bedroom-bath-unit/7507908343.html
2022-07-12 10:49, (Kirkland),Kirkland Home for Lease - 3 BR 2.5 Bath + Office,4500,3,2200.0,https://seattle.craigslist.org/est/apa/d/kirkland-kirkland-home-for-lease-br-25/7507908264.html
2022-07-12 10:49," (2624 Western Avenue, Seattle, WA)","Short term leases AVAILABLE! Belltown Studio, Fully-equipped kitchen",1249,,300.0,https://seattle.craigslist.org/see/apa/d/seattle-short-term-leases-available/7506518170.html
2022-07-12 10:48, (West Seattle),Open and spacious urban 1x1 available now! Tour today!,1825,1,662.0,https://seattle.craigslist.org/see/apa/d/seattle-open-and-spacious-urban-1x1/7507907917.html
2022-07-12 10:48, (south king co),"Seasonal Outdoor Pool, Garbage Disposal, Private Patio or Balcony",1654,1,674.0,https://seattle.craigslist.org/skc/apa/d/kent-seasonal-outdoor-pool-garbage/7507907669.html
2022-07-12 10:48, (tacoma / pierce),"Refrigerator, Clubhouse, View, Extra Storage",1844,1,725.0,https://seattle.craigslist.org/tac/apa/d/milton-refrigerator-clubhouse-view/7507907626.html
2022-07-12 10:47, (Kent),"2x2 Gardner loft style, 3rd floor, Pet-Friendly available 8/31/2022",2170,2,1172.0,https://seattle.craigslist.org/skc/apa/d/kent-2x2-gardner-loft-style-3rd-floor/7507898816.html
2022-07-12 10:47," (Kent, Auburn, Renton, Sea-Tac, Seattle, Maple Valley)","Fireplace, Carport, On-Site Maintenance, Carpeting",1766,1,750.0,https://seattle.craigslist.org/skc/apa/d/kent-fireplace-carport-on-site/7507907204.html
2022-07-12 10:47, (Tacoma WA),"Fitness Center, Large Gourmet Kitchen, Oversized Walk-In Closets",1701,2,907.0,https://seattle.craigslist.org/tac/apa/d/tacoma-fitness-center-large-gourmet/7506290279.html
2022-07-12 10:46, (Belltown),"Full size washer and dryer, Private balcony*, Breakfast bar*",2129,,527.0,https://seattle.craigslist.org/see/apa/d/seattle-full-size-washer-and-dryer/7507907004.html
2022-07-12 10:46," (Sunrise, Puyallup)","This Bottom-Floor, Corner Home is Calling Your Name! Apply Today!",2095,1,823.0,https://seattle.craigslist.org/tac/apa/d/puyallup-this-bottom-floor-corner-home/7507906925.html
2022-07-12 10:46," (1610 West James Place, Kent, WA)","Life-Size Foosball, Patio",1728,,500.0,https://seattle.craigslist.org/see/apa/d/seattle-life-size-foosball-patio/7496252321.html
2022-07-12 10:46, (south king co),Cut Down on Those Move-In Costs with $300 Off!!,2334,2,940.0,https://seattle.craigslist.org/skc/apa/d/seattle-cut-down-on-those-move-in-costs/7507906881.html
2022-07-12 10:46, (seattle),"City Views and Water Views, Additional Storage Available, Pet Friendly",1647,,358.0,https://seattle.craigslist.org/see/apa/d/seattle-city-views-and-water-views/7507906872.html
2022-07-12 10:46," (255 Lenora St, Seattle, WA)",3 Bed 2 Bath - 9ft Windows! In-house bartender on our 35th floor!,10430,3,1666.0,https://seattle.craigslist.org/see/apa/d/seattle-bed-bath-9ft-windows-in-house/7499110078.html
2022-07-12 10:46, (Seattle),Conveniently Located Studio Close To Freeways For An Easy Commute!!,1699,,443.0,https://seattle.craigslist.org/see/apa/d/seattle-conveniently-located-studio/7507906603.html
2022-07-12 10:45," (1100 University St Seattle, WA)",Amazing City and Water VIEWS!! Schedule a tour TODAY!,3768,2,1101.0,https://seattle.craigslist.org/see/apa/d/seattle-amazing-city-and-water-views/7507906512.html
2022-07-12 10:44, (Tacoma),"Tacoma, Hardwood, SS Appliances, Parking",975,1,621.0,https://seattle.craigslist.org/tac/apa/d/tacoma-tacoma-hardwood-ss-appliances/7502005139.html
2022-07-12 10:43, (Tacoma),"Tacoma Duplex, Hardwood, Stainless Appliances, W/D",1495,2,900.0,https://seattle.craigslist.org/tac/apa/d/tacoma-tacoma-duplex-hardwood-stainless/7503760985.html
2022-07-12 10:43," (416 111th Street Court East, Tacoma, WA)","Zero Deposit Community, Dishwasher & Disposal, Walk-In Pantry",2198,3,1150.0,https://seattle.craigslist.org/tac/apa/d/tacoma-zero-deposit-community/7502977253.html
2022-07-12 10:43, (seattle),"6th Floor, Balcony, Courtyard View, Available 9/6",2185,,,https://seattle.craigslist.org/see/apa/d/seattle-6th-floor-balcony-courtyard/7507905267.html
2022-07-12 10:42, (snohomish county),"AvalonConnect Technology Package, Pet Friendly, Parking",2255,2,966.0,https://seattle.craigslist.org/sno/apa/d/bothell-avalonconnect-technology/7502705487.html
2022-07-12 10:42," (11301 3rd AVE NE, Seattle, WA)","LIVE RENT FREE FOR 1 MONTH! Pet Friendly, Close to Restaurants",1996,1,648.0,https://seattle.craigslist.org/see/apa/d/seattle-live-rent-free-for-month-pet/7500843012.html
2022-07-12 10:42, (Bothell),Quality Living Starts Here! 2x2 At Willina Ranch!,2702,2,1104.0,https://seattle.craigslist.org/est/apa/d/bothell-quality-living-starts-here-2x2/7507904759.html
2022-07-12 10:42," (7413 142nd Avenue East, Sumner, WA)","Oversized Closets, Washer & Dryer In Every Unit, Fireplace",2020,2,977.0,https://seattle.craigslist.org/tac/apa/d/sumner-oversized-closets-washer-dryer/7500907339.html
2022-07-12 10:41, (Port Orchard),"Fitness Center, Additional Storage, Covered Parking Available",1898,2,982.0,https://seattle.craigslist.org/kit/apa/d/port-orchard-fitness-center-additional/7507904433.html
2022-07-12 10:41," (97 Byrd Drive, Steilacoom, WA)","One Bedroom Available Now, $250 Look & Lease",1480,1,726.0,https://seattle.craigslist.org/tac/apa/d/steilacoom-one-bedroom-available-now/7506315948.html
2022-07-12 10:41, (Belltown),Newly renovated 1 bed den @ Dorian Belltown,2570,1,597.0,https://seattle.craigslist.org/see/apa/d/seattle-newly-renovated-bed-den-dorian/7507904378.html
2022-07-12 10:41, (Seattle),"Large One Bedroom w/ Patio, High Ceilings and Full W/D",2485,1,722.0,https://seattle.craigslist.org/see/apa/d/seattle-large-one-bedroom-patio-high/7507904343.html
2022-07-12 10:41, (South Everett),"Only One Left!! 2bed, 2bath - W/D- Top Floor",2110,2,1236.0,https://seattle.craigslist.org/sno/apa/d/everett-only-one-left-2bed-2bath-d-top/7507904279.html
2022-07-12 10:41, (Kent),"Playground, Large Bedrooms, Simulated Wood Plank Floors",1775,1,656.0,https://seattle.craigslist.org/see/apa/d/seattle-playground-large-bedrooms/7507904082.html
2022-07-12 10:41, (tacoma / pierce),"Spectacular Views, Extra Storage, Package Lockers",1422,1,555.0,https://seattle.craigslist.org/tac/apa/d/tacoma-spectacular-views-extra-storage/7507904078.html
2022-07-12 10:40, (Tacoma),SUMMER STUDIOS SPECIALS,1025,,251.0,https://seattle.craigslist.org/tac/apa/d/tacoma-summer-studios-specials/7507894467.html
2022-07-12 10:40, (eastside),Life Elevated Here At Hyde Square!,2745,1,709.0,https://seattle.craigslist.org/est/apa/d/bellevue-life-elevated-here-at-hyde/7507903962.html
2022-07-12 10:40, (Kent),"2 Bedroom, Close to Shopping, Freeways, Public Transportation & More!",2154,2,900.0,https://seattle.craigslist.org/skc/apa/d/kent-bedroom-close-to-shopping-freeways/7507903784.html
2022-07-12 10:40," (10408 SE 174th St, Renton, WA)",First Floor Home! Private Patio! Oversized Closets! Dishwasher!!,1732,1,678.0,https://seattle.craigslist.org/skc/apa/d/renton-first-floor-home-private-patio/7502533474.html
2022-07-12 10:40, (south king co),Lovely 3 Bedroom Apartmentâ€¦ Waiting for You to Make it Home!,2880,3,1300.0,https://seattle.craigslist.org/skc/apa/d/seattle-lovely-bedroom-apartment/7507903634.html
2022-07-12 10:40," (9624 Frontier Ave SE Snoqualmie, WA)",Spacious 4 Bedroom 2 Bath ADA Unit Available for Pre-Lease!!,2120,4,1480.0,https://seattle.craigslist.org/see/apa/d/preston-spacious-bedroom-bath-ada-unit/7507903597.html
2022-07-12 10:39, (seattle),"Stunning Studio On The 21st Floor, Full City View",2220,,499.0,https://seattle.craigslist.org/see/apa/d/seattle-stunning-studio-on-the-21st/7507903520.html
2022-07-12 10:39, (Seattle),"Spacious 2B/1.5B!! International District, Rooftop Deck, W/D In Unit!",3150,2,1012.0,https://seattle.craigslist.org/see/apa/d/seattle-spacious-2b-15b-international/7507903279.html
2022-07-12 10:39," (3509 South Orchard Street, Tacoma, WA)",Love Where You Live Move To The Verandas,1886,2,1030.0,https://seattle.craigslist.org/tac/apa/d/tacoma-love-where-you-live-move-to-the/7502412919.html
2022-07-12 10:39, (eastside),"3/BD 2/BA, Near Redmond Ridge Bike Trail, Located in Redmond",3265,3,1505.0,https://seattle.craigslist.org/est/apa/d/sammamish-bd-ba-near-redmond-ridge-bike/7496508974.html
2022-07-12 10:38, (tacoma / pierce),Conveniently Located Near Freeways- River Trail Has It All,2068,2,1055.0,https://seattle.craigslist.org/tac/apa/d/puyallup-conveniently-located-near/7501119094.html
2022-07-12 10:38, (south king co),Youâ€™ll love being here. Weâ€™ll love to have you here.,2838,3,1300.0,https://seattle.craigslist.org/skc/apa/d/seattle-youll-love-being-here-well-love/7506306460.html
2022-07-12 10:38, (snohomish county),"One bedroom steps from Boeing! Apply today, move tomorrow!",1735,1,602.0,https://seattle.craigslist.org/sno/apa/d/everett-one-bedroom-steps-from-boeing/7507886540.html
2022-07-12 10:37, (Lakewood),1Bd 1 Bath Must See,1300,1,,https://seattle.craigslist.org/tac/apa/d/lakewood-1bd-bath-must-see/7496000034.html
2022-07-12 10:36, (Shoreline),#246- 2 Weeks Free On Luxurious 1x1! Huge 24/7 Fitness Center!,2021,1,754.0,https://seattle.craigslist.org/see/apa/d/seattle-weeks-free-on-luxurious-1x1/7507901932.html
2022-07-12 10:36, (Bothell),Make Willina Ranch Your Next Move! Updated 2x2 with Garage!,3047,2,1073.0,https://seattle.craigslist.org/est/apa/d/bothell-make-willina-ranch-your-next/7507901811.html
2022-07-12 10:36, (tacoma / pierce),"Walk-In Pantry, Seasonal Outdoor Pool, Playground",1724,2,880.0,https://seattle.craigslist.org/tac/apa/d/tacoma-walk-in-pantry-seasonal-outdoor/7507901689.html
2022-07-12 10:36, (Issaquah),House for Rent,2400,3,1350.0,https://seattle.craigslist.org/est/apa/d/issaquah-house-for-rent/7507901087.html
2022-07-12 10:35, (Columbia City),"Views, Extra Storage, Rooftop Deck",2015,1,650.0,https://seattle.craigslist.org/see/apa/d/seattle-views-extra-storage-rooftop-deck/7507898492.html
2022-07-12 10:35, (Ballard),"GRANITE COUNTERTOPS, ORIGINAL OAK HARDWOOD FLOORS",2008,1,566.0,https://seattle.craigslist.org/see/apa/d/seattle-granite-countertops-original/7507901458.html
2022-07-12 10:35, (Lakewood),2Bd 1 Bath Must See,1350,2,,https://seattle.craigslist.org/tac/apa/d/lakewood-2bd-bath-must-see/7495979161.html
2022-07-12 10:35, (Seattle),Modern and Spacious 1x1 In Fantastic Location!,2436,1,781.0,https://seattle.craigslist.org/see/apa/d/seattle-modern-and-spacious-1x1-in/7507901333.html
2022-07-12 10:35, (eastside),"Assigned Parking, Full-size Washer and Dryer in Home, Extra Storage",2215,1,675.0,https://seattle.craigslist.org/est/apa/d/bothell-assigned-parking-full-size/7507901308.html
2022-07-12 10:35, (South Everett),Top Floor THREE Bedroom w/Laundry + Storage,2585,3,1510.0,https://seattle.craigslist.org/sno/apa/d/everett-top-floor-three-bedroom-laundry/7507901301.html
2022-07-12 10:35, (Lakewood),2Bd 1 Bath Must See,1450,2,800.0,https://seattle.craigslist.org/tac/apa/d/lakewood-2bd-bath-must-see/7495976326.html
2022-07-12 10:34, (kitsap / west puget),"Hardwood Flooring, Ceiling Fans, Clubhouse",2495,3,1232.0,https://seattle.craigslist.org/kit/apa/d/silverdale-hardwood-flooring-ceiling/7506766875.html
2022-07-12 10:34, (seattle),"Great room, Private dining on the 40th floor, Bike repair station",4158,2,1041.0,https://seattle.craigslist.org/see/apa/d/seattle-great-room-private-dining-on/7507900912.html
2022-07-12 10:34, (Newcastle),"Ideal Location, Hardwood Flooring, Pet Friendly",2470,1,932.0,https://seattle.craigslist.org/skc/apa/d/ideal-location-hardwood-flooring-pet/7507900860.html
2022-07-12 10:34, (Issaquah),Spectacular Views In Every Direction!,2427,1,912.0,https://seattle.craigslist.org/est/apa/d/issaquah-spectacular-views-in-every/7507900586.html
2022-07-12 10:33, (Kirkland),"Nature Reserve, Dog Park, Resort-Style Pool on Lake Washington!",3617,2,972.0,https://seattle.craigslist.org/est/apa/d/kirkland-nature-reserve-dog-park-resort/7507900497.html
2022-07-12 10:33," (3231 S 204th St, SeaTac, WA)","#J205--Playground, Courtesy Patrol, Large Closets",1767,2,900.0,https://seattle.craigslist.org/see/apa/d/seattle-j205-playground-courtesy-patrol/7502817672.html
2022-07-12 10:33, (Olympia),"Resident social lounge, Elevator access, Control-entry access",1164,1,431.0,https://seattle.craigslist.org/oly/apa/d/olympia-resident-social-lounge-elevator/7507900323.html
2022-07-12 10:33, (snohomish county),"Gated Electronic Entrance, Clubroom, Onsite Management",1625,1,540.0,https://seattle.craigslist.org/sno/apa/d/lynnwood-gated-electronic-entrance/7506298336.html
2022-07-12 10:33, (Lacey),Want to Save $$$ on Your First Months Rent? Call Us & Ask How!,1750,2,1074.0,https://seattle.craigslist.org/oly/apa/d/lacey-want-to-save-on-your-first-months/7507900185.html
2022-07-12 10:33, (Tacoma),"â­ Controlled Access, Rooftop Views, RockStar Livingâ­",995,,275.0,https://seattle.craigslist.org/tac/apa/d/tacoma-controlled-access-rooftop-views/7507895005.html
2022-07-12 10:32, (Issaquah/Sammamish/Redmond),"Premiere Corner 2BD,2BA w/ Bonus Loft Space!",3323,2,1311.0,https://seattle.craigslist.org/est/apa/d/sammamish-premiere-corner-2bd2ba-bonus/7507899673.html
2022-07-12 10:32, (seattle),"Open-Concept, Storage rooms, Hardwood Flooring",2277,1,530.0,https://seattle.craigslist.org/see/apa/d/seattle-open-concept-storage-rooms/7507899592.html
2022-07-12 10:31," (9400 Rainier Avenue South Seattle, WA)",Studio Apartments on Special! Reduced from $1324  to $1191!!!,1191,,434.0,https://seattle.craigslist.org/see/apa/d/seattle-studio-apartments-on-special/7497905165.html
2022-07-12 10:31, (Seattle),844:August Move!Top Floor Urban 1B|Courtyard View|24/7 Fitness Center,2617,1,596.0,https://seattle.craigslist.org/see/apa/d/seattle-844august-movetop-floor-urban/7507899396.html
2022-07-12 10:31," (1020 West Casino Road, Everett, WA)","Flexible Monthly Payments with Flex Rent, On-Site Laundry, Storage",1803,2,980.0,https://seattle.craigslist.org/sno/apa/d/everett-flexible-monthly-payments-with/7502111458.html
2022-07-12 10:31, (Seattle),1 Bedroom / 1 Bath Apartment Home in Belltown!!!,2416,1,686.0,https://seattle.craigslist.org/see/apa/d/seattle-bedroom-bath-apartment-home-in/7507899342.html
2022-07-12 10:31," (10710 17th Avenue South, Tacoma, WA)",Renovated Two Bed Two Bath with a Move In Special! Deposit Free !!!,1849,2,1050.0,https://seattle.craigslist.org/est/apa/d/tacoma-renovated-two-bed-two-bath-with/7507899302.html
2022-07-12 10:31, (Capitol Hill),"Capitol Hill studio, hardwood floors, all utilities included.",1045,,,https://seattle.craigslist.org/see/apa/d/capitol-hill-studio-hardwood-floors-all/7507899252.html
2022-07-12 10:31, (Smokey Point Area - Marysville),You'll love our amazing community! Highly desirable neighborhood!,0,1,557.0,https://seattle.craigslist.org/sno/apa/d/north-lakewood-youll-love-our-amazing/7507899083.html
2022-07-12 10:30," (521 Stadium Place S, Seattle, WA)",Unique Design Apartment Tower in Famous Pioneer Square,1808,,428.0,https://seattle.craigslist.org/see/apa/d/seattle-unique-design-apartment-tower/7507081277.html
2022-07-12 10:30, (Bellevue),Surrey On Main Pre-leasing now #OldMainMeetsNewMain,4710,1,801.0,https://seattle.craigslist.org/est/apa/d/bellevue-surrey-on-main-pre-leasing-now/7507898770.html
2022-07-12 10:29, (Bothell),This One Bedroom Has More Storage Than You Need!,2254,1,820.0,https://seattle.craigslist.org/sno/apa/d/bothell-this-one-bedroom-has-more/7507898499.html
2022-07-12 10:29, (Seattle),Studio in Vintage Building,950,,175.0,https://seattle.craigslist.org/see/apa/d/seattle-studio-in-vintage-building/7506839788.html
2022-07-12 10:29, (Seattle),"3 Bedroom Apartment in Vintage Building,",1900,3,925.0,https://seattle.craigslist.org/see/apa/d/seattle-bedroom-apartment-in-vintage/7506403559.html
2022-07-12 10:29, (South Lake Union),SLU studio available August - walking distance to Amazon & Google!,1622,,252.0,https://seattle.craigslist.org/see/apa/d/seattle-slu-studio-available-august/7507898221.html
2022-07-12 10:29, (Issaquah/Sammamish/Redmond),Fall In Love With This Beautiful Apartment Home!,3252,2,1136.0,https://seattle.craigslist.org/est/apa/d/sammamish-fall-in-love-with-this/7507898059.html
2022-07-12 10:28, (South Lake Union),Studio w/ balcony in SLU w/in walking distance of Amazon!,1628,,248.0,https://seattle.craigslist.org/see/apa/d/seattle-studio-balcony-in-slu-in/7507897910.html
2022-07-12 10:28, (Volunteer Park / Capitol Hill),Great studio at The Adamson (10)!,1425,,425.0,https://seattle.craigslist.org/see/apa/d/seattle-great-studio-at-the-adamson-10/7506390634.html
2022-07-12 10:28, (SEATTLE),Adorable studio at Windsor Arms (104)!,1425,,445.0,https://seattle.craigslist.org/see/apa/d/seattle-adorable-studio-at-windsor-arms/7501105744.html
2022-07-12 10:28, (15 Minute Drive to Everett Station),You'll love where you live! Come home to Helm Apartments,1837,,545.0,https://seattle.craigslist.org/sno/apa/d/everett-youll-love-where-you-live-come/7507897609.html
2022-07-12 10:27, (Tacoma),â¥â¥Affordable! Controlled Access! Convenience! â¥â¥,1025,,251.0,https://seattle.craigslist.org/tac/apa/d/tacoma-affordable-controlled-access/7496185421.html
2022-07-12 10:27," (Port Angeles, WA)",Irish Cottage Cabin charming Mtn. Ocean views,1195,1,640.0,https://seattle.craigslist.org/kit/apa/d/irish-cottage-cabin-charming-mtn-ocean/7496884363.html
2022-07-12 10:27," (9624 Frontier Ave SE Snoqualmie, WA)",Gorgeous Top Floor 4 bedroom 2 Bath Unit Available for Pre-Lease!!,2120,4,1438.0,https://seattle.craigslist.org/see/apa/d/preston-gorgeous-top-floor-bedroom-bath/7507897323.html
2022-07-12 10:27, (South Lake Union),Moving to Seattle? Affordable studios available in South Lake Union!,1520,,233.0,https://seattle.craigslist.org/see/apa/d/seattle-moving-to-seattle-affordable/7507897298.html
2022-07-12 10:27, (eastside),Southern facing one bedroom with great natural light,2565,1,645.0,https://seattle.craigslist.org/est/apa/d/bellevue-southern-facing-one-bedroom/7497743122.html
2022-07-12 10:27, (Kent),Large 2x2 available 6/17/2022 End unit with balcony!!,2185,2,1119.0,https://seattle.craigslist.org/skc/apa/d/kent-large-2x2-available-end-unit-with/7507893104.html
2022-07-12 10:27, (Edmonds),Quality living from the team that cares,2470,2,948.0,https://seattle.craigslist.org/sno/apa/d/seattle-quality-living-from-the-team/7507897087.html
2022-07-12 10:26," (Seattle, WA)",Renovated 1 BR/1 BA with Den in Seward Park,2250,1,760.0,https://seattle.craigslist.org/see/apa/d/seattle-renovated-br-ba-with-den-in/7507896920.html
2022-07-12 10:26, (Silverdale),Looking For a Large Kitchen With Vaulted Ceilings? Come To Ridgetop!,2045,2,878.0,https://seattle.craigslist.org/kit/apa/d/silverdale-looking-for-large-kitchen/7507891714.html
2022-07-12 10:25, (Snohomish),Jump into summer with a new 2 BR apartment home!,1750,2,655.0,https://seattle.craigslist.org/sno/apa/d/snohomish-jump-into-summer-with-new-br/7507896228.html
2022-07-12 10:25, (Boeing / Paine Field),"$500 Gift Card Look n Lease! Only 2 Left, Apply Today!",1703,1,658.0,https://seattle.craigslist.org/sno/apa/d/everett-500-gift-card-look-lease-only/7507896159.html
2022-07-12 10:24, (south king co),Reserve at SeaTac 55+ affordable apartments,1326,,448.0,https://seattle.craigslist.org/skc/apa/d/seattle-reserve-at-seatac-55-affordable/7507869726.html
2022-07-12 10:24, (West Seattle),"Brand New Stainless Steel Appliances, Flooring & Cabinets, On-Site Gym",1495,,350.0,https://seattle.craigslist.org/see/apa/d/seattle-brand-new-stainless-steel/7507895905.html
2022-07-12 10:24, (Renton),"Sparkling Pool, Pet Friendly, Incredible Features",2292,2,891.0,https://seattle.craigslist.org/est/apa/d/renton-sparkling-pool-pet-friendly/7507895912.html
2022-07-12 10:24, (Bothell),"Spa, Lease Today, Patio or Balcony",2247,2,1000.0,https://seattle.craigslist.org/sno/apa/d/spa-lease-today-patio-or-balcony/7507895883.html
2022-07-12 10:24," (South Everett, Silverlake, Mill Creek, Boeing, Costco, Navy)","GROUND LEVEL, 2 BEDROOM 1 BATH WITH PRIVATE TREE SCAPE VIEW!!!",1755,2,815.0,https://seattle.craigslist.org/sno/apa/d/everett-ground-level-bedroom-bath-with/7502309786.html
2022-07-12 10:24," (South Everett, Silverlake, Mill Creek, Boeing, Costco, Navy)",COZY GROUND LEVEL 2 BED 1 BATH! FREE PARKING!,1755,2,815.0,https://seattle.craigslist.org/sno/apa/d/everett-cozy-ground-level-bed-bath-free/7503112219.html
2022-07-12 10:24, (Tacoma),2 Bedroom - Conveniently Located in Tacoma,1395,2,825.0,https://seattle.craigslist.org/tac/apa/d/tacoma-bedroom-conveniently-located-in/7507895544.html
2022-07-12 10:24, (Kent),"Ideal Location, Pets Welcome, Solid Surface Countertops",1530,,440.0,https://seattle.craigslist.org/skc/apa/d/kent-ideal-location-pets-welcome-solid/7507895506.html
2022-07-12 10:24, (kitsap / west puget),"Vinyl & Carpet Flooring, Sport Court, Classic Countertops",1925,2,816.0,https://seattle.craigslist.org/kit/apa/d/silverdale-vinyl-carpet-flooring-sport/7507895480.html
2022-07-12 10:23," (9624 Frontier Ave SE Snoqualmie, WA)",Beautiful Ground Floor 4 Bedroom 2 Bath Available for Pre-Lease!!,2120,4,1438.0,https://seattle.craigslist.org/see/apa/d/preston-beautiful-ground-floor-bedroom/7507895330.html
2022-07-12 10:23," (2226 Elliott Avenue, Seattle, WA)","Greta for roommates! Huge 2BR 2BA apt, Modern kitchen, Spacious plan",3670,2,900.0,https://seattle.craigslist.org/see/apa/d/seattle-greta-for-roommates-huge-2br/7505572186.html
2022-07-12 10:23," (West Olympia, Captial Mall, Yauger Park)","Spacious 2 bedroom, Walk-In Closet, Plank Flooring, Soaker Tub",2093,2,1180.0,https://seattle.craigslist.org/oly/apa/d/olympia-spacious-bedroom-walk-in-closet/7504074496.html
2022-07-12 10:23, (Kirkland),A New Wave of Living at Vue Kirkland Apartments! 2 Bed for July!,2499,2,745.0,https://seattle.craigslist.org/est/apa/d/kirkland-new-wave-of-living-at-vue/7507895236.html
2022-07-12 10:23," (25220 109th Place Southeast, Kent, WA)",Ground Floor! Patio! In-Unit Washer & Dryer! Two Bed Two Bath Home!,2482,2,900.0,https://seattle.craigslist.org/est/apa/d/kent-ground-floor-patio-in-unit-washer/7507895025.html
2022-07-12 10:23, (117 HANSON ST  CENTRALIA),1 BEDROOM HOUSE,1000,1,500.0,https://seattle.craigslist.org/oly/apa/d/centralia-bedroom-house/7507893125.html
2022-07-12 10:22, (Seattle),Stunning Studio in the Heart of Belltown!,1995,,507.0,https://seattle.craigslist.org/see/apa/d/seattle-stunning-studio-in-the-heart-of/7507894911.html
2022-07-12 10:22," (Redmond, Costco, Wholefoods, Downtown Redmond)",Top floor one bed! Central ac with forest views! Rare luxury!,2269,1,646.0,https://seattle.craigslist.org/est/apa/d/redmond-top-floor-one-bed-central-ac/7507894678.html
2022-07-12 10:22, (tacoma / pierce),"Microwave, Zero Deposit Community, Private Patio",1821,2,970.0,https://seattle.craigslist.org/tac/apa/d/tacoma-microwave-zero-deposit-community/7502269287.html
2022-07-12 10:22, (south king co),"Resident social lounge, Easy access to WA-167 and WA-18",1156,1,532.0,https://seattle.craigslist.org/skc/apa/d/federal-way-resident-social-lounge-easy/7507894567.html
2022-07-12 10:22, (West Seattle),Waterfront Living - West Seattle 1 Bedroom,2650,1,650.0,https://seattle.craigslist.org/see/apa/d/seattle-waterfront-living-west-seattle/7497073241.html
2022-07-12 10:22, (Kent),Kent 2 Bedroom Available,1579,2,900.0,https://seattle.craigslist.org/skc/apa/d/seattle-kent-bedroom-available/7499104343.html
2022-07-12 10:22, (Everett),Your Future Spacious 1 Bed 1 Bath Is Coming Soon! Apply Now!!!,1799,1,780.0,https://seattle.craigslist.org/sno/apa/d/everett-your-future-spacious-bed-bath/7507894498.html
2022-07-12 10:22, (Seattle),West Seattle - Affordable 1 Bedroom Apartment,1469,1,600.0,https://seattle.craigslist.org/see/apa/d/seattle-west-seattle-affordable-bedroom/7497101344.html
2022-07-12 10:22, (tacoma / pierce),"ðŸŒžHeating, Grills, Dishwasher, Fitness CenterðŸŒž",1699,,516.0,https://seattle.craigslist.org/tac/apa/d/tacoma-heating-grills-dishwasher/7507894311.html
2022-07-12 10:21, (Federal Way),1x1 in Federal Way - Rent Ready,1380,1,700.0,https://seattle.craigslist.org/skc/apa/d/federal-way-1x1-in-federal-way-rent/7498015780.html
2022-07-12 10:21, (Bellevue),1 Bedroom in Bellevue!,2099,1,638.0,https://seattle.craigslist.org/est/apa/d/bellevue-bedroom-in-bellevue/7496171472.html
2022-07-12 10:21, (Tacoma),Studio Apartment Homes - One Month Free!,1125,,418.0,https://seattle.craigslist.org/skc/apa/d/tacoma-studio-apartment-homes-one-month/7495837057.html
2022-07-12 10:21," (109 S Division Street, Auburn, WA)",Beautiful & Unique: You Will LOVE This 2 Bedroom 2 Bath Home!,3128,2,1168.0,https://seattle.craigslist.org/skc/apa/d/auburn-beautiful-unique-you-will-love/7502907518.html
2022-07-12 10:21, (seattle),Corner unit with full size washer & dryer!,2806,3,1221.0,https://seattle.craigslist.org/see/apa/d/lynnwood-corner-unit-with-full-size/7507894306.html
2022-07-12 10:21, (Columbia City),Because Location Is Everything! Brand New 2 Bed 2 Bath! 1 Month Free!,2199,1,653.0,https://seattle.craigslist.org/see/apa/d/seattle-because-location-is-everything/7507894224.html
