date_time,town,title,price,beds,sqft,url
2022-07-12 15:35, (Seattle),Lovely 2 bed/ 2.5 bath Available NOW !!,3274,2,930.0,https://seattle.craigslist.org/see/apa/d/seattle-lovely-bed-25-bath-available/7508040183.html
2022-07-12 15:35," (11432 105th Avenue Southwest, Lakewood, WA)","Ceiling Fans, Fitness Center, Flexible Monthly Payments with Flex Rent",2340,3,1200.0,https://seattle.craigslist.org/est/apa/d/lakewood-ceiling-fans-fitness-center/7505481042.html
2022-07-12 15:35," (West Olympia, Captial Mall, Yauger Park)","Walk-In Closets, Soaker Tub, Plank Flooring, In unit Washer/Dryer",1809,1,903.0,https://seattle.craigslist.org/oly/apa/d/olympia-walk-in-closets-soaker-tub/7508039934.html
2022-07-12 15:35, (West Seattle),Incredible Views of Elliot Bay & Seattle Skyline!,3295,2,1200.0,https://seattle.craigslist.org/see/apa/d/seattle-incredible-views-of-elliot-bay/7508039869.html
2022-07-12 15:34, (Central Capitol Hill Up to 2 Months Rent Free),Capitol Hill steals your heart ðŸ’– 2 MONTHS FREE RENT,5910,2,1561.0,https://seattle.craigslist.org/see/apa/d/seattle-capitol-hill-steals-your-heart/7508037480.html
2022-07-12 15:34, (Seattle),"*** 2bds, Water View, Sand Point Beauty. ***",1695,2,900.0,https://seattle.craigslist.org/see/apa/d/seattle-2bds-water-view-sand-point/7496587378.html
2022-07-12 15:34," (8022 83rd Avenue Southwest, Lakewood, WA)",Apply today for a beautiful newly renovated apartment home.,1980,2,880.0,https://seattle.craigslist.org/tac/apa/d/lakewood-apply-today-for-beautiful/7503642254.html
2022-07-12 15:34, (Bellevue),1 Bedroom 1 Bath! Basketball Court! Close to Shopping & Restaurants!,2054,1,700.0,https://seattle.craigslist.org/est/apa/d/bellevue-bedroom-bath-basketball-court/7508039516.html
2022-07-12 15:34, (eastside),"2 BD, Wood-style plank flooring, Elevator access",2667,2,934.0,https://seattle.craigslist.org/est/apa/d/lynnwood-bd-wood-style-plank-flooring/7507203394.html
2022-07-12 15:34, (snohomish county),"Outdoor fire pit with natural seating, White quartz counter tops",3095,3,1167.0,https://seattle.craigslist.org/sno/apa/d/north-lakewood-outdoor-fire-pit-with/7508039503.html
2022-07-12 15:33," (Kent, Auburn, Des Moines, Federal Way, SeaTac, Seatte)","Convenient access to SEATAC Airport, Fully equipped kitchens",2800,3,1100.0,https://seattle.craigslist.org/skc/apa/d/kent-convenient-access-to-seatac/7508039470.html
2022-07-12 15:33," (520 Occidental Ave S, Seattle, WA)",Urban Downtown Living At The Nolo,3114,2,892.0,https://seattle.craigslist.org/see/apa/d/seattle-urban-downtown-living-at-the/7508039406.html
2022-07-12 15:33, (Marysville),"This deal won't last long! Gorgeous 1 bed, 1 bath! Prime location.",0,1,557.0,https://seattle.craigslist.org/sno/apa/d/north-lakewood-this-deal-wont-last-long/7508039390.html
2022-07-12 15:33, (Renton),"Cats and Dogs Welcome, Serene Wooded and Valley Views",2230,2,938.0,https://seattle.craigslist.org/skc/apa/d/renton-cats-and-dogs-welcome-serene/7508039332.html
2022-07-12 15:33, (Redmond),"BBQ Area, Come Visit Today, Modern Amenities",3525,3,1423.0,https://seattle.craigslist.org/est/apa/d/redmond-bbq-area-come-visit-today/7508039221.html
2022-07-12 15:33, (Renton),"Ideal Renton Area, Convenient Location, Lease Today",2120,2,943.0,https://seattle.craigslist.org/skc/apa/d/renton-ideal-renton-area-convenient/7508039217.html
2022-07-12 15:33," (3509 South Orchard Street, Tacoma, WA)",43.	Discover Verandas Apartment Living.,1848,2,1030.0,https://seattle.craigslist.org/tac/apa/d/tacoma-43-discover-verandas-apartment/7506514909.html
2022-07-12 15:32, (Exit 13th on SE Newport Way),3x2 Just Renovated! Beautiful Home with No Stairs! Call Now,3660,3,1130.0,https://seattle.craigslist.org/est/apa/d/bellevue-3x2-just-renovated-beautiful/7508039081.html
2022-07-12 15:32, (Port Orchard),"1x1, 2x1, and 2x2's call now for more details",1727,1,728.0,https://seattle.craigslist.org/kit/apa/d/port-orchard-1x1-2x1-and-2x2s-call-now/7506034907.html
2022-07-12 15:32," (9615 Holly Dr. Everett, WA)",Your New Home Is Just Waiting For You! See What Home Can Be! *Senior*,1408,1,545.0,https://seattle.craigslist.org/sno/apa/d/everett-your-new-home-is-just-waiting/7508025232.html
2022-07-12 15:32, (Port Orchard),"Summer Savings, lock in the low rate for your new 2 bedroom home!",1898,2,982.0,https://seattle.craigslist.org/kit/apa/d/port-orchard-summer-savings-lock-in-the/7506308496.html
2022-07-12 15:32, (Fremont),Charming 3 bedroom apt in Fremont,3690,3,,https://seattle.craigslist.org/see/apa/d/seattle-charming-bedroom-apt-in-fremont/7508037986.html
2022-07-12 15:32, (Port Orchard),Nestled in the trees this 2x2 is waiting for you!,1898,2,982.0,https://seattle.craigslist.org/kit/apa/d/port-orchard-nestled-in-the-trees-this/7506340647.html
2022-07-12 15:32, (Port Orchard),Plan your Summer move @ the Sidney!,1847,2,982.0,https://seattle.craigslist.org/kit/apa/d/port-orchard-plan-your-summer-move-the/7506470478.html
2022-07-12 15:32," (12240 Daphne Ln. NW, Silverdale, WA)","Near Public Transit, Ceiling Fan, Private Balcony or Patio",2030,2,949.0,https://seattle.craigslist.org/kit/apa/d/silverdale-near-public-transit-ceiling/7508010903.html
2022-07-12 15:32," (9860 Bushlac Lane Northwest, Silverdale, WA)","Vinyl & Carpet Flooring, Covered & Open Air Parking, Washer/Dryer",1866,1,616.0,https://seattle.craigslist.org/kit/apa/d/silverdale-vinyl-carpet-flooring/7506349709.html
2022-07-12 15:31, (Central Capitol Hill Up to 2 Months Rent Free),Capitol Hill steals your heart ðŸ’–,5910,2,1561.0,https://seattle.craigslist.org/see/apa/d/seattle-capitol-hill-steals-your-heart/7508037152.html
2022-07-12 15:31, (seattle),1612 1st Ave N - Gorgeous Single Family House - Queen Anne,4500,3,2200.0,https://seattle.craigslist.org/see/apa/d/seattle-st-ave-gorgeous-single-family/7503690403.html
2022-07-12 15:31, (Seattle),5014 8th Ave NE - Spacious University District Home - Great Location,4980,6,2400.0,https://seattle.craigslist.org/see/apa/d/seattle-th-ave-ne-spacious-university/7503684646.html
2022-07-12 15:31, (seattle),901 W Howe St - A - Beautiful 1 bedroom apartment in Queen Anne,1800,1,,https://seattle.craigslist.org/see/apa/d/seattle-901-howe-st-beautiful-bedroom/7503682626.html
2022-07-12 15:31, (seattle),3243 NW Market - Ballard 50's Townhouse,2700,2,,https://seattle.craigslist.org/see/apa/d/seattle-3243-nw-market-ballard-50s/7503347326.html
2022-07-12 15:31, (Bellevue),"Excellent Location, Exceptional Views, Unmatched Amenities",2552,1,648.0,https://seattle.craigslist.org/est/apa/d/bellevue-excellent-location-exceptional/7508038362.html
2022-07-12 15:30, (Auburn),"Balcony/Deck, Heating, Refrigerator",1234,1,546.0,https://seattle.craigslist.org/skc/apa/d/federal-way-balcony-deck-heating/7506306100.html
2022-07-12 15:30," (604 E Union St, Seattle, WA)","Hardwood Floors, Laundry Room On-Site, Close to Public Transportation",1350,,490.0,https://seattle.craigslist.org/see/apa/d/seattle-hardwood-floors-laundry-room-on/7500379274.html
2022-07-12 15:30, (snohomish county),Looking for A Bigger Placeâ€¦Try Us,1580,1,895.0,https://seattle.craigslist.org/sno/apa/d/everett-looking-for-bigger-placetry-us/7496499173.html
2022-07-12 15:29, (Green Lake),"Energy-Efficient, Dual-Pane Windows, Spectacular Skyline Vistas",2715,1,581.0,https://seattle.craigslist.org/see/apa/d/seattle-energy-efficient-dual-pane/7508037942.html
2022-07-12 15:29, (Auburn),Charming 1 bed / 1 bath with great character! 500 Sq Feet,1258,1,500.0,https://seattle.craigslist.org/skc/apa/d/federal-way-charming-bed-bath-with/7508037877.html
2022-07-12 15:29, (south king co),Are you tired of looking for the best home? Well look no further!,2334,2,940.0,https://seattle.craigslist.org/skc/apa/d/seattle-are-you-tired-of-looking-for/7508037811.html
2022-07-12 15:28," (3295 SW Avalon Way Seattle, WA)","Head-turning Style, Extraordinary Location + First Month FREE!",1905,1,585.0,https://seattle.craigslist.org/see/apa/d/seattle-head-turning-style/7508037612.html
2022-07-12 15:28, (U District),Virtual Tours Available Facetime and Skype,1665,,392.0,https://seattle.craigslist.org/see/apa/d/seattle-virtual-tours-available/7508037541.html
2022-07-12 15:28, (East Lake/South Lake Union/Seattle/Downtown/Amazon),A Spacious Apartment with everything you need!,2464,1,738.0,https://seattle.craigslist.org/see/apa/d/seattle-spacious-apartment-with/7508024354.html
2022-07-12 15:28, (olympia / thurston),"Plank-Wood Flooring, Resident Events, Walk-In Closets with Every Home",1909,1,903.0,https://seattle.craigslist.org/oly/apa/d/olympia-plank-wood-flooring-resident/7502846187.html
2022-07-12 15:28, (Renton),AFFORDABLE SENIOR LIVING 55+,1683,2,750.0,https://seattle.craigslist.org/see/apa/d/renton-affordable-senior-living-55/7508029733.html
2022-07-12 15:27, (tacoma / pierce),"24 Hour Fitness Center, Year-Round Spa, Swimming Pool!",2056,2,1193.0,https://seattle.craigslist.org/tac/apa/d/tacoma-24-hour-fitness-center-year/7505465527.html
2022-07-12 15:27, (EVERETT),FUN IN THE SUN IN 3 FL 2X1 APT!!! $750.00 OFF MOVE IN IF MOVE BY 7/22,1999,2,846.0,https://seattle.craigslist.org/sno/apa/d/lynnwood-fun-in-the-sun-in-fl-2x1-apt/7508037161.html
2022-07-12 15:27, (seattle),Modern newer home,4900,4,2800.0,https://seattle.craigslist.org/see/apa/d/seattle-modern-newer-home/7501344793.html
2022-07-12 15:27, (Covington),Senior Housing in Covington! Now accepting applications!,1456,1,548.0,https://seattle.craigslist.org/skc/apa/d/kent-senior-housing-in-covington-now/7508036921.html
2022-07-12 15:26, (Bremerton),B.2 Will Be Available Soon! Apply Today For It And Make Ambrose Home!,2900,2,1045.0,https://seattle.craigslist.org/kit/apa/d/bremerton-b2-will-be-available-soon/7508036595.html
2022-07-12 15:26, (seattle),"Zero Deposit Community, Over-sized Walk-In Closets, Outdoor Pool & Spa",1726,1,700.0,https://seattle.craigslist.org/see/apa/d/seattle-zero-deposit-community-over/7506841084.html
2022-07-12 15:25, (West Seattle),Huge Spacious Floorplans! Tour Today!,1995,1,725.0,https://seattle.craigslist.org/see/apa/d/seattle-huge-spacious-floorplans-tour/7502303432.html
2022-07-12 15:25, (south king co),"Water Views, Renovated Units, Outdoor Spa, Air Conditioning",2921,1,615.0,https://seattle.craigslist.org/skc/apa/d/renton-water-views-renovated-units/7508036497.html
2022-07-12 15:25, (Renton),This Home Has All You Need! Visit Hilltop Today!,1813,1,670.0,https://seattle.craigslist.org/skc/apa/d/this-home-has-all-you-need-visit/7508036457.html
2022-07-12 15:25," (Everett, South Forest Park)","Comfortable private duplex house, w/ yard, Everett Central Location",1575,2,700.0,https://seattle.craigslist.org/sno/apa/d/everett-comfortable-private-duplex/7497333768.html
2022-07-12 15:25, (Olympia),Views on Fifth 6TH FLOOR One-Bedroom Apartment Home with Lake Views!,2450,1,474.0,https://seattle.craigslist.org/oly/apa/d/olympia-views-on-fifth-6th-floor-one/7508031650.html
2022-07-12 15:24, (Kent),Beautiful 1 bedroom 1 bathroom with patio AND W/D in unit!,1400,1,540.0,https://seattle.craigslist.org/see/apa/d/kent-beautiful-bedroom-bathroom-with/7508036148.html
2022-07-12 15:24," (10710 17th Avenue South, Tacoma, WA)","Coming Soon! Two bed, One Bath, Gym, Move In Special! Pool!",1834,2,950.0,https://seattle.craigslist.org/est/apa/d/tacoma-coming-soon-two-bed-one-bath-gym/7504171403.html
2022-07-12 15:24, (Shoreline),Beautiful Corner Unit With TONS of Natural Light!,2299,1,720.0,https://seattle.craigslist.org/see/apa/d/seattle-beautiful-corner-unit-with-tons/7508036102.html
2022-07-12 15:24, (Renton),Make Crown Pointe Your New Home Today!,1699,1,533.0,https://seattle.craigslist.org/skc/apa/d/renton-make-crown-pointe-your-new-home/7508035982.html
2022-07-12 15:24, (Everett),Something to love in every room! Apartment. Beautiful view!,1697,,600.0,https://seattle.craigslist.org/sno/apa/d/everett-something-to-love-in-every-room/7508030919.html
2022-07-12 15:23, (Renton),Beautiful One Bedroom At Crown Pointe,1693,1,652.0,https://seattle.craigslist.org/skc/apa/d/renton-beautiful-one-bedroom-at-crown/7508035580.html
2022-07-12 15:23, (NEWCASTLE),THIS PRICE WON'T LAST - 1 BEDROOM 1 BATH - LEASE TODAY!,1999,1,650.0,https://seattle.craigslist.org/est/apa/d/bellevue-this-price-wont-last-bedroom/7508035529.html
2022-07-12 15:22," (Downtown Kent, Auburn, Renton)","1 Bed Available! Large Deck+Views of Mt Rainier, What Else Do You Need",1837,1,730.0,https://seattle.craigslist.org/skc/apa/d/seattle-bed-available-large-deckviews/7508035432.html
2022-07-12 15:22," (58th Avenue East , Tacoma, WA)","Public Transportation, Stainless Steel Appliances, Patio or Balcony",1527,1,576.0,https://seattle.craigslist.org/tac/apa/d/tacoma-public-transportation-stainless/7508035336.html
2022-07-12 15:22, (tacoma / pierce),Available for July Move in! Don't Miss it!!,2599,3,1152.0,https://seattle.craigslist.org/tac/apa/d/lakewood-available-for-july-move-in/7500824515.html
2022-07-12 15:21, (Redmond),Sit back and relax in your new beautiful townhome,3285,2,1185.0,https://seattle.craigslist.org/est/apa/d/redmond-sit-back-and-relax-in-your-new/7508034841.html
2022-07-12 15:20," (11301 3rd AVE NE, Seattle, WA)","Quartz Countertops, Walk-In Shower, Stainless Steel Appliances",2295,1,657.0,https://seattle.craigslist.org/see/apa/d/seattle-quartz-countertops-walk-in/7502487962.html
2022-07-12 15:19," (11100 Southeast Petrovitsky Road, Renton, WA)","Dog Friendly, Shopping Nearby, Reserved Parking",2140,1,721.0,https://seattle.craigslist.org/tac/apa/d/renton-dog-friendly-shopping-nearby/7508034238.html
2022-07-12 15:19," (1415 Northwest Santa Fe Lane, Silverdale, WA)","Clubhouse, Playground, Resident Lounge",2300,2,1042.0,https://seattle.craigslist.org/kit/apa/d/silverdale-clubhouse-playground/7506588658.html
2022-07-12 15:19," (97 Byrd Drive, Steilacoom, WA)","Close to JBLM, Close to Steilacoom Park, High-Speed Internet",1730,2,926.0,https://seattle.craigslist.org/tac/apa/d/steilacoom-close-to-jblm-close-to/7508034215.html
2022-07-12 15:19," (1809 105th Street Court South, Tacoma, WA)","In-Unit W&D, Sport Court, Two Playgrounds, Pool, Gym, LAST ONE",2299,3,1150.0,https://seattle.craigslist.org/tac/apa/d/tacoma-in-unit-wd-sport-court-two/7508034144.html
2022-07-12 15:19, (snohomish county),"Going, Going, GONE!",1949,2,,https://seattle.craigslist.org/sno/apa/d/everett-going-going-gone/7508034136.html
2022-07-12 15:19, (south king co),"Walking trail, Fitness Center, Breakfast Bar",1643,2,875.0,https://seattle.craigslist.org/skc/apa/d/federal-way-walking-trail-fitness/7503194030.html
2022-07-12 15:19," (10815 SE 184th Lane, Renton, WA)","Private Patio/Terrace With Storage, On Bus Line, 24-Hour Service Line",1945,1,745.0,https://seattle.craigslist.org/skc/apa/d/renton-private-patio-terrace-with/7506384044.html
2022-07-12 15:19, (Redmond),Love where you live!,3480,2,1004.0,https://seattle.craigslist.org/est/apa/d/redmond-love-where-you-live/7508034072.html
2022-07-12 15:19, (East Lake/South Lake Union/Seattle/Downtown/Amazon),Every commuterâ€™s dream!,2499,1,723.0,https://seattle.craigslist.org/see/apa/d/seattle-every-commuters-dream/7508022307.html
2022-07-12 15:19, (Issaquah),Walk to Shopping and Dining in the Heart of Issaquah!,2070,1,662.0,https://seattle.craigslist.org/est/apa/d/issaquah-walk-to-shopping-and-dining-in/7508033955.html
2022-07-12 15:18, (tacoma / pierce),Come Relax By The Pool At River Trail!,1820,1,786.0,https://seattle.craigslist.org/tac/apa/d/puyallup-come-relax-by-the-pool-at/7502692280.html
2022-07-12 15:18, (Redmond),"Head-turning Style, Extraordinary Location!",3480,2,1004.0,https://seattle.craigslist.org/est/apa/d/redmond-head-turning-style/7508033777.html
2022-07-12 15:18," (10710 17th Avenue South, Tacoma, WA)","Summer Special! Deposit Free! Two Bed, Two Bath, Gym, Pool!!!",1856,2,1050.0,https://seattle.craigslist.org/est/apa/d/tacoma-summer-special-deposit-free-two/7508033599.html
2022-07-12 15:18," (2122 Northeast Hostmark Street, Poulsbo, WA)","Outdoor lounge with BBQ, Package concierge, Resort style pool and spa",2083,1,727.0,https://seattle.craigslist.org/kit/apa/d/poulsbo-outdoor-lounge-with-bbq-package/7508033513.html
2022-07-12 15:17," (3202 South Mason Avenue, Tacoma, WA)",Falling Prices! Happening @ The Lodge Of Madrona Apply Now $500 Off,1700,2,820.0,https://seattle.craigslist.org/est/apa/d/tacoma-falling-prices-happening-the/7508033444.html
2022-07-12 15:17, (Seattle/Belltown),Beautiful Open One bedroom With Balcony Views of Mt. Rainer,2826,1,710.0,https://seattle.craigslist.org/see/apa/d/seattle-beautiful-open-one-bedroom-with/7508033321.html
2022-07-12 15:17," (3509 South Orchard Street, Tacoma, WA)",Now leasing new beginnings,1924,2,1030.0,https://seattle.craigslist.org/tac/apa/d/tacoma-now-leasing-new-beginnings/7508033120.html
2022-07-12 15:17, (seattle),3 weeks FREE on this Lovely Two Bedroom!,5500,2,1627.0,https://seattle.craigslist.org/see/apa/d/seattle-weeks-free-on-this-lovely-two/7508033095.html
2022-07-12 15:16," (3815 North Pearl Street, Seattle-Tacoma, WA)","Stainless Steel Appliances, Storage, Business Center",2274,2,939.0,https://seattle.craigslist.org/est/apa/d/tacoma-stainless-steel-appliances/7508033042.html
2022-07-12 15:16," (8333 32nd Avenue South, Lakewood, WA)","Two Story Townhome Living, Close to JBLM and I-5, Dishwasher",1699,2,850.0,https://seattle.craigslist.org/tac/apa/d/lakewood-two-story-townhome-living/7508033026.html
2022-07-12 15:16, (Mercer Island),Stop in for a Self-Guided Tour of this Home!,2392,1,889.0,https://seattle.craigslist.org/see/apa/d/mercer-island-stop-in-for-self-guided/7508032883.html
2022-07-12 15:16, (Federal Way),Renovated Townhomes! (2Bed - 2Bath),2824,2,1148.0,https://seattle.craigslist.org/skc/apa/d/federal-way-renovated-townhomes-2bed/7508032810.html
2022-07-12 15:16," (308 Fourth Ave. S, Seattle, WA)","Large Windows, Vintage Moldings, Come And Tour Today!",1456,1,132.0,https://seattle.craigslist.org/see/apa/d/seattle-large-windows-vintage-moldings/7508032738.html
2022-07-12 15:15," (1001 E Marine View Dr. Everett, WA)",Everything You Need. All Right Here! CALL US TODAY!,1752,2,710.0,https://seattle.craigslist.org/sno/apa/d/everett-everything-you-need-all-right/7508029989.html
2022-07-12 15:15, (Bellevue),Cozy Studio Available Now! Fitness Center and Swimming Pool!,1641,,238.0,https://seattle.craigslist.org/est/apa/d/bellevue-cozy-studio-available-now/7508032594.html
2022-07-12 15:15," (21010 39th Way S Sea Tac, WA)",Another 2 Bedroom With Lot's of Light,2460,2,881.0,https://seattle.craigslist.org/see/apa/d/kent-another-bedroom-with-lots-of-light/7499973558.html
2022-07-12 15:15, (Olympia),Corner Waterfront 2Bed/1Bath Apartment w/ Harbor Views!!,3950,2,1047.0,https://seattle.craigslist.org/see/apa/d/olympia-corner-waterfront-2bed-1bath/7508032515.html
2022-07-12 15:15," (21010 39th Way S Sea Tac, WA)",2 Bedroom with 2 Parking,2400,2,939.0,https://seattle.craigslist.org/see/apa/d/kent-bedroom-with-parking/7502361309.html
2022-07-12 15:15," (21010 39th Way S Sea Tac, WA)",2 Bedroom Last One with View,2410,2,881.0,https://seattle.craigslist.org/see/apa/d/kent-bedroom-last-one-with-view/7502362253.html
2022-07-12 15:15," (420 West Smith Street, Kent, WA)",Love Extra Space? Spacious 1 Bed+Den Available for August Move-in!,1981,1,830.0,https://seattle.craigslist.org/skc/apa/d/seattle-love-extra-space-spacious/7506444465.html
2022-07-12 15:14," (521 Stadium Place S, Seattle, WA)",Amazing Views at The Wave in Downtown Seattle,2089,,521.0,https://seattle.craigslist.org/see/apa/d/seattle-amazing-views-at-the-wave-in/7508032359.html
2022-07-12 15:14," (3231 S 204th St, SeaTac, WA)","Flexible Monthly Payments with Flex Rent, Cable Ready, #M103",1499,1,725.0,https://seattle.craigslist.org/see/apa/d/seattle-flexible-monthly-payments-with/7508032302.html
2022-07-12 15:14," (10408 Southeast 174th Street, Seattle-Tacoma, WA)","Clubhouse, Translation Service Available, Window Coverings",2239,2,875.0,https://seattle.craigslist.org/skc/apa/d/renton-clubhouse-translation-service/7508032145.html
2022-07-12 15:14," (2226 Elliott Avenue, Seattle, WA)","Move-in ready! Large 2BR apt, Walk-in closet, Modern kitchen, has W/D",3670,2,900.0,https://seattle.craigslist.org/see/apa/d/seattle-move-in-ready-large-2br-apt/7508032120.html
2022-07-12 15:14," (North Beacon Hill, First, 1st, Capitol, Central, Downtown)","3212 Spacious, Quiet, Clean, WSG Included, Secured, Garage Parking",1600,1,675.0,https://seattle.craigslist.org/see/apa/d/seattle-3212-spacious-quiet-clean-wsg/7508032085.html
2022-07-12 15:14," (109 S Division Street, Auburn, WA)",Steps from Everything! Affordable Midrise Luxury Living!,2701,2,1154.0,https://seattle.craigslist.org/skc/apa/d/auburn-steps-from-everything-affordable/7505542290.html
2022-07-12 15:13, (eastside),"Oversized walk-in closets, Near Redmond Ridge Bike Trail, Reading room",3265,3,1505.0,https://seattle.craigslist.org/est/apa/d/sammamish-oversized-walk-in-closets/7498604493.html
2022-07-12 15:13, (tacoma / pierce),Live Uptown in Lakewoodâ€™s Newest Destination Community,1425,1,695.0,https://seattle.craigslist.org/tac/apa/d/lakewood-live-uptown-in-lakewoods/7505859964.html
2022-07-12 15:13, (Olympia),Views on Fifth 3rd Floor Two Bedroom Apartment Home w/ Balcony!!,3350,2,902.0,https://seattle.craigslist.org/see/apa/d/olympia-views-on-fifth-3rd-floor-two/7508031832.html
2022-07-12 15:13," (11301 3rd ave NE, seattle , WA)","Laundry Facility, Vinyl Flooring, Jogging Trail",2725,2,825.0,https://seattle.craigslist.org/see/apa/d/seattle-laundry-facility-vinyl-flooring/7508031794.html
2022-07-12 15:13, (Olympia),LAST Available Studio in the NW Building!! Call Today about Specials!,1425,,400.0,https://seattle.craigslist.org/see/apa/d/olympia-last-available-studio-in-the-nw/7506015313.html
2022-07-12 15:13, (Olympia),Views on Fifth 5TH FLOOR One-Bedroom Apartment Home with Lake Views!,2350,1,474.0,https://seattle.craigslist.org/oly/apa/d/olympia-views-on-fifth-5th-floor-one/7504013959.html
2022-07-12 15:13, (Olympia),Views on Fifth 7TH FLOOR One-Bedroom Apartment Home with Lake Views!,2550,1,474.0,https://seattle.craigslist.org/oly/apa/d/olympia-views-on-fifth-7th-floor-one/7504010405.html
2022-07-12 15:12, (seattle),"Arcade/game area, Close to Shopping, Rooftop Deck",2337,1,581.0,https://seattle.craigslist.org/see/apa/d/seattle-arcade-game-area-close-to/7504078754.html
2022-07-12 15:12," (416 111th Street Court East, Tacoma, WA)","Indoor Pool, Spa & Sauna, Friendly & Professional Staff, Extra Storage",1724,2,880.0,https://seattle.craigslist.org/tac/apa/d/tacoma-indoor-pool-spa-sauna-friendly/7508031572.html
2022-07-12 15:12, (Olympia),Views on Fifth 4th Floor One-Bedroom + Double Closet Feature!,2350,1,484.0,https://seattle.craigslist.org/oly/apa/d/olympia-views-on-fifth-4th-floor-one/7504013097.html
2022-07-12 15:12, (Olympia),Beautiful 8TH FLOOR 2Bed/1Bath Apartment with Waterfront Views!,4150,2,1047.0,https://seattle.craigslist.org/see/apa/d/olympia-beautiful-8th-floor-2bed-1bath/7504017942.html
2022-07-12 15:12, (tacoma / pierce),"Complimentary WiFi, Dishwasher, European Style Cabinets",1416,1,637.0,https://seattle.craigslist.org/tac/apa/d/tacoma-complimentary-wifi-dishwasher/7506371920.html
2022-07-12 15:12, (Olympia),Views on Fifth Unique Two Bedroom Apartment Home! CALL FOR SPECIALS!,3350,2,987.0,https://seattle.craigslist.org/see/apa/d/olympia-views-on-fifth-unique-two/7504016826.html
2022-07-12 15:12, (Olympia),Views on Fifth 6th Floor One Bed Apartment Home with Ocean Views!!,2450,1,453.0,https://seattle.craigslist.org/oly/apa/d/olympia-views-on-fifth-6th-floor-one/7504008260.html
2022-07-12 15:12, (Olympia),Views on Fifth 4TH FLOOR One-Bedroom Apartment Home with Harbor Views!,2450,1,650.0,https://seattle.craigslist.org/oly/apa/d/olympia-views-on-fifth-4th-floor-one/7496214356.html
2022-07-12 15:12, (Kent),Leasing 1 and 2 bedrooms!,1920,1,905.0,https://seattle.craigslist.org/skc/apa/d/kent-leasing-and-bedrooms/7508017785.html
2022-07-12 15:11, (Shoreline),Woof Your Pets Want to Live at Linden Highlands,1749,1,612.0,https://seattle.craigslist.org/see/apa/d/seattle-woof-your-pets-want-to-live-at/7508031212.html
2022-07-12 15:11, (Federal Way),Townhomes with big walking trail!,2748,2,1200.0,https://seattle.craigslist.org/skc/apa/d/federal-way-townhomes-with-big-walking/7508031152.html
2022-07-12 15:11, (West Seattle),"Washer & Dryer in Home, Community Room with Gourmet Kitchen",1725,1,493.0,https://seattle.craigslist.org/see/apa/d/seattle-washer-dryer-in-home-community/7508031155.html
2022-07-12 15:11, (kitsap / west puget),"Pet-friendly community, On Public Transportation Route, Clubhouse",2495,3,1232.0,https://seattle.craigslist.org/kit/apa/d/silverdale-pet-friendly-community-on/7508031092.html
2022-07-12 15:11," (11216 18th Ave S , Tacoma , WA)",$0 Deposit Community!! Apply Today!,1512,1,658.0,https://seattle.craigslist.org/tac/apa/d/tacoma-deposit-community-apply-today/7508031054.html
2022-07-12 15:11, (tacoma / pierce),"Spacious Floorplans, Large Closet, Playground",2155,3,1153.0,https://seattle.craigslist.org/tac/apa/d/puyallup-spacious-floorplans-large/7508030986.html
2022-07-12 15:11, (West Seattle),"Peaceful Area, Walking distance to Alki Beach!",1995,1,790.0,https://seattle.craigslist.org/see/apa/d/seattle-peaceful-area-walking-distance/7502302142.html
2022-07-12 15:11, (Tumwater),"Controlled Access, Fitness Club, Deck Area",2440,2,1125.0,https://seattle.craigslist.org/oly/apa/d/controlled-access-fitness-club-deck-area/7508030935.html
2022-07-12 15:11, (Pacific),Pacific Rental,3200,5,2000.0,https://seattle.craigslist.org/skc/apa/d/auburn-pacific-rental/7505645563.html
2022-07-12 15:11, (Lake Tapps),Lake Tapps Rental,3700,3,2000.0,https://seattle.craigslist.org/tac/apa/d/bonney-lake-lake-tapps-rental/7505645811.html
2022-07-12 15:11," (21010 39th Way S Sea Tac, WA)",2 Bedroom With 2 Full Bathrooms,2455,2,881.0,https://seattle.craigslist.org/see/apa/d/kent-bedroom-with-full-bathrooms/7505589585.html
