date_time,town,title,price,beds,sqft,url
2022-07-12 13:01, (Auburn),Beautiful Two Bedroom Two Bath!,2500,2,1026.0,https://seattle.craigslist.org/tac/apa/d/federal-way-beautiful-two-bedroom-two/7507973597.html
2022-07-12 13:00, (Carnation),charming home is sure to steal your heart.,2200,1,820.0,https://seattle.craigslist.org/est/apa/d/carnation-charming-home-is-sure-to/7507967459.html
2022-07-12 13:00, (Everett),"Leasing Now, Schedule a Tour, Modern Amenities",2085,3,1150.0,https://seattle.craigslist.org/sno/apa/d/everett-leasing-now-schedule-tour/7507973422.html
2022-07-12 13:00," (416 111th Street Court East, Tacoma, WA)","Fitness Center, Zero Deposit Community, Spacious Breakfast Bars",2045,3,1150.0,https://seattle.craigslist.org/tac/apa/d/tacoma-fitness-center-zero-deposit/7505445108.html
2022-07-12 13:00," (South Lake Union, Seattle)",Space Needle Views Are EVERYTHING!,1695,,330.0,https://seattle.craigslist.org/see/apa/d/seattle-space-needle-views-are/7507973198.html
2022-07-12 13:00, (snohomish county),"High-Speed WiFi, Keyless Entry, Parking",3045,2,1181.0,https://seattle.craigslist.org/sno/apa/d/lynnwood-high-speed-wifi-keyless-entry/7498342648.html
2022-07-12 13:00, (snohomish county),***Its all about Lifestyle and Convenience**,2211,2,864.0,https://seattle.craigslist.org/sno/apa/d/everett-its-all-about-lifestyle-and/7507973147.html
2022-07-12 13:00, (Capitol Hill),"Classic Vintage 1 BD w/ HRD WD, Nat. Light & LRG CLST!!!",1695,1,630.0,https://seattle.craigslist.org/see/apa/d/seattle-classic-vintage-bd-hrd-wd-nat/7507973140.html
2022-07-12 13:00, (tacoma / pierce),Tacoma 6 Bed with AC Ready For Rent this July 15th!,3780,6,2633.0,https://seattle.craigslist.org/tac/apa/d/tacoma-tacoma-bed-with-ac-ready-for/7507965767.html
2022-07-12 13:00," (11301 3rd ave NE, seattle , WA)","Ensuite, Secured Building Access, Recycling",2185,1,625.0,https://seattle.craigslist.org/see/apa/d/seattle-ensuite-secured-building-access/7505646380.html
2022-07-12 12:59, (Fremont / Wallingford / Seattle),"Rooftop views, Community Lounge, BarBQ's",2204,1,545.0,https://seattle.craigslist.org/see/apa/d/seattle-rooftop-views-community-lounge/7507972929.html
2022-07-12 12:59," (255 Lenora St, Seattle, WA)",BRIGHT CORNER one bed / one bath walking distance to Pike Market!,4145,1,793.0,https://seattle.craigslist.org/see/apa/d/seattle-bright-corner-one-bed-one-bath/7502918886.html
2022-07-12 12:59," (10321 Meridian Ave N, Seattle, WA)","Close to I-5, Conveniently Located Near Shopping, Garage Parking",1525,1,570.0,https://seattle.craigslist.org/see/apa/d/seattle-close-to-5-conveniently-located/7501970597.html
2022-07-12 12:58," (12240 Daphne Ln. NW, Silverdale, WA)","Private Balcony or Patio, Full-Size Washer and Dryer, Playground",2090,2,949.0,https://seattle.craigslist.org/kit/apa/d/silverdale-private-balcony-or-patio/7507919367.html
2022-07-12 12:57," (South Lake Union, Seattle)",Gorgeous Top Floor Studio in SLU!,1750,,327.0,https://seattle.craigslist.org/see/apa/d/seattle-gorgeous-top-floor-studio-in-slu/7507972089.html
2022-07-12 12:57, (Lacey),Save Some $$$ With Our 1/2 Off First Month Rent Special,1899,2,1099.0,https://seattle.craigslist.org/oly/apa/d/lacey-save-some-with-our-2-off-first/7507972077.html
2022-07-12 12:57, (tacoma / pierce),A Higher Quality Of Living!,2030,2,1055.0,https://seattle.craigslist.org/tac/apa/d/puyallup-higher-quality-of-living/7502692906.html
2022-07-12 12:57, (Bellevue),16th Floor One Bedroom w/Floor to Ceiling Windows Ready Now!,2376,1,599.0,https://seattle.craigslist.org/est/apa/d/bellevue-16th-floor-one-bedroom-floor/7507971926.html
2022-07-12 12:57, (Bellevue),16th Floor One Bedroom w/Floor to Ceiling Windows Ready Now!,2376,1,599.0,https://seattle.craigslist.org/est/apa/d/bellevue-16th-floor-one-bedroom-floor/7507971926.html
2022-07-12 12:57," (Seattle, WA)","Stunning 3BR/2BA Home - Free Parking, Modern Kitchen, Large Deck",3950,3,1850.0,https://seattle.craigslist.org/see/apa/d/seattle-stunning-3br-2ba-home-free/7507971865.html
2022-07-12 12:56," (Kent WA. Down Town Kent, Bus line, Kent Station, I-5, 167)",Find your Dream Space @ Signature Pointe,2880,3,1300.0,https://seattle.craigslist.org/skc/apa/d/kent-find-your-dream-space-signature/7506390429.html
2022-07-12 12:56, (Bothell),"MOVE IN SPECIAL!! 2nd floor, private location, HUGE walk-in closet!",2531,2,1040.0,https://seattle.craigslist.org/see/apa/d/mill-creek-move-in-special-2nd-floor/7507971442.html
2022-07-12 12:54, (south king co),"Free Wi-Fi, Dishwasher, Stove",2065,3,1138.0,https://seattle.craigslist.org/skc/apa/d/issaquah-free-wi-fi-dishwasher-stove/7497306262.html
2022-07-12 12:54, (Lake City/Shoreline/Cedar Park),"Bright Tahoe Studio + Den with TONS of storage, available now!",1709,,499.0,https://seattle.craigslist.org/see/apa/d/seattle-bright-tahoe-studio-den-with/7507970432.html
2022-07-12 12:54, (Renton),"Near Public Transit, Storage Space, High Speed Internet Available",2210,2,1003.0,https://seattle.craigslist.org/see/apa/d/renton-near-public-transit-storage/7504973832.html
2022-07-12 12:53, (Seattle),"Beautiful, large 1x1 - Floor to Ceiling Windows",2568,1,636.0,https://seattle.craigslist.org/see/apa/d/seattle-beautiful-large-1x1-floor-to/7507969860.html
2022-07-12 12:52, (SEATTLE),LARGE TWO BED TWO BATH IN UPPER QUEEN ANNE,3952,2,1057.0,https://seattle.craigslist.org/see/apa/d/seattle-large-two-bed-two-bath-in-upper/7507969679.html
2022-07-12 12:52," (3852 South 29th Street, Tacoma, WA)","Easy Commute to Military Bases, 2-Bay Manual Car Wash, Playground",2202,2,962.0,https://seattle.craigslist.org/tac/apa/d/tacoma-easy-commute-to-military-bases/7507137711.html
2022-07-12 12:52, (Seattle),Available NOW~ 2 BED 1 BATH! LARGE PATIO!,2599,2,1000.0,https://seattle.craigslist.org/see/apa/d/seattle-available-now-bed-bath-large/7507969444.html
2022-07-12 12:52, (Seattle),"Incredible Features, Grilling Station, Movie Theatre",4520,2,1109.0,https://seattle.craigslist.org/see/apa/d/seattle-incredible-features-grilling/7507969418.html
2022-07-12 12:52, (Belltown/Seattle),Beautiful Corner Loft w/Floor to Ceiling Windows!,2633,1,651.0,https://seattle.craigslist.org/see/apa/d/seattle-beautiful-corner-loft-floor-to/7507969409.html
2022-07-12 12:51, (snohomish county),"Lounge, One-car Garage, Playground",2430,2,966.0,https://seattle.craigslist.org/sno/apa/d/bothell-lounge-one-car-garage-playground/7505099506.html
2022-07-12 12:51, (Lacey),"Clubhouse, Ideal Location, Contact us Today",2379,2,1045.0,https://seattle.craigslist.org/oly/apa/d/lacey-clubhouse-ideal-location-contact/7507969212.html
2022-07-12 12:51, (Arlington),Country Living,750,1,,https://seattle.craigslist.org/sno/apa/d/arlington-country-living/7507959164.html
2022-07-12 12:51," (7413 142nd Avenue East, Sumner, WA)","Oversized Closets, River Access, Playground",2203,2,1092.0,https://seattle.craigslist.org/tac/apa/d/sumner-oversized-closets-river-access/7505478943.html
2022-07-12 12:51, (seattle),Unfurnished studo,850,,445.0,https://seattle.craigslist.org/see/apa/d/seattle-unfurnished-studo/7507963264.html
2022-07-12 12:51, (seattle),"Walk to bus line, Short-term lease, Disposal, Refrigerator",2316,1,669.0,https://seattle.craigslist.org/see/apa/d/seattle-walk-to-bus-line-short-term/7507968946.html
2022-07-12 12:50, (Lakewood/Tacoma),"Easy Access to Freeways, Cozy Wood Burning Fireplaces, Community Park",2137,3,1100.0,https://seattle.craigslist.org/tac/apa/d/lakewood-easy-access-to-freeways-cozy/7507968795.html
2022-07-12 12:50," (Snoqualmie Ridge, Snoqualmie, North Bend, Bellevue, Seattle)","#D102 Move in Ready! Large Living Area, New Carpet",2925,3,1495.0,https://seattle.craigslist.org/est/apa/d/preston-d102-move-in-ready-large-living/7507968695.html
2022-07-12 12:49," (436 Broadway Tacoma, WA)",Spacious 1 bedroom with partial water view READY NOW!,1699,1,667.0,https://seattle.craigslist.org/tac/apa/d/tacoma-spacious-bedroom-with-partial/7507968396.html
2022-07-12 12:49, (eastside),"3/BD 2/BA, Reading room, Located in Redmond",3265,3,1505.0,https://seattle.craigslist.org/est/apa/d/sammamish-bd-ba-reading-room-located-in/7496428330.html
2022-07-12 12:49," (Seattle, Capitol Hill, 1st Hill)","#1112, FULLY remodeled, Stainless Steel, Plank Flooring",1980,,512.0,https://seattle.craigslist.org/see/apa/d/seattle-1112-fully-remodeled-stainless/7507968358.html
2022-07-12 12:49, (snohomish county),"Stainless Steel Appliances, AVAConnect Technology Package, Parking",1995,1,599.0,https://seattle.craigslist.org/sno/apa/d/lynnwood-stainless-steel-appliances/7507968344.html
2022-07-12 12:49, (Redmond),Stunning 2x2 On Redmonds Marymoor Park! TOUR TODAY!,3320,2,976.0,https://seattle.craigslist.org/est/apa/d/redmond-stunning-2x2-on-redmonds/7507968284.html
2022-07-12 12:48, (Capitol hill),Cozy 1Bed 1Bath in the Beating Heart of Captial Hill,1495,1,520.0,https://seattle.craigslist.org/see/apa/d/seattle-cozy-1bed-1bath-in-the-beating/7507967980.html
2022-07-12 12:48, (Seattle),"Get Cozy In Your New Home, Tour Today!",1695,1,625.0,https://seattle.craigslist.org/see/apa/d/seattle-get-cozy-in-your-new-home-tour/7507967953.html
2022-07-12 12:48, (Greenwood/Ballard),Spacious unit with full size washer/dryer,2199,1,765.0,https://seattle.craigslist.org/see/apa/d/seattle-spacious-unit-with-full-size/7507967812.html
2022-07-12 12:47, (Capitol Hill),"Beautifully Vintage 1BD/1BTH W/10ft Ceilings, Nat Light & Wood Floor!",1795,1,705.0,https://seattle.craigslist.org/see/apa/d/seattle-beautifully-vintage-1bd-1bth/7507967411.html
2022-07-12 12:47, (Lakewood/Tacoma),"Easy Access to Freeways, Heaters & Ceiling Fans, Cable and Wi-Fi Ready",1763,2,984.0,https://seattle.craigslist.org/tac/apa/d/lakewood-easy-access-to-freeways/7507967407.html
2022-07-12 12:47, (seattle),"3rd Floor, 2 Sliding Door Closets, Plenty Of Storage, 578 Sqft",2085,,,https://seattle.craigslist.org/see/apa/d/seattle-3rd-floor-sliding-door-closets/7507967331.html
2022-07-12 12:47, (Redmond/Bellevue/Microsoft),"Lovely Bellevue Town Home, 2BR 2-story plan, Modern kitchen, has W/D",3195,2,1100.0,https://seattle.craigslist.org/see/apa/d/bellevue-lovely-bellevue-town-home-2br/7507967319.html
2022-07-12 12:47," (Seattle, University District)","Schedule a Tour, Car Charging Station, Walk In Closets",2820,1,632.0,https://seattle.craigslist.org/see/apa/d/seattle-schedule-tour-car-charging/7507967152.html
2022-07-12 12:47, (seattle),ASK US ABOUT OUR SPECIALS! Ready for IMMEDIATE MOVE-IN!,2703,1,644.0,https://seattle.craigslist.org/see/apa/d/seattle-ask-us-about-our-specials-ready/7507967140.html
2022-07-12 12:47," (714 7th Avenue, Seattle, WA)","Flexible Monthly Payments with Flex Rent, Bay Windows, Microwave",1253,,322.0,https://seattle.craigslist.org/see/apa/d/seattle-flexible-monthly-payments-with/7503756894.html
2022-07-12 12:47," (2325 96th St S Tacoma, WA)",APPLY TODAY MOVE IN TOMORROW! TOP FLOOR 1 BEDROOM,1427,1,650.0,https://seattle.craigslist.org/tac/apa/d/tacoma-apply-today-move-in-tomorrow-top/7507938739.html
2022-07-12 12:46, (Kent),"Mirrored Wardrobe Doors, Dog Wash, Translation Service Available",2131,2,864.0,https://seattle.craigslist.org/see/apa/d/seattle-mirrored-wardrobe-doors-dog/7505463758.html
2022-07-12 12:46, (seattle),"In-Unit Laundry, Night Patrol, Close to Restaurants",4097,2,927.0,https://seattle.craigslist.org/see/apa/d/seattle-in-unit-laundry-night-patrol/7507966945.html
2022-07-12 12:46, (Redmond),"Open 1 Bed - Glass Sliders, Floor 2 Ceiling Windows, Portable AC Port",2410,,591.0,https://seattle.craigslist.org/est/apa/d/redmond-open-bed-glass-sliders-floor/7507966924.html
2022-07-12 12:46, (tacoma / pierce),"Seasonal  Outdoor Pool, Extra Storage, Patio/Balcony",1596,2,950.0,https://seattle.craigslist.org/tac/apa/d/tacoma-seasonal-outdoor-pool-extra/7507966823.html
2022-07-12 12:46," (Puyallup, Tacoma, South Hill, Summit)","Pet Friendly, Garage, Updated Countertops, Patio/Balcony With Storage",1675,1,805.0,https://seattle.craigslist.org/tac/apa/d/puyallup-pet-friendly-garage-updated/7507966771.html
2022-07-12 12:46, (seattle),"Happy Hours, stunning views and vibrant city life? We can deliver.",2189,1,554.0,https://seattle.craigslist.org/see/apa/d/seattle-happy-hours-stunning-views-and/7507965295.html
2022-07-12 12:46, (Woodinville),"Sunset Views, Bright, Spacious, Beautiful Location!",3269,2,1233.0,https://seattle.craigslist.org/est/apa/d/woodinville-sunset-views-bright/7507966711.html
2022-07-12 12:46, (Bellevue),"Lease Today, Concierge, Walk to Bellevue Square Mall",4371,2,1612.0,https://seattle.craigslist.org/est/apa/d/lease-today-concierge-walk-to-bellevue/7507966661.html
2022-07-12 12:45, (Port Orchard),"1x1, 2x1, and 2x2's call now for more details",2009,2,949.0,https://seattle.craigslist.org/kit/apa/d/port-orchard-1x1-2x1-and-2x2s-call-now/7507966476.html
2022-07-12 12:45," (436 Broadway Tacoma, WA)",Top floor corner unit with city views,2199,2,926.0,https://seattle.craigslist.org/tac/apa/d/tacoma-top-floor-corner-unit-with-city/7507966467.html
2022-07-12 12:45, (south king co),The only home that matters to you is here at Signature Pointe!,2482,2,1208.0,https://seattle.craigslist.org/skc/apa/d/seattle-the-only-home-that-matters-to/7502433451.html
2022-07-12 12:45, (Federal Way),Spacious 4 bedroom 2 bathroom Townhome in Federal Way!,2750,4,1480.0,https://seattle.craigslist.org/skc/apa/d/federal-way-spacious-bedroom-bathroom/7505880114.html
2022-07-12 12:45," (1020 West Casino Road, Everett, WA)","Walk-In Closets, Flexible Monthly Payments with Flex Rent, Storage",1596,,450.0,https://seattle.craigslist.org/sno/apa/d/everett-walk-in-closets-flexible/7502012141.html
2022-07-12 12:44, (snohomish county),"Elevators, 24-Hour Fitness Center, Onsite Team",2250,2,919.0,https://seattle.craigslist.org/sno/apa/d/lynnwood-elevators-24-hour-fitness/7506290811.html
2022-07-12 12:44, (Lakewood/Tacoma),"Cable and Wi-Fi Ready, Zero Deposit Community, Microwave & Stove",1600,2,958.0,https://seattle.craigslist.org/tac/apa/d/lakewood-cable-and-wi-fi-ready-zero/7507965925.html
2022-07-12 12:44, (Mountlake Terrace),Townhouse For Rent,2000,2,1060.0,https://seattle.craigslist.org/sno/apa/d/mountlake-terrace-townhouse-for-rent/7507955557.html
2022-07-12 12:43," (97 Byrd Drive, Steilacoom, WA)","Minutes to Pierce College, 24-Hour Maintenance, Dishwasher",1546,1,726.0,https://seattle.craigslist.org/tac/apa/d/steilacoom-minutes-to-pierce-college-24/7506382441.html
2022-07-12 12:43, (Capitol hill),Cozy Studio on Cap Hill â­ walk to plenty of restaurants and shopping,1295,,365.0,https://seattle.craigslist.org/see/apa/d/seattle-cozy-studio-on-cap-hill-walk-to/7496545633.html
2022-07-12 12:42, (PORT ORCHARD),Spacious 3-Bedroom Available August â—,2865,3,1170.0,https://seattle.craigslist.org/kit/apa/d/retsil-spacious-bedroom-available/7507965131.html
2022-07-12 12:42, (Bothell),Beautiful East facing Home in Kings Corner!,3500,4,2200.0,https://seattle.craigslist.org/sno/apa/d/bothell-beautiful-east-facing-home-in/7507965099.html
2022-07-12 12:42, (Capitol hill),Cozy Studio with Large Walk in Closest,1595,,530.0,https://seattle.craigslist.org/see/apa/d/seattle-cozy-studio-with-large-walk-in/7496550688.html
2022-07-12 12:42," (22782 SE 277th PL Maple Valley, WA)",Elk Run 3 bedroom and 2.5 bath with 3 car garage! Available NOW!,2850,3,1830.0,https://seattle.craigslist.org/skc/apa/d/kent-elk-run-bedroom-and-25-bath-with/7507965037.html
2022-07-12 12:42, (Capitol hill),2 BD 1 Bath  â­ Few steps way from nearby restaurants and shopping,2495,2,800.0,https://seattle.craigslist.org/see/apa/d/seattle-bd-bath-few-steps-way-from/7496555463.html
2022-07-12 12:41, (Totem Lake),Spacious 2 Bed 2 Bath With Stunning Views Of Totem Lake,3866,2,1147.0,https://seattle.craigslist.org/est/apa/d/kirkland-spacious-bed-bath-with/7507964629.html
2022-07-12 12:41, (seattle),Stylish Studio Home With All The Perks You Need!!,1685,,456.0,https://seattle.craigslist.org/see/apa/d/seattle-stylish-studio-home-with-all/7507964475.html
2022-07-12 12:41, (Capitol Hill),"2BD/2.5 BTH 2 WEEKS FREE!! Huge Space, Resi Hood, Updtd ktchn & bth!",3595,2,1050.0,https://seattle.craigslist.org/see/apa/d/seattle-2bd-25-bth-weeks-free-huge/7507964466.html
2022-07-12 12:41," (10408 SE 174th St, Renton, WA)","Private Balcony, Open Kitchen, Large Windows!!!",1732,1,678.0,https://seattle.craigslist.org/skc/apa/d/renton-private-balcony-open-kitchen/7502522134.html
2022-07-12 12:41, (tacoma / pierce),"In-Unit Washer & Dryer, Updated Appliances, Lots of Closet Space",1900,2,1030.0,https://seattle.craigslist.org/tac/apa/d/tacoma-in-unit-washer-dryer-updated/7505434947.html
2022-07-12 12:41, (Port Orchard),Available in August! 2 bedroom 2 bathroom 950 sq ft,1800,2,,https://seattle.craigslist.org/kit/apa/d/port-orchard-available-in-august/7507964333.html
2022-07-12 12:41, (Capitol hill),Cozy Studio on Cap Hill â­ walk to plenty of restaurants and shopping,1495,,326.0,https://seattle.craigslist.org/see/apa/d/seattle-cozy-studio-on-cap-hill-walk-to/7496559508.html
2022-07-12 12:40, (Lakewood/Tacoma),"Community Park, Walking & Biking Trails, Dual Pane Windows & Doors",1435,1,743.0,https://seattle.craigslist.org/tac/apa/d/lakewood-community-park-walking-biking/7507964219.html
2022-07-12 12:40, (seattle),Afternoon tours here at The Ivy Ridge Apartments for Spring!,1412,,,https://seattle.craigslist.org/see/apa/d/seattle-afternoon-tours-here-at-the-ivy/7507964163.html
2022-07-12 12:40, (south king co),$1000 off of move in cost if you move in by July 29th,999,1,431.0,https://seattle.craigslist.org/skc/apa/d/federal-way-1000-off-of-move-in-cost-if/7507963800.html
2022-07-12 12:39, (olympia / thurston),"Resort-Style Summer Pool, 24-Hour Fitness Center, Resident Events",1911,1,903.0,https://seattle.craigslist.org/oly/apa/d/olympia-resort-style-summer-pool-24/7500415795.html
2022-07-12 12:39, (Centralia),2 Bdrm Apt-Affordable Housing for Farm Workers,454,2,850.0,https://seattle.craigslist.org/oly/apa/d/centralia-bdrm-apt-affordable-housing/7507963554.html
2022-07-12 12:39, (PORT ORCHARD),Beautiful 1-Bedroom Waiting For You! ðŸ”’,1926,1,694.0,https://seattle.craigslist.org/kit/apa/d/retsil-beautiful-bedroom-waiting-for/7507963276.html
2022-07-12 12:39, (Seattle),MFTE. Live By The Water. Period,1605,1,487.0,https://seattle.craigslist.org/see/apa/d/seattle-mfte-live-by-the-water-period/7507963286.html
2022-07-12 12:39, (Seattle),Remarkable Value. Unbeatable Location.,1495,,334.0,https://seattle.craigslist.org/see/apa/d/seattle-remarkable-value-unbeatable/7507963272.html
2022-07-12 12:39, (Seattle),"Right Around the Corner, Near Everywhere You Want to Be.",1495,,334.0,https://seattle.craigslist.org/see/apa/d/seattle-right-around-the-corner-near/7507963265.html
2022-07-12 12:39, (Seattle),Service with a Lifestyle.,1495,,334.0,https://seattle.craigslist.org/see/apa/d/seattle-service-with-lifestyle/7507963247.html
2022-07-12 12:39, (Seattle),MFTE. How To Live Better at Bode88,1605,1,487.0,https://seattle.craigslist.org/see/apa/d/seattle-mfte-how-to-live-better-at/7507963227.html
2022-07-12 12:38, (Redmond),"Indoor Therapy Spa, Leasing Now, Stylish Features",2905,2,1187.0,https://seattle.craigslist.org/est/apa/d/redmond-indoor-therapy-spa-leasing-now/7507963080.html
2022-07-12 12:38, (Capitol hill),Cozy Studio on Cap Hill â­ walk to plenty of restaurants and shopping,1595,,480.0,https://seattle.craigslist.org/see/apa/d/seattle-cozy-studio-on-cap-hill-walk-to/7496562778.html
2022-07-12 12:38," (11216 18th Avenue South, Tacoma, WA)","Outdoor Swimming Pool, Oversized Walk-In Closets, Pet Friendly",1637,2,853.0,https://seattle.craigslist.org/tac/apa/d/tacoma-outdoor-swimming-pool-oversized/7503697288.html
2022-07-12 12:37, (seattle),Modern Lifestyle You Will Find Here At Assembly 118!,1913,1,530.0,https://seattle.craigslist.org/see/apa/d/seattle-modern-lifestyle-you-will-find/7507962710.html
2022-07-12 12:37, (kitsap / west puget),"Reserved Covered Parking for Each Home, Ceiling Fans, Playground",2495,3,1232.0,https://seattle.craigslist.org/kit/apa/d/silverdale-reserved-covered-parking-for/7505867374.html
2022-07-12 12:37, (Redmond),"High Speed Internet, Modern Amenities, Leasing Now",2890,2,1095.0,https://seattle.craigslist.org/est/apa/d/redmond-high-speed-internet-modern/7507962682.html
2022-07-12 12:37," (Dexter Ave, South Lake Union)",Home With Its Own Private Patio!,2452,1,535.0,https://seattle.craigslist.org/see/apa/d/seattle-home-with-its-own-private-patio/7507962665.html
2022-07-12 12:37, (Capitol hill),1Bed 1Bath on CAPITOL HILL â­ TOUR THIS WEEKEND,1795,1,705.0,https://seattle.craigslist.org/see/apa/d/seattle-1bed-1bath-on-capitol-hill-tour/7496586365.html
2022-07-12 12:37," (10710 17th Avenue South, Tacoma, WA)","Spacious Two Bed, Two Bath, Move In Special! Deposit Free Community!",1849,2,1050.0,https://seattle.craigslist.org/est/apa/d/tacoma-spacious-two-bed-two-bath-move/7507962309.html
2022-07-12 12:36, (kirkland),Get Creative With Your Dream Home At Sailhouse!,4400,2,1393.0,https://seattle.craigslist.org/est/apa/d/kirkland-get-creative-with-your-dream/7507962198.html
2022-07-12 12:36, (Mukilteo),11-202 Townhome in Village Center of Harbour Pointe!,3040,2,1035.0,https://seattle.craigslist.org/sno/apa/d/townhome-in-village-center-of-harbour/7507961998.html
2022-07-12 12:36, (East Capitol Hill),"Mid-Century Style Expansive Windows, Tour Today!",1795,1,500.0,https://seattle.craigslist.org/see/apa/d/seattle-mid-century-style-expansive/7507961931.html
2022-07-12 12:36, (snohomish county),"Stainless Steel Appliances, Playground, Basketball Court",2605,3,1447.0,https://seattle.craigslist.org/sno/apa/d/marysville-stainless-steel-appliances/7507926016.html
2022-07-12 12:35, (Bellevue),"Bellevue 2 bedroom apt, Convenient W/D inside, Near schools & shopping",2550,2,1000.0,https://seattle.craigslist.org/see/apa/d/bellevue-bellevue-bedroom-apt/7507961752.html
2022-07-12 12:35," (521 Stadium Place S, Seattle, WA)",Amazing Views at The Wave in Downtown Seattle,2038,,487.0,https://seattle.craigslist.org/see/apa/d/seattle-amazing-views-at-the-wave-in/7507961738.html
2022-07-12 12:35, (Seattle),1x1! With Patio! W&D! Pet Friendly! BELLTOWN!,2421,1,2421.0,https://seattle.craigslist.org/see/apa/d/seattle-1x1-with-patio-wd-pet-friendly/7507961644.html
2022-07-12 12:35, (Tacoma WA),Available NOW!! 1 Bedroom with Washer and Dryer!! Apply Today! $0 Dep.,1522,1,658.0,https://seattle.craigslist.org/tac/apa/d/tacoma-available-now-bedroom-with/7507961571.html
2022-07-12 12:35, (Tacoma),Tacoma 5 Bed With AC Ready For Rent This July!,3450,5,2438.0,https://seattle.craigslist.org/tac/apa/d/tacoma-tacoma-bed-with-ac-ready-for/7507957596.html
2022-07-12 12:35, (Capitol Hill),"2BD/1BTH Resi Hood, Granite Counters, Corner Unit!!",2495,2,800.0,https://seattle.craigslist.org/see/apa/d/seattle-2bd-1bth-resi-hood-granite/7507961306.html
2022-07-12 12:35," (11301 3rd ave NE, seattle , WA)","Laundry Facility, Security Camera, Controlled Access",2725,2,825.0,https://seattle.craigslist.org/see/apa/d/seattle-laundry-facility-security/7507961296.html
2022-07-12 12:34," (929 North 4th Ave  Kent, WA)",Kent downtown 2 bedroom apartment with 1 car garage! Available NOW!,1895,2,900.0,https://seattle.craigslist.org/skc/apa/d/kent-kent-downtown-bedroom-apartment/7507961224.html
2022-07-12 12:34, (Capitol hill),Cozy 1Bed 1Bath in the Beating Heart of Captial Hill,1695,1,630.0,https://seattle.craigslist.org/see/apa/d/seattle-cozy-1bed-1bath-in-the-beating/7496588417.html
2022-07-12 12:34," (407 Valley Ave NE Puyallup, WA)",Convenience. Comfort. Community. âœ”,1989,2,891.0,https://seattle.craigslist.org/tac/apa/d/puyallup-convenience-comfort-community/7507961022.html
2022-07-12 12:33, (Bothell),Gracious 1209 Sq. Ft. square foot apartment in Bothell,2850,3,1209.0,https://seattle.craigslist.org/see/apa/d/bothell-gracious-1209-sq-ft-square-foot/7507960475.html
2022-07-12 12:33, (Lakewood/Tacoma),"Business Center Onsite, Dishwasher, Clubhouse",1699,2,850.0,https://seattle.craigslist.org/tac/apa/d/lakewood-business-center-onsite/7507960463.html
2022-07-12 12:33, (snohomish county),Summer Time Is Here! Tour Our 2x1 Today!!,2499,3,1367.0,https://seattle.craigslist.org/sno/apa/d/everett-summer-time-is-here-tour-our/7507960409.html
2022-07-12 12:33," (21010 39th Way S Sea Tac, WA)",Massive 1 bedroom,2016,1,694.0,https://seattle.craigslist.org/see/apa/d/kent-massive-bedroom/7507960324.html
2022-07-12 12:32, (Edmonds),2 Bedroom 1 Bath Apartment,1650,2,910.0,https://seattle.craigslist.org/sno/apa/d/mountlake-terrace-bedroom-bath-apartment/7507960152.html
2022-07-12 12:32, (Seattle),"Perfect Location, Resident Lounge, Office Spaces",2311,1,695.0,https://seattle.craigslist.org/see/apa/d/perfect-location-resident-lounge-office/7507960024.html
2022-07-12 12:32, (Bothell),Available Now! 1 Bedroom Apartments at Rivercroft Apartments,1920,1,722.0,https://seattle.craigslist.org/est/apa/d/mill-creek-available-now-bedroom/7507959994.html
2022-07-12 12:32," (520 Occidental Ave S, Seattle, WA)",Urban Apartments in the Nolo Tower in Historic Pioneer Square,1968,,542.0,https://seattle.craigslist.org/see/apa/d/seattle-urban-apartments-in-the-nolo/7507088874.html
2022-07-12 12:31, (Seattle),MFTE. Live The Extraordinary.,1605,1,487.0,https://seattle.craigslist.org/see/apa/d/seattle-mfte-live-the-extraordinary/7507959680.html
2022-07-12 12:31, (Seattle),Dream Big. Live Well.,1495,,334.0,https://seattle.craigslist.org/see/apa/d/seattle-dream-big-live-well/7507959678.html
2022-07-12 12:31, (Seattle),History. Remade.,1495,,334.0,https://seattle.craigslist.org/see/apa/d/seattle-history-remade/7507959655.html
2022-07-12 12:31, (Seattle),Eat. Play. Live.,1495,,334.0,https://seattle.craigslist.org/see/apa/d/seattle-eat-play-live/7507959640.html
2022-07-12 12:31, (Seattle),MFTE. Cozy inside retreat for everyday,1605,1,487.0,https://seattle.craigslist.org/see/apa/d/seattle-mfte-cozy-inside-retreat-for/7507959622.html
