date_time,town,title,price,beds,sqft,url
2022-07-12 18:59," (Auburn, GRCC, Kent, Federal Way, Renton)",Spacious townhouse with 2 br 2 ba,1980,2,1189.0,https://seattle.craigslist.org/skc/apa/d/auburn-spacious-townhouse-with-br-ba/7496854873.html
2022-07-12 18:57, (snohomish county),2bd/1bth Bedroom Apartment Come Tour Today! Get Ready For Summer!,1752,2,660.0,https://seattle.craigslist.org/sno/apa/d/lynnwood-2bd-1bth-bedroom-apartment/7508104778.html
2022-07-12 18:57," (Seattle, WA)",Pick and Choose Your Home Before We're 100% Occupied! New Build!,1550,,320.0,https://seattle.craigslist.org/see/apa/d/seattle-pick-and-choose-your-home/7508104755.html
2022-07-12 18:57," (3231 S 204th St, SeaTac, WA)","Electric Range, Large Closets, Spa",1899,2,900.0,https://seattle.craigslist.org/see/apa/d/seattle-electric-range-large-closets-spa/7497435788.html
2022-07-12 18:56," (6115 111th Street East, Puyallup , WA)","Clubhouse, Hardwood Flooring, Double Sinks",1948,2,946.0,https://seattle.craigslist.org/tac/apa/d/puyallup-clubhouse-hardwood-flooring/7500038565.html
2022-07-12 18:56," (3825 Bridge Way N Seattle, WA)","$2,255 / 636 sqft - 1Bed in beautiful Fremont neighborhood !",2255,1,636.0,https://seattle.craigslist.org/see/apa/d/seattle-sqft-1bed-in-beautiful-fremont/7508083221.html
2022-07-12 18:55, (Bellevue),"Prime Location, Spacious Homes! Tour The Borgata Apartments Today!!",3650,2,1155.0,https://seattle.craigslist.org/est/apa/d/bellevue-prime-location-spacious-homes/7508104279.html
2022-07-12 18:55, (Olympia),lovely Single Family Home,1795,2,1502.0,https://seattle.craigslist.org/oly/apa/d/olympia-lovely-single-family-home/7508084033.html
2022-07-12 18:54," (16100 Linden Ave N, Seattle-Tacoma, WA)",We welcome you and your fur babies to your new home!,1600,1,683.0,https://seattle.craigslist.org/see/apa/d/seattle-we-welcome-you-and-your-fur/7508104056.html
2022-07-12 18:54," (1415 Northwest Santa Fe Lane, Silverdale, WA)","Stainless Steel Appliances, Additional Storage, Rock Climbing Wall",2295,2,1100.0,https://seattle.craigslist.org/kit/apa/d/silverdale-stainless-steel-appliances/7506575705.html
2022-07-12 18:52," (Seattle, Queen Anne Neighborhood)",Be the First to Live Here! New Building x Starting at $1550! Tour 2Day,1550,,320.0,https://seattle.craigslist.org/see/apa/d/seattle-be-the-first-to-live-here-new/7508103526.html
2022-07-12 18:51, (seattle),Beautiful Studio in Downtown Renton,1542,,558.0,https://seattle.craigslist.org/see/apa/d/renton-beautiful-studio-in-downtown/7506522222.html
2022-07-12 18:50, (seattle),incredible luxurious one bed one bath for lease,1600,1,413.0,https://seattle.craigslist.org/see/apa/d/seattle-incredible-luxurious-one-bed/7508090395.html
2022-07-12 18:50, (Bellevue),2BR 2BA apt | Close to schools | Modern kitchen | Enjoy BONUS Sun Room,2550,2,1000.0,https://seattle.craigslist.org/see/apa/d/bellevue-2br-2ba-apt-close-to-schools/7506424688.html
2022-07-12 18:50," (1433 8th Street Northeast , Auburn, WA)","Stainless Steel Appliances, Pantries, Spacious Areas, W/D, $0 DEPOSIT!",2023,2,950.0,https://seattle.craigslist.org/tac/apa/d/auburn-stainless-steel-appliances/7506533064.html
2022-07-12 18:47," (12240 Daphne Ln. NW, Silverdale, WA)","Fireside Lounge, Stainless Steel Appliances, Private Balcony or Patio",2330,3,1028.0,https://seattle.craigslist.org/kit/apa/d/silverdale-fireside-lounge-stainless/7508075999.html
2022-07-12 18:47," (1020 West Casino Road, Everett, WA)","Walk to Shopping, Large Open Floor Plans, Cabana",1844,2,980.0,https://seattle.craigslist.org/sno/apa/d/everett-walk-to-shopping-large-open/7508102274.html
2022-07-12 18:47," (Queen Anne-GATES FOUNDATION, SLU)","Queen Anne-  VIEW LAMINATE FLOOR,SPACE NEEDLE",1495,1,450.0,https://seattle.craigslist.org/see/apa/d/seattle-queen-anne-view-laminate/7508102208.html
2022-07-12 18:46, (seattle),Beautiful Townhome in Downtown Renton,2591,2,1169.0,https://seattle.craigslist.org/see/apa/d/renton-beautiful-townhome-in-downtown/7506519854.html
2022-07-12 18:46," (400 S Jackson Street  , Seattle, WA)","Night Patrol, Pet Friendly, USB Charging Outlets",1885,1,536.0,https://seattle.craigslist.org/see/apa/d/seattle-night-patrol-pet-friendly-usb/7500762805.html
2022-07-12 18:45," (2611 84th Street Ct , Lakewood, WA)","Washers & Dryers in Every Home, Microwave & Stove, Community Park",1763,2,984.0,https://seattle.craigslist.org/tac/apa/d/lakewood-washers-dryers-in-every-home/7508101788.html
2022-07-12 18:45," (15907 Ash Way Lynnwood, WA)",COZY 1 BEDROOM 1 BATHROOM AVAILABLE IN OCTOBER!!!,1408,1,790.0,https://seattle.craigslist.org/sno/apa/d/lynnwood-cozy-bedroom-bathroom/7508090034.html
2022-07-12 18:43, (eastside),Unique floor plans that take advantage of available light and views,2543,1,733.0,https://seattle.craigslist.org/est/apa/d/redmond-unique-floor-plans-that-take/7508101189.html
2022-07-12 18:42, (seattle),2 weeks free on our floor to ceiling home in the heart of Seattle DT!,3150,1,863.0,https://seattle.craigslist.org/see/apa/d/seattle-weeks-free-on-our-floor-to/7508100907.html
2022-07-12 18:41, (seattle),"Full-Size Washer/Dryer, Double Sinks, Basketball & Tennis Courts",1733,1,700.0,https://seattle.craigslist.org/see/apa/d/seattle-full-size-washer-dryer-double/7505659220.html
2022-07-12 18:41," (58th Avenue East , Tacoma, WA)","Stainless Steel Appliances, Freeway Access, Outdoor Swimming Pool",1835,2,864.0,https://seattle.craigslist.org/tac/apa/d/tacoma-stainless-steel-appliances/7508100630.html
2022-07-12 18:40, (tacoma / pierce),"European Style Cabinets, Fitness Center, Dishwasher",1310,1,637.0,https://seattle.craigslist.org/tac/apa/d/tacoma-european-style-cabinets-fitness/7496596650.html
2022-07-12 18:40," (2901 Auburn Way South, Auburn, WA)",Courtyard & pool view | 1BR 1BA apt | Fully-equipped kitchen | Auburn,1450,1,550.0,https://seattle.craigslist.org/skc/apa/d/auburn-courtyard-pool-view-1br-1ba-apt/7508100367.html
2022-07-12 18:38, (Kent),"Wood-Burning Fireplace*, Off-Leash Dog Park, Public Parks Nearby",1995,2,891.0,https://seattle.craigslist.org/see/apa/d/seattle-wood-burning-fireplace-off/7508100067.html
2022-07-12 18:37, (eastside),"3BD 2BA, Polished quartz countertops, Redmond WA",3265,3,1505.0,https://seattle.craigslist.org/est/apa/d/sammamish-3bd-2ba-polished-quartz/7498307721.html
2022-07-12 18:36," (10710 17th Avenue South, Tacoma, WA)","Two Bed, One Bath, Move In Special ! Deposit Free Community!!",1718,2,924.0,https://seattle.craigslist.org/est/apa/d/tacoma-two-bed-one-bath-move-in-special/7508099554.html
2022-07-12 18:36," (13543 Greenwood Ave N, Seattle-Tacoma, WA)",Looking for the perfect place to call home?,1700,1,619.0,https://seattle.craigslist.org/see/apa/d/seattle-looking-for-the-perfect-place/7508099459.html
2022-07-12 18:35," (3852 South 29th Street, Tacoma, WA)","Close to Schools, Restaurants & Shops, Fitness Center, Playground",2000,2,962.0,https://seattle.craigslist.org/tac/apa/d/tacoma-close-to-schools-restaurants/7503308124.html
2022-07-12 18:34," (10031 Southeast 258th Place, Kent, WA)","Quartz Countertops, Patio/Balcony, Stainless Steel Appliances",1911,2,985.0,https://seattle.craigslist.org/skc/apa/d/kent-quartz-countertops-patio-balcony/7508098995.html
2022-07-12 18:34, (Lakeland Hills),"Private Balcony or Patio, Nine-foot Ceilings, Pay on Line Feature",1787,1,741.0,https://seattle.craigslist.org/tac/apa/d/auburn-private-balcony-or-patio-nine/7508098943.html
2022-07-12 18:34, (Poulsbo),Poulsbo 2 Bedroom Duplex,1600,2,1000.0,https://seattle.craigslist.org/kit/apa/d/poulsbo-bedroom-duplex/7504714886.html
2022-07-12 18:34," (1610 West James Place, Kent, WA)","Wood Look Flooring, Mirrored Wardrobe Doors, Washer/Dryer",2089,2,864.0,https://seattle.craigslist.org/see/apa/d/seattle-wood-look-flooring-mirrored/7505643825.html
2022-07-12 18:34, (North Queen Anne),"High ceilings, high windows, private patio and a great neighborhood!",2074,1,2744.0,https://seattle.craigslist.org/see/apa/d/seattle-high-ceilings-high-windows/7508098808.html
2022-07-12 18:33, (North Queen Anne),Wake up to the birds singing right outside your window!,2533,1,700.0,https://seattle.craigslist.org/see/apa/d/seattle-wake-up-to-the-birds-singing/7508098635.html
2022-07-12 18:33," (1321 Minor Avenue, Seattle, WA)","Bright living space, Comfortable 1BR apt, In-home W/D, Modern kitchen",1995,1,647.0,https://seattle.craigslist.org/see/apa/d/seattle-bright-living-space-comfortable/7508098629.html
2022-07-12 18:33, (North Queen Anne),Extra large windows to let in the sun!,2540,1,700.0,https://seattle.craigslist.org/see/apa/d/seattle-extra-large-windows-to-let-in/7508098533.html
2022-07-12 18:32, (seattle),Penthouse living with massive private balcony on rooftop-2 weeks free!,5900,2,1098.0,https://seattle.craigslist.org/see/apa/d/seattle-penthouse-living-with-massive/7508098302.html
2022-07-12 18:31," (2510 Western Avenue, Suite 100 , Seattle, WA)","Balconies With Stunning Views, Courtyard, Planned Social Activities",1479,,426.0,https://seattle.craigslist.org/see/apa/d/seattle-balconies-with-stunning-views/7508098278.html
2022-07-12 18:31, (south king co),2 Bed 2 Bath Available Now!,2570,2,966.0,https://seattle.craigslist.org/skc/apa/d/black-diamond-bed-bath-available-now/7508098149.html
2022-07-12 18:30," (58th Avenue East , Tacoma, WA)","Cabana, Patio or Balcony, Window Coverings",1547,1,576.0,https://seattle.craigslist.org/tac/apa/d/tacoma-cabana-patio-or-balcony-window/7502945868.html
2022-07-12 18:30, (seattle),amazing one bed one bath for lease,1750,1,855.0,https://seattle.craigslist.org/see/apa/d/seattle-amazing-one-bed-one-bath-for/7508094452.html
2022-07-12 18:29," (2359 Franklin Ave East Seattle, WA)","$2,200 /775ft - LUXURY LOFT IN EASTLAKE - LEASING SPECIAL",2200,,775.0,https://seattle.craigslist.org/see/apa/d/seattle-ft-luxury-loft-in-eastlake/7508067499.html
2022-07-12 18:28, (Seattle),1 Bedroom - Beacon Hill Area,1650,1,600.0,https://seattle.craigslist.org/see/apa/d/seattle-bedroom-beacon-hill-area/7508064001.html
2022-07-12 18:28, (Seattle),"2BR fully furnished condo, newly remodeled,  w/parking, in-unit W/D",3400,2,800.0,https://seattle.craigslist.org/see/apa/d/seattle-2br-fully-furnished-condo-newly/7508097316.html
2022-07-12 18:28," (3825 Bridge Way N Seattle, WA)","$1,525 /348ft2 - Inspire Fremont Beautiful Building!",1525,,348.0,https://seattle.craigslist.org/see/apa/d/seattle-ft2-inspire-fremont-beautiful/7508078440.html
2022-07-12 18:27," (8333 32nd Avenue South, Lakewood, WA)","In Unit Washer & Dryers, Spacious Front & Back Yards, Playground",1748,2,860.0,https://seattle.craigslist.org/tac/apa/d/lakewood-in-unit-washer-dryers-spacious/7508097053.html
2022-07-12 18:27, (801 Pine Street Seattle),"A Must See, Penthouse 1288sq.ft 2-Bdrm Near The Paramount!",3998,2,1288.0,https://seattle.craigslist.org/see/apa/d/seattle-must-see-penthouse-1288sqft/7508096967.html
2022-07-12 18:26," (Medina, WA)","3 bedroom, 1.5 bath rambler in Medina Gorgeous hardwoods floor.",2398,3,1380.0,https://seattle.craigslist.org/skc/apa/d/medina-bedroom-15-bath-rambler-in/7508086169.html
2022-07-12 18:25, (Port Orchard),Make Atlas Your Home!,2700,3,1069.0,https://seattle.craigslist.org/kit/apa/d/retsil-make-atlas-your-home/7508096665.html
2022-07-12 18:24, (south king co),"Quartz countertops, Picnic areas, Future retail",2665,2,1011.0,https://seattle.craigslist.org/skc/apa/d/black-diamond-quartz-countertops-picnic/7508096333.html
2022-07-12 18:24, (Renton),"Modern 2BR Private entry guest suite, Everything included",2500,2,1000.0,https://seattle.craigslist.org/skc/apa/d/renton-modern-2br-private-entry-guest/7505619414.html
2022-07-12 18:24, (Mercer Island),This beautiful 2bd/2ba has everything your looking for! Tour Today!,6485,2,2072.0,https://seattle.craigslist.org/see/apa/d/mercer-island-this-beautiful-2bd-2ba/7508096246.html
2022-07-12 18:23," (3852 South 29th Street, Tacoma, WA)","2-Bay Manual Car Wash, Accent Walls, Zero Deposit Community",1994,2,962.0,https://seattle.craigslist.org/tac/apa/d/tacoma-bay-manual-car-wash-accent-walls/7508095943.html
2022-07-12 18:22," (2301 58th Avenue East , Fife, WA)","Clubhouse, Translation Service Available, Dishwasher",1784,2,800.0,https://seattle.craigslist.org/tac/apa/d/tacoma-clubhouse-translation-service/7508095734.html
2022-07-12 18:22," (4015 133rd St. SE Mill Creek, WA)","3 bd/2bath for only $1,984/month. Available in December",1984,3,1149.0,https://seattle.craigslist.org/sno/apa/d/everett-bd-2bath-for-only-1984-month/7508088760.html
2022-07-12 18:22, (eastside),There's a place here for you at Hyde Square!,2564,1,709.0,https://seattle.craigslist.org/est/apa/d/bellevue-theres-place-here-for-you-at/7508095629.html
2022-07-12 18:21," (2615 1st Avenue, Seattle, WA)",Belltown 1BR apt | Well-equipped kitchen | W/D in-home | Pet-friendly,2298,1,610.0,https://seattle.craigslist.org/see/apa/d/seattle-belltown-1br-apt-well-equipped/7508095455.html
2022-07-12 18:21, (south king co),"Community events, Electric fireplaces (in select homes)",2665,3,1070.0,https://seattle.craigslist.org/skc/apa/d/black-diamond-community-events-electric/7508095214.html
2022-07-12 18:20," (2170 Bel-Red Road, Seattle-Tacoma, WA)","1/BD 1/BA, Only Unit in this floor plan! Roof top lounges!",2484,1,609.0,https://seattle.craigslist.org/est/apa/d/bellevue-bd-ba-only-unit-in-this-floor/7507131852.html
2022-07-12 18:20, (Redmond),Vision 5 Apartments!,1295,,190.0,https://seattle.craigslist.org/est/apa/d/redmond-vision-apartments/7508075439.html
2022-07-12 18:20, (Seattle),Amazing floor and view in the heart of interbay! Tour now!,2270,1,730.0,https://seattle.craigslist.org/see/apa/d/seattle-amazing-floor-and-view-in-the/7508094973.html
2022-07-12 18:19, (Redmond),How To Live Better at The Luke Apartments!,2184,1,674.0,https://seattle.craigslist.org/est/apa/d/redmond-how-to-live-better-at-the-luke/7508094885.html
2022-07-12 18:19," (420 West Smith Street, Kent, WA)",1 Bed w/ Den Available for August Move-in! Enjoy Living Near Shops!,2042,1,830.0,https://seattle.craigslist.org/skc/apa/d/seattle-bed-den-available-for-august/7508094884.html
2022-07-12 18:19, (seattle),Studio with a View,1542,,558.0,https://seattle.craigslist.org/see/apa/d/renton-studio-with-view/7506523824.html
2022-07-12 18:19, (Redmond),Spacious Modern Living!,2229,1,608.0,https://seattle.craigslist.org/est/apa/d/redmond-spacious-modern-living/7508094762.html
2022-07-12 18:19, (Issaquah),"2b + Den - Offering One-Time Special, Call Today!!",2811,2,1169.0,https://seattle.craigslist.org/est/apa/d/issaquah-2b-den-offering-one-time/7508094750.html
2022-07-12 18:19, (south king co),"Yoga & exercise room, Views, Clubhouse",1380,1,618.0,https://seattle.craigslist.org/skc/apa/d/federal-way-yoga-exercise-room-views/7505610541.html
2022-07-12 18:18," (1809 105th Street Court South, Tacoma, WA)","Two State-of-the-Art Playgrounds, Dog Park, Pool",1596,2,950.0,https://seattle.craigslist.org/tac/apa/d/tacoma-two-state-of-the-art-playgrounds/7508094597.html
2022-07-12 18:18, (Renton),"EV Charging Stations, Mountain and Lakeviews Available, Open Layouts",2200,1,821.0,https://seattle.craigslist.org/skc/apa/d/renton-ev-charging-stations-mountain/7508094525.html
2022-07-12 18:18," (2226 Elliott Avenue, Seattle, WA)","2BR 2BA apt for the avid city dweller, Stainless kitchen, in Belltown",2950,2,975.0,https://seattle.craigslist.org/see/apa/d/seattle-2br-2ba-apt-for-the-avid-city/7506449359.html
2022-07-12 18:18, (south king co),"Hiking trails nearby, Playgrounds, Future retail",2665,2,1011.0,https://seattle.craigslist.org/skc/apa/d/black-diamond-hiking-trails-nearby/7508094441.html
2022-07-12 18:18," (10710 17th Avenue South, Tacoma, WA)","Spacious Two Bed, Two Bath, Move In Special! Deposit Free Community!!",1856,2,1050.0,https://seattle.craigslist.org/est/apa/d/tacoma-spacious-two-bed-two-bath-move/7508094433.html
2022-07-12 18:18," (13410 Greenwood Ave N, Seattle-Tacoma, WA)","Located Near Major Bus Lines, Pet Friendly, Washer/Dryer",1500,1,570.0,https://seattle.craigslist.org/see/apa/d/seattle-located-near-major-bus-lines/7508094381.html
2022-07-12 18:17, (Bellevue),Pre-Lease This Gorgeous 3 Bedroom!,3150,3,1224.0,https://seattle.craigslist.org/est/apa/d/bellevue-pre-lease-this-gorgeous-bedroom/7508094259.html
2022-07-12 18:17, (Pacific),"Refrigerator, Controlled Access, Community Room",1458,1,539.0,https://seattle.craigslist.org/tac/apa/d/pacific-refrigerator-controlled-access/7508094201.html
2022-07-12 18:17, (Everett),"Large Closets, Playground, Onsite Maintenance, Wood Burning Fireplaces",1989,1,720.0,https://seattle.craigslist.org/sno/apa/d/everett-large-closets-playground-onsite/7508094195.html
2022-07-12 18:17, (Medina - Downtown Bellevue - Clyde Hill),"Large, Modern, Renovated, Park-like Setting! Two Bedroom",3725,2,1211.0,https://seattle.craigslist.org/est/apa/d/bellevue-large-modern-renovated-park/7508094174.html
2022-07-12 18:16, (Snohomish),"Rare, super cute home on the *lettered streets* in heart of historic",1200,1,600.0,https://seattle.craigslist.org/sno/apa/d/snohomish-rare-super-cute-home-on-the/7508082162.html
2022-07-12 18:16, (snohomish county),"On-site Maintenance, Basketball Court, Patio",2305,2,1281.0,https://seattle.craigslist.org/sno/apa/d/marysville-on-site-maintenance/7508076499.html
2022-07-12 18:16," (10815 SE 184th Lane, Renton, WA)","Fitness Center, Covered Parking, Wood-burning Fireplace",1945,1,745.0,https://seattle.craigslist.org/skc/apa/d/renton-fitness-center-covered-parking/7508093883.html
2022-07-12 18:15," (7413 142nd Avenue East, Sumner, WA)","Fireplace, Dining Room, River Access",1997,2,977.0,https://seattle.craigslist.org/tac/apa/d/sumner-fireplace-dining-room-river/7508093737.html
2022-07-12 18:15, (Everett),"BBQ & Picnic Area, Ceiling Fan, Renovated Homes**, Patio or Balcony",1906,2,820.0,https://seattle.craigslist.org/sno/apa/d/everett-bbq-picnic-area-ceiling-fan/7508093727.html
2022-07-12 18:15, (eastside),"Central Air Conditioning, Seamless glass enclosed showers",3566,1,765.0,https://seattle.craigslist.org/est/apa/d/bellevue-central-air-conditioning/7508093559.html
2022-07-12 18:14," (97 Byrd Drive, Steilacoom, WA)","Close to Steilacoom Park, Patio/Balcony On Select Units, Close to JBLM",1379,1,726.0,https://seattle.craigslist.org/tac/apa/d/steilacoom-close-to-steilacoom-park/7508093497.html
2022-07-12 18:14," (714 7th Avenue, Seattle, WA)","Close to Bus lines, Laundry Onsite, Pet Friendly",1253,,322.0,https://seattle.craigslist.org/see/apa/d/seattle-close-to-bus-lines-laundry/7505086749.html
2022-07-12 18:14, (Kent),Better Living Near You! Near The Heart Of Kent! Newly Renovated Units!,1709,1,600.0,https://seattle.craigslist.org/skc/apa/d/kent-better-living-near-you-near-the/7508093436.html
2022-07-12 18:14," (14700 NE 35th St, Bellevue, WA)",2BR 2BA apt : Deck w/ BONUS storage : Modern kitchen : Walk-in closets,2850,2,1089.0,https://seattle.craigslist.org/see/apa/d/bellevue-2br-2ba-apt-deck-bonus-storage/7508093430.html
2022-07-12 18:14, (MountLake Terrace),One month Free Lok and Lease! Studio with a Patio,1709,1,770.0,https://seattle.craigslist.org/sno/apa/d/mountlake-terrace-one-month-free-lok/7508093332.html
2022-07-12 18:13," (714 7th Avenue, Seattle, WA)","Walking Distance to Everything You Need, Dishwasher, Pet Friendly",1199,,253.0,https://seattle.craigslist.org/see/apa/d/seattle-walking-distance-to-everything/7508093064.html
2022-07-12 18:13," (2301 58th Avenue East , Fife, WA)","Fitness Center, New Vinyl Windows, Translation Service Available",1727,2,800.0,https://seattle.craigslist.org/tac/apa/d/tacoma-fitness-center-new-vinyl-windows/7506150257.html
2022-07-12 18:13, (East Hill Kent),"A cottage with a beautiful lake view, available on Sept 1st 2022",1800,1,420.0,https://seattle.craigslist.org/skc/apa/d/kent-cottage-with-beautiful-lake-view/7508093001.html
2022-07-12 18:11," (3509 South Orchard Street, Tacoma, WA)",Living excellence,1924,2,1030.0,https://seattle.craigslist.org/tac/apa/d/tacoma-living-excellence/7508092679.html
2022-07-12 18:11, (Lower Queen Anne),"On-site Storage, Custom Closets, High Ceilings",2357,1,573.0,https://seattle.craigslist.org/see/apa/d/seattle-on-site-storage-custom-closets/7508092664.html
2022-07-12 18:11," (1415 Northwest Santa Fe Lane, Silverdale, WA)","Complimentary Wi-Fi access in Cabana, Additional Storage, Playground",2500,3,1232.0,https://seattle.craigslist.org/kit/apa/d/silverdale-complimentary-wi-fi-access/7508092629.html
2022-07-12 18:10," (97 Byrd Drive, Steilacoom, WA)","Additional Laundry Facility, Close to JBLM, Washer & Dryer",2281,3,1126.0,https://seattle.craigslist.org/tac/apa/d/steilacoom-additional-laundry-facility/7506512422.html
2022-07-12 18:10, (Seattle/Belltown),"9th floor NE Facing 1x1 , 10-foot ceiling! City and Waterfront Views!",3408,1,808.0,https://seattle.craigslist.org/see/apa/d/seattle-9th-floor-ne-facing-1x1-10-foot/7508092203.html
2022-07-12 18:10, (Everett),"Waterfront Views, Gorgeous Floorplan!",2706,2,993.0,https://seattle.craigslist.org/sno/apa/d/everett-waterfront-views-gorgeous/7508092141.html
2022-07-12 18:10, (eastside),"Dual open fridge*, Engage business center, Asana yoga studio",3566,1,765.0,https://seattle.craigslist.org/est/apa/d/bellevue-dual-open-fridge-engage/7508092135.html
2022-07-12 18:10, (Everett),Love Where You Live!,1904,2,864.0,https://seattle.craigslist.org/sno/apa/d/everett-love-where-you-live/7508092118.html
2022-07-12 18:09, (Seattle),"Views of City Skyline, Mt. Rainer, and Elliot Bay",2854,1,840.0,https://seattle.craigslist.org/see/apa/d/seattle-views-of-city-skyline-mt-rainer/7508092089.html
2022-07-12 18:09, (tacoma),House For Rent/Lease,2680,3,,https://seattle.craigslist.org/tac/apa/d/tacoma-house-for-rent-lease/7508079299.html
2022-07-12 18:09," (South Lake Union, Downtown Seattle, Capitol Hill)","Traditional 1x1, 1st Floor, High Vaulted Ceiling, Available 8/01!",2624,1,713.0,https://seattle.craigslist.org/see/apa/d/seattle-traditional-1x1-1st-floor-high/7508092049.html
2022-07-12 18:09, (Bellevue),Beautiful 2x2 W/High Vaulted Ceilings Available Soon! Call Us Today!,3021,2,1000.0,https://seattle.craigslist.org/est/apa/d/bellevue-beautiful-2x2-high-vaulted/7508092024.html
2022-07-12 18:09," (25102 62nd Avenue South, Kent, WA)",Your life deserves the calm and the scenery we offer!,1733,1,700.0,https://seattle.craigslist.org/skc/apa/d/seattle-your-life-deserves-the-calm-and/7508092020.html
2022-07-12 18:09, (Northgate),Open bedroom + den available Now!,2075,1,820.0,https://seattle.craigslist.org/see/apa/d/seattle-open-bedroom-den-available-now/7508082147.html
2022-07-12 18:09," (628 - 128th Street S.W. Everett, WA.)","Private, Fenced Yard Apt. available in NOW! Beautiful!",2150,2,1005.0,https://seattle.craigslist.org/sno/apa/d/everett-private-fenced-yard-apt/7508090363.html
2022-07-12 18:09, (south king co),Create awesome memories in this place you can call home!,2120,2,915.0,https://seattle.craigslist.org/skc/apa/d/seattle-create-awesome-memories-in-this/7506510822.html
2022-07-12 18:08, (Silverdale),"Feel The Sunshine, & Experience The Wellington Lifestyle! 1 Month FREE",2100,2,,https://seattle.craigslist.org/kit/apa/d/silverdale-feel-the-sunshine-experience/7508091774.html
2022-07-12 18:08," (8022 83rd Avenue Southwest, Lakewood, WA)","Outdoor Fitness Center, Newly Renovated, Indoor Fitness Center",1875,2,880.0,https://seattle.craigslist.org/tac/apa/d/lakewood-outdoor-fitness-center-newly/7508091759.html
2022-07-12 18:08," (8333 32nd Avenue South, Lakewood, WA)","Washer/Dryer in All Homes, Translation Service Available, Playground",1699,2,850.0,https://seattle.craigslist.org/tac/apa/d/lakewood-washer-dryer-in-all-homes/7508091735.html
2022-07-12 18:07," (1248 Cedar Ave, Marysville, WA)","Spacious Townhome, Washer/Dryer, Playground and Pet Park!",2295,2,980.0,https://seattle.craigslist.org/sno/apa/d/marysville-spacious-townhome-washer/7503794973.html
2022-07-12 18:07, (Downtown Auburn),"30-Day Guarantee, Midrise Luxury, Heart of Downtown",1703,1,504.0,https://seattle.craigslist.org/skc/apa/d/auburn-30-day-guarantee-midrise-luxury/7500226855.html
2022-07-12 18:07," (1433 8th Street Northeast , Auburn, WA)",You Will Guarantee to Enjoy Summer Here! Move in w/ $0 DEPOSIT! #w/d,1681,1,700.0,https://seattle.craigslist.org/tac/apa/d/auburn-you-will-guarantee-to-enjoy/7508091256.html
2022-07-12 18:06, (Redmond),"Act Now! Last 2 Bedroom Available, Top Floor, Corner Home!",3185,2,815.0,https://seattle.craigslist.org/est/apa/d/redmond-act-now-last-bedroom-available/7508091214.html
2022-07-12 18:06, (BURIEN),Hurry in while it lasts!,1705,1,646.0,https://seattle.craigslist.org/see/apa/d/seattle-hurry-in-while-it-lasts/7508085515.html
2022-07-12 18:06, (Redmond),"1 Bed + Den Quick walk 2 Transit, QFC, Trader Joes & Restaurants!",2905,1,806.0,https://seattle.craigslist.org/est/apa/d/redmond-bed-den-quick-walk-transit-qfc/7508091124.html
2022-07-12 18:06, (First Hill/Yesler/International District),2x2 Great Floorplan! 6 weeks Free!,3030,2,988.0,https://seattle.craigslist.org/see/apa/d/seattle-2x2-great-floorplan-weeks-free/7508090999.html
2022-07-12 18:05, (eastside),Seize the Day! Find Your New Home at Nightingale,2899,,902.0,https://seattle.craigslist.org/est/apa/d/redmond-seize-the-day-find-your-new/7508090792.html
2022-07-12 18:05," (604 E Union St, Seattle, WA)","Spacious Closets, Extra Storage, Fur Baby Friendly",1400,,538.0,https://seattle.craigslist.org/see/apa/d/seattle-spacious-closets-extra-storage/7499002095.html
2022-07-12 18:05, (Everett),"Bright & Spacious Home, Incredible Views!",2050,1,603.0,https://seattle.craigslist.org/sno/apa/d/everett-bright-spacious-home-incredible/7508090672.html
2022-07-12 18:04, (eastside),"24-hour fitness center, Conference room with Wi-Fi, Washer and dryer",1889,1,873.0,https://seattle.craigslist.org/est/apa/d/kirkland-24-hour-fitness-center/7508088153.html
